Collection;Auteurs;Année;Année de soutenance;Titre;Titre journal;Année;Volume;Issue;Editeur scientifique;Titre ouvrage;Titre du volume;Editeur revue;Volume, Issue, Pages;ISBN;Titre conférence;Commentaire;Date congrès;Ville;Pays;Patent n°;Date de publication;Type de rapport;N°;Organisme de délivrance;Pages;Date de publication;Directeur de thèse;Université de soutenance;Année de soutenance;Organisme de délivrance;DOI;NNT;Pubmed;Référence;ArXiv;Description;Voir aussi;Réf. HAL;Rang HCERES;Rang CNRS
CREM-MEF - 89 ;Lenormand Gaëlle, Poulard Benjamin, Touchais Lionel;2012;;Les IAS/IFRS;Revue Française de Gestion;;;;;;;; vol 3 ,n° 222, pp. 55-66;;;;;;;;;;;;;;;;;;10.3166/RFG.222.55-66;;;;;;;;C;4;
CREM-MEF - 90 ;Lilti Jean-Jacques, Elbadraoui Khalid, M'zali Bouchra, Shalchian Homayoon;2012;;On the performance of socially responsible investing : further evidence;Bankers Markets & Investors;;;;;;;; ,n° 118, pp. 30-42;;;;;;;;;;;;;;;;;;;;;;;;;;;
CREM-MEF - 91 ;Lilti Jean-Jacques, Elbadraoui Khalid;2012;;The long-run operating performance of canadian convertible debt issuers : trends and explanatory factors;International Journal of Business;;;;;;;; vol 17 ,n° 3, pp. 299-324;;;;;;;;;;;;;;;;;;;;;;;;;;;E;
CREM-EIEC - 103 ;Lohéac Youenn, Combris Pierre, Issanchou Sylvie;2012;;Information nutritionnelle, choix et caractéristiques des consommateurs;Revue Française d'Economie;;;;;;;; vol XXVI ,n° 3, pp. 29-68;;;;;;;;;;;;;;;;;;;;;;;;;;;
CREM-EPCS - 106 ;Losa Fabio Beniamino, Bigotta Maurizio, Stephani Eric, Ritschard Gilbert;2012;;Trajectoires des chômeurs de longue durée en Suisse – une analyse de données AVS/AI;Sécurité sociale CHSS;;;;;;;; vol 4, pp. 224-228;;;;;;;;;;;;;;;;;;;;;;;;;;;
CREM-MEF - 92 ;Louhichi Waël;2012;;Does trading activity contain information to predict stock returns ? Evidence from Euronext Paris;Applied Financial Economics;;;;;;;; vol 22 ,n° 8, pp. 625-632;;;;;;;;;;;;;;;;;;10.1080/09603107.2011.621879;;;;;;;;C;4;
CREM-MEF - 93 ;Louhichi Waël;2012;;L'asymétrie informationnelle autour des annonces de bénéfices : le cas du marché français;La Revue des Sciences de Gestion;;;;;;;; vol 2 ,n° 254, pp. 49-57;;;;;;;;;;;;;;;;;;;;;;;;;;;
CREM-EIEC - 104 ;Lévy-Garboua Louis, Maafi Hela, Masclet David, Terracol Antoine;2012;;Risk aversion and framing effects;Experimental Economics;;;;;;;; vol 15 ,n° 1, pp. 128-144;;;;;;;;;;;;;;;;;;10.1007/s10683-011-9293-5;;;;;;;;A;1;
CREM-MEF - 94 ;L’Œillet Guillaume, Licheron Julien;2012;;How does the European Central Bank react to oil prices?;Economics Letters;;;;;;;; vol 116 ,n° 3, pp. 445-447;;;;;;;;;;;;;;;;;;10.1016/j.econlet.2012.04.035;;;;;;;;B;3;
CREM-MM - 111 ;Mandard Matthieu;2012;;L'influence des réseaux inter-organisationnels sur les partenariats d'entreprises;Management & Avenir;;;;;;;; vol 1 ,n° 51, pp. 99-115;;;;;;;;;;;;;;;;;;;;;;;;;;C;
CREM-MM - 112 ;Mandard Matthieu;2012;;Théorie du contrat relationnel et gouvernance des relations interentreprises;Gérer et Comprendre. Annales des Mines;;;;;;;; ,n° 109, pp. 13-22;;;;;;;;;;;;;;;;;;;;;;;;;;C;4;
CREM-MM - 113 ;Martin Dominique, Poilpot-Rocaboy Gwénaëlle;2012;;Chronique - La recherche en GRH : diagnostic et perspectives d'évolution à partir du 21e congrès de l'AGRH;Revue de Gestion des Ressources Humaines;;;;;;;; ,n° 85, pp. 1-11;;;;;;;;;;;;;;;;;;;;;;;;;;;3;
CREM-EPCS - 107 ;Merlin Vincent, Bervoets Sebastian;2012;;Gerrymander-proof representative democracies;International Journal of Game Theory;;;;;;;; vol 41, pp. 473-488;;;;;;;;;;;;;;;;;;10.1007/s00182-011-0298-2;;;;;;;;A;2;
CREM-EPCS - 108 ;Merlin Vincent, Fleurbaey Marc, Lepelley Dominique;2012;;Introduction to the special issue on new developments in social choice and welfare theories;Social Choice and Welfare;;;;;;;; vol 39 ,n° 2-3, pp. 253-257;;;;;;;;;;;;;;;;;;10.1007/s00355-012-0678-y;;;;;;;;A;1;
CREM-EIEC - 105 ;Moysan-Louazel Anne, Dietrich Anne;2012;;Conflits de territoire dans la profession d'expert-comptable;Revue Economique;;;;;;;; vol 1 ,n° 9, pp. 227-245;;;;;;;;;;;;;;;;;;10.3917/rfse.009.0227;;;;;;;;;
CREM-MEF - 95 ;Navatte Patrick, Bouzgarrou Houssam;2012;;Short term wealth creation sustainability of French acquirers of unlisted versus listed firms;Bankers, markets and investors;;;;;;;; vol 121, pp. 47-58;;;;;;;;;;;;;;;;;;;;;;;;;;;
CREM-EPCS - 109 ;Ortmann Andreas, Walraevens Benoît;2012;;Adam Smith, Philosopher and Man of the World;History of Economic Ideas;;;;;;;; vol 20 ,n° 1, pp. 185-191;;;;;;;;;;;;;;;;;;;;;;;;;;;3;
CREM-EPCS - 110 ;Padovano Fabio;2012;;Are we witnessing a paradigm shift in the analysis of political competition?;Public Choice;;;;;;;; vol 156 ,n° 3-4, pp. 631-651;;;;;;;;;;;;;;;;;;10.1007/s11127-012-9920-5;;;;;;;;A;1;
CREM-EPCS - 111 ;Padovano Fabio;2012;;Fairness and decentralization : a tale of two countries;Review of Institution and Economics;;;;;;;; vol 11, pp. 157-193;;;;;;;;;;;;;;;;;;;;;;;;;;;0;
CREM-EPCS - 112 ;Padovano Fabio;2012;;The drivers of interregional policy choices: Evidence from Italy;European Journal of Political Economy;;;;;;;; vol 28 ,n° 3, pp. 324-340;;;;;;;;;;;;;;;;;;10.1016/j.ejpoleco.2012.01.003;;;;;;;;B;3;
CREM-MEF - 96 ;Pentecôte Jean-Sébastien, Poutineau Jean-Christophe, Rondeau Fabien;2012;;Marge extensive du commerce et synchronisation des cycles;Revue Economique;;;;;;;; vol 63 ,n° 3, pp. 523-534;;;;;;;;;;;;;;;;;;;;;;;;;;;
CREM-EIEC - 106 ;Peretti-Watel Patrick, L'haridon Olivier, Seror Valérie;2012;;Responses to increasing cigarette prices in France: How did persistent smokers react?;Health Policy;;;;;;;; ,n° 106, pp. 169-176;;;;;;;;;;;;;;;;;;10.1016/j.healthpol.2012.03.016;;;;;;;;A;2;
CREM-MM - 114 ;Perrigot Rozenn, Kacker Manish, Basset Guy, Cliquet Gérard;2012;;Antecedents of early adoption and use of social networks for stakeholder communications: Evidence from franchising;Journal of Small Business Management;;;;;;;; ,n° 50, pp. 539-565;;;;;;;;;;;;;;;;;;;;;;;;;;A;2;
CREM-MM - 115 ;Perrigot Rozenn, Herrbach Olivier;2012;;The plural form from the inside A study of franchisee perception of company-owned outlets within their network;International Journal of Retail and Distribution Management;;;;;;;; vol 40 ,n° 7, pp. 544-563;;;;;;;;;;;;;;;;;;10.1108/09590551211239855;;;;;;;;B;3;
CREM-MM - 116 ;Pijoan Natacha, Poilpot-Rocaboy Gwénaëlle, Chevance Alain;2012;;Coopérations intergénérationnelles : Quels outils mobilisés pour quels objectifs ?;La Revue des Sciences de Gestion;;;;;;;; vol 1 ,n° 253, pp. 69-78;;;;;;;;;;;;;;;;;;;;;;;;;;;
CREM-MM - 117 ;Pijoan Natacha, Poilpot-Rocaboy Gwénaëlle;2012;;La tutoria como instrumento de solidaridad intergeneracional;Arxius de ciències socials;;;;;;;; ,n° 26, pp. 73-83;;;;;;;;;;;;;;;;;;;;;;;;;;;0;
CREM-MM - 118 ;Poilpot-Rocaboy Gwénaëlle, Pijoan Natacha, Chevance Alain;2012;;La formation des salariés âgés : accords et plans d'actions seniors;Éducation permanente;;;;;;;; vol 191 ,n° 2, pp. 67-84;;;;;;;;;;;;;;;;;;;;;;;;;;;0;
CREM-MEF - 97 ;Pommier Sébastien, Rondeau Fabien;2012;;Factors of R&D spillovers and European integration;Economics Bulletin;;;;;;;; vol 32 ,n° 3, pp. 1970-1977;;;;;;;;;;;;;;;;;;;;;;;;;;B;3;
CREM-EIEC - 107 ;Pénard Thierry, Poussing Nicolas, Zomo Yebe Gabriel, Nsi Ella Philémon;2012;;Comparing the determinants of Internet and cell phone use in Africa: Evidence from Gabon;Communications and Strategies;;;;;;;; vol 86 ,n° 2, pp. 65-83;;;;;;;;;;;;;;;;;;;;;;;;;;;4;
CREM-EIEC - 108 ;Renault Michel;2012;;Book review : Dire ce à quoi nous tenons et en prendre soin. John Dewey, la formation des valeurs, Paris, la Découverte, Coll. " les empêcheurs de penser en rond ", 2011, 238 p.;Revue Française de Socio-Economie;;;;;;;; vol 1 ,n° 9, pp. 247-253;;;;;;;;;;;;;;;;;;10.3917/rfse.009.0247;;;;;;;;;
CREM-MEF - 98 ;Renou-Maissant Patricia;2012;;Toward the integration of European natural gasmarkets: A time-varying approach;Energy Policy;;;;;;;; ,n° 51, pp. 779-790;;;;;;;;;;;;;;;;;;;;;;;;;;A;2;
CREM-MEF - 99 ;Revelli Christophe, Viviani Jean-Laurent;2012;;Performance financière de l'investissement socialement responsable (ISR) : une méta-analyse;Finance Contrôle Stratégie;;;;;;;; vol 15 ,n° 4revue électronique;;;;;;;;;;;;;;;;;;;;;;;;;;B;3;
CREM-MM - 119 ;Ruiller Caroline;2012;;Le caractère socio-émotionnel des relations de soutien social à l'hôpital;Management & Avenir;;;;;;;; ,n° 52, pp. 15-34;;;;;;;;;;;;;;;;;;10.3917/mav.052.0015;;;;;;;;C;
CREM-EPCS - 113 ;Samba Zitou Raïsa-Juvette, Adli Rhonya;2012;;Quasi stable outcomes in the assignment game;Theory and Decision;;;;;;;; vol 72 ,n° 3, pp. 323-340;;;;;;;;;;;;;;;;;;10.1007/s11238-011-9288-x;;;;;;;;A;2;
CREM-MM - 120 ;Schmidt Céline, Robert-Demontrond Philippe;2012;;Territoire et mobilité géographique infranationale. Étude des représentations et des trajectoires des salariés;Revue Française de Gestion;;;;;;;; vol 38 ,n° 226, pp. 107-120;;;;;;;;;;;;;;;;;;10.3166/rfg.226.107-120;;;;;;;;C;4;
CREM-EPCS - 114 ;Tarroux Benoît;2012;;Are equalization payments making Canadians better off? A two-dimensional dominance answer;The Journal of Economic Inequality;;;;;;;; vol 10, pp. 19-44;;;;;;;;;;;;;;;;;;10.1007/s10888-010-9152-1;;;;;;;;;
CREM-EPCS - 115 ;Valognes Fabrice, Ferrer Hélène, Owen Guillermo;2012;;Stable syndicates of factor owners and distribution of social output: a Shapley value approach;Social Choice and Welfare;;;;;;;; vol 39, pp. 553-565;;;;;;;;;;;;;;;;;;10.1007/s00355-011-0622-6;;;;;;;;A;1;
CREM-EPCS - 116 ;Walraevens Benoît;2012;;A la recherche du spectateur impartial perdu;Cahiers d'Economie Politique;;;;;;;;, pp. 257-266;;;;;;;;;;;;;;;;;;;;;;;;;;;
CREM-EPCS - 117 ;Walraevens Benoît;2012;;Growth and progress in Adam Smith's thought;Journal of the History of Economic Thought;;;;;;;; vol 34 ,n° 1, pp. 131-132;;;;;;;;;;;;;;;;;;10.1017/S1053837212000053;;;;;;;;A;2;
CREM-MM - 121 ;Xu-Priour Dong Ling, Cliquet Gérard, Guoqun Fu;2012;;The combined influence of time pressure and time orientation on consumers' multichannel choice: evidence from China;International Review of Retail, Distribution and Consumer Research;;;;;;;; vol 22 ,n° 5, pp. 529-546;;;;;;;;;;;;;;;;;;10.1080/09593969.2012.711256;;;;;;;;;0;
CREM-EPCS - 118 ;Ziad Abderrahmane, Bhattacharya Anindya;2012;;On credible coalitional deviations by prudent players;Social Choice and Welfare;;;;;;;; vol 39 ,n° 2-3, pp. 537-552;;;;;;;;;;;;;;;;;;10.1007/s00355-011-0647-x;;;;;;;;A;1;
;Aguilera Anne, Lethiais Virginie;2011;;Transmission des connaissances dans les relations de coopération inter-entreprises : TIC versus face à face;Revue d'Economie Régionale & Urbaine;;;;;;;; ,n° 2, pp. 269-293;;;;;;;;;;;;;;;;;;10.3917/reru.112.0269;;;;;;;;;
CREM-MEF - 100 ;Aubert François, Louhichi Waël;2011;;L'impact informationnel de l'alerte aux résultats sur l'annonce du résultat annuel;Comptabilité, Contrôle, Audit;;;;;;;; vol 17 ,n° 2, pp. 11-36;;;;;;;;;;;;;;;;;;;;;;;;;;;
CREM-EPCS - 119 ;Auray Stéphane, Mariotti Thomas, Moizeau Fabien;2011;;Dynamic regulation of quality;The RAND Journal of Economics;;;;;;;; vol 42 ,n° 2, pp. 246-265;;;;;;;;;;;;;;;;;;10.1111/j.1756-2171.2011.00132.x/pdf;;;;;;;;;
CREM-EPCS - 120 ;Autant-Bernard Corinne, Massard Nadine, Guironnet Jean-Pascal;2011;;Agglomeration and social return to R&D: Evidence from French plant productivity changes;International Journal of Production Economics;;;;;;;; vol 132 ,n° 1, pp. 34-42;;;;;;;;;;;;;;;;;;10.1016/j.ijpe.2011.02.028;;;;;;;;A;1;
CREM-EIEC - 109 ;Avenel Eric, De Muizon Gildas, Daley Nathalie;2011;;La malédiction du vainqueur : Peut-on en tenir compte dans l'analyse des effets unilatéraux ?;Concurrences -  revue des droits de la concurrence;;;;;;;; ,n° 3, pp. 42-52;;;;;;;;;;;;;;;;;;;;;;;;;;C;
CREM-EIEC - 110 ;Avenel Eric, Daley Nathalie, De Muizon Gildas;2011;;Position dominante collective : Dépasser les critères Airtours en matière de contrôle a posteriori des pratiques anticoncurrentielles;Concurrences -  revue des droits de la concurrence;;;;;;;; ,n° 4, pp. 41-50;;;;;;;;;;;;;;;;;;;;;;;;;;C;
CREM-EPCS - 121 ;Barros Carlos, Guironnet Jean-Pascal, Peypoch Nicolas;2011;;Productivity growth and biased technical change in French higher education;Economic Modelling;;;;;;;; ,n° 28, pp. 641-646;;;;;;;;;;;;;;;;;;10.1016/j.econmod.2010.06.005;;;;;;;;A;2;
CREM-EIEC - 111 ;Baslé Maurice, Huaulme Maud;2011;;Comparing outcomes profiles of public programmes with ELECTRE assistance instead of observing evolution of a synthetic impact index: illustration of the benefits of a multicriteria evaluation approach;International Journal of Multicriteria Decision Making;;;;;;;; vol 1 ,n° 4, pp. 394-406;;;;;;;;;;;;;;;;;;10.1504/IJMCDM.2011.043555;;;;;;;;;0;
CREM-MM - 122 ;Basso Frédéric, Oullier Olivier;2011;;Smokers Are Suckers: Should Incongruous Metaphors Be Used in Public Health Prevention?;American Journal of Public Health,;;;;;;;; vol 101 ,n° 2, pp. 203-204;;;;;;;;;;;;;;;;;;;;;;;;;;;
CREM-EPCS - 122 ;Baujard Antoinette;2011;;De l'économie du bien-être à la théorie de l'équité;Les Cahiers français : documents d'actualité;;;;;;;; vol La pensée économique contemporaine ,n° 363, pp. 82-87;;;;;;;;;;;;;;;;;;;;;;;;;;;
CREM-EPCS - 123 ;Baujard Antoinette, Igersheim Herrade, Senné Thomas;2011;;The Political Supply in the 2007 French Presidential Elections : An Analysis Based on Experimental Data;Annales d'Economie et Statistiques;;;;;;;; vol 101/102, pp. 149-186;;;;;;;;;;;;;;;;;;;;;;;;;;;
CREM-EPCS - 124 ;Baujard Antoinette, Merlin Vincent;2011;;Vote, pouvoir et modes de scrutin dans les sociétés cotées: l'éclairage des théories mathématiques du vote;Revue trimestrielle de Droit Financier;;;;;;;; vol 4 ,n° Novembre 2011, pp. 20-31;;;;;;;;;;;;;;;;;;;;;;;;;;;0;
CREM-EIEC - 112 ;Ben Youssef Adel, Le Texier Thomas, Ragni Ludovic;2011;;Bridging the Learning Gap in the Market for Higher Education: E-learning and Public Subside;Economic Analysis (Belgrade);;;;;;;; vol 3-4 ,n° 45, pp. 1-11;;;;;;;;;;;;;;;;;;;;;;;;;;;
CREM-MEF - 101 ;Benkraiem Ramzi, Le Roy Frédéric, Louhichi Waël;2011;;Sporting performances and the volatility of listed football clubs;International Journal of Sport Finance;;;;;;;; vol 6 ,n° 4, pp. 283-297;;;;;;;;;;;;;;;;;;;;;;;;;;;E;
CREM-EPCS - 125 ;Bigotta Maurizio, Losa Fabio Beniamino, Ritschard Gilbert, Stephani Eric;2011;;Le parcours professionnel des chômeurs de longue durée;La Vie économique CH;;;;;;;; vol 7/8, pp. 51-54;;;;;;;;;;;;;;;;;;;;;;;;;;;
CREM-EPCS - 126 ;Binet Marie-Estelle;2011;;Estimer la fonction de dépenses publiques locales avec et sans mesure du prix : les apports du système linéaire de dépenses;Revue d Economie Politique;;;;;;;; ,n° 121, pp. 583-605;;;;;;;;;;;;;;;;;;;;;;;;;;B;
CREM-EPCS - 127 ;Binet Marie-Estelle, Facchini François, Koning Martin;2011;;Les déterminants de la dynamique entrepreneuriale dans les régions françaises;Canadian Journal of Regional Science;;;;;;;; vol 33 ,n° Special Issue, pp. 73-88;;;;;;;;;;;;;;;;;;;;;;;;;;;3;
CREM-EIEC - 113 ;Bonnet Jean, Brau Thomas, Cadet Bernard, Guijarro Madrid Antonia;2011;;Making students sensitive to entrepreneurship;Journal of Social Management;;;;;;;; vol 9 ,n° 1, pp. 55-80;;;;;;;;;;;;;;;;;;;;;;;;;;;0;
CREM-EIEC - 114 ;Bougherara Douadia, Denant-Boèmont Laurent, Masclet David;2011;;Cooperation and framing effects in provision point mechanisms: Experimental evidence;Ecological Economics;;;;;;;; vol 70 ,n° 6, pp. 1200-1210;;;;;;;;;;;;;;;;;;10.1016/j.ecolecon.2011.01.023;;;;;;;;A;1;
CREM-MEF - 102 ;Boussemart J.ph., Briec W., Tavera Christophe;2011;;More evidence on technological catching-up in the manufacturing sector;Applied Economics;;;;;;;; vol 43 ,n° 18, pp. 2321-2330;;;;;;;;;;;;;;;;;;10.1080/00036840903166236;;;;;;;;A;2;
CREM-EPCS - 128 ;Bunel Matthieu, L'horty Yannick;2011;;Pourquoi est-il si difficile d'évaluer les politiques publiques ?;Reflets et Perspectives de la vie économique;;;;;;;; vol L ,n° 1, pp. 23-31;;;;;;;;;;;;;;;;;;10.3917/rpve.501.0023;;;;;;;;;0;
CREM-MEF - 103 ;Cellier Alexis, Louhichi Waël;2011;;Intraday Relationship Between Market Activity And Public Announcements;The Journal of Applied Business Research;;;;;;;; vol 27 ,n° 3, pp. 55-70;;;;;;;;;;;;;;;;;;;;;;;;;;;
CREM-EPCS - 129 ;Chantreuil F., Trannoy Alain;2011;;Inequality Decomposition Values;Annales d'Economie et Statistiques;;;;;;;; vol 101/102, pp. 13-36;;;;;;;;;;;;;;;;;;;;;;;;;;;
CREM-MEF - 104 ;Charles Amélie, Darné Olivier, Fouilloux Jessica;2011;;Testing the martingale difference hypothesis in CO2 emission allowances;Economic Modelling;;;;;;;; vol 28 ,n° 1-2, pp. 27-35;;;;;;;;;;;;;;;;;;10.1016/j.econmod.2010.10.003;;;;;;;;A;2;
CREM-MEF - 105 ;Clauss Pierre;2011;;Hedge funds performance ratios adjusted to market liquidity risk1;Journal of Financial Transformation;;;;;;;; ,n° 31, pp. 133-139;;;;;;;;;;;;;;;;;;;;;;;;;;;E;
CREM-MM - 123 ;Cliquet Gérard;2011;;Las MDD en Francia : evolucion en el pasado, situacion actual y perspectivas;Distribución y Consumo;;;;;;;;, pp. 24-27;;;;;;;;;;;;;;;;;;;;;;;;;;;0;
CREM-EIEC - 115 ;Colombier Nathalie, Masclet David, Mirza Daniel, Montmarquette Claude;2011;;Global security policies against terrorism and the free riding problem: An experimental approach;Journal of Public Economic Theory;;;;;;;; vol 13 ,n° 5, pp. 755-790;;;;;;;;;;;;;;;;;;10.1111/j.1467-9779.2011.01519.x;;;;;;;;A;2;
CREM-EIEC - 116 ;Danau Daniel;2011;;Capacity Investment with Dynamic Operation and Intertemporal Budget Balance;Journal of Public Economic Theory;;;;;;;; vol 13 ,n° 2, pp. 217-253;;;;;;;;;;;;;;;;;;10.1111/j.1467-9779.2011.01499.x;;;;;;;;A;2;
CREM-EIEC - 117 ;Darmon Eric, Le Texier Thomas, Torre Dominique;2011;;Proprietary or Open Source Software? Winner-Takes-All Competition, Partial Adoption and Efficiency;Revue d'économie industrielle;;;;;;;; vol 136, pp. 109-140;;;;;;;;;;;;;;;;;;;;;;;;;;B;
CREM-MEF - 106 ;Darolles Serge, Mero Gulten;2011;;Hedge Fund Returns and Factor Models: A Cross-Sectional Approach;Bankers, Markets & Investors;;;;;;;; vol 112, pp. 34-53;;;;;;;;;;;;;;;;;;;;;;;;;;;
CREM-MEF - 107 ;Delacour Hélène, Fouilloux Jessica, Liarte Sébastien;2011;;Toutes les recherches doivent-elles être menées ? Performativité, surpâturage et responsabilité du chercheur en finance;Revue Française de Gestion;;;;;;;; vol 7 ,n° 216, pp. 75-92;;;;;;;;;;;;;;;;;;;;;;;;;;C;4;
CREM-EIEC - 118 ;Denant-Boèmont Laurent, Masclet David, Noussair Charles;2011;;Announcement, observation, and honesty in the voluntary contributions game;Pacific Economic Review;;;;;;;; vol 16 ,n° 2, pp. 207-228;;;;;;;;;;;;;;;;;;10.1111/j.1468-0106.2011.00543.x;;;;;;;;B;3;
CREM-EIEC - 119 ;Donfouet Hermann Pythagore Pierre, Essombé Jean-Roger Edimo, Mahieu Pierre-Alexandre, Malin Éric;2011;;Social capital and willingness-to-pay for community-based health insurance in rural Cameroon;Global Journal of Health Science;;;;;;;; vol 3 ,n° 1, pp. 142-149;;;;;;;;;;;;;;;;;;;;;;;;;;;0;
CREM-EIEC - 120 ;Donfouet Hermann Pythagore Pierre, Makaudze Ephias, Mahieu Pierre-Alexandre, Malin Éric;2011;;The determinants of the willingness-to-pay for community-based prepayment scheme in rural Cameroon;International Journal of Health Care Finance and Economics;;;;;;;; ,n° 11, pp. 209-220;;;;;;;;;;;;;;;;;;10.1007/s10754-011-9097-3;;;;;;;;A;2;
CREM-EPCS - 130 ;Dupuis Jean-Marc, El Moudden Claire, Hammouda Nacer Eddine, Pétron Anne, Ben Braham Mehdi, Dkhissi Ilham;2011;;L'impact des systèmes de retraite sur le niveau de vie des personnes âgées au Maghreb;Economie et Statistique;;;;;;;; ,n° 441-442, pp. 205-224;;;;;;;;;;;;;;;;;;;;;;;;;;;3;
CREM-MM - 124 ;El Akremi Assâad, Karim Mignonac, Perrigot Rozenn;2011;;Opportunistic behaviors in franchise chains: the role of cohesion among franchisees;Strategic Management Journal;;;;;;;; vol 32 ,n° 9, pp. 930-948;;;;;;;;;;;;;;;;;;10.1002/smj.912;;;;;;;;A;1;
CREM-EPCS - 131 ;Fanelli Angelo, Flammini Michele, Mango Domenico, Melideo Giovanna, Moscardelli Luca;2011;;Experimental evaluations of algorithms for IP table minimization;Journal of Interconnection Networks;;;;;;;; vol 12 ,n° 4, pp. 299-318;;;;;;;;;;;;;;;;;;10.1142/S0219265911003015;;;;;;;;;0;
CREM-EPCS - 132 ;Fleurbaey Marc, Lepelley Dominique, Merlin Vincent;2011;;Introduction to the Special Issue on New Developments in Social Choice and Welfare Theories;Annals of Economics and Statistics;;;;;;;; vol 101-102, pp. 7-11;;;;;;;;;;;;;;;;;;;;;;;;;;;2;
CREM-EIEC - 121 ;Franck Bernard, Owen Robert F.;2011;;Formation à l'étranger, fuite des cerveaux et bien-être national : Enjeux et paradoxes dans une perspective microéconomique;Revue d Economie Politique;;;;;;;; vol 121 ,n° 2, pp. 233-257;;;;;;;;;;;;;;;;;;10.3917/redp.212.0233;;;;;;;;B;
CREM-MM - 125 ;Gallopel Karine, Le Gall-Ely Marine, Rieunier Sophie;2011;;Faut-il apposer des avertissements sanitaires visuels sur les paquets decigarettes ? Les conditions de l'efficacité.;Décisions Marketing;;;;;;;; ,n° 62, pp. 19-29;;;;;;;;;;;;;;;;;;;;;;;;;;B;4;
CREM-MM - 126 ;Gallopel Karine, Gabriel Patrick, Le Gall-Ely Marine, Rieunier Sophie, Urien Bertrand;2011;;The use of visual warnings in social marketing: The case of tobacco;Journal of Business Research;;;;;;;; ,n° 64, pp. 7-11;;;;;;;;;;;;;;;;;;;;;;;;;;A;2;
CREM-MM - 127 ;Gallopel-Morvan Karine, Béguinot Emmanuelle, Eker Figen, Martinet Yves, Hammond David;2011;;Perception de l'efficacité des paquets de cigarettes standardisés.;Bulletin Epidémiologique Hebdomadaire - BEH;;;;;;;; ,n° 20-21, pp. 244-247;;;;;;;;;;;;;;;;;;;;;;;;;;;
CREM-EIEC - 122 ;Gaussens Olivier, Lecostey Sophie, Simon Geoffray;2011;;Intégration internationale et concurrence effective : quelques apports de la théorie de l'oligopole;Actualite Economique;;;;;;;; vol 87 ,n° 4, pp. 481-502;;;;;;;;;;;;;;;;;;10.7202/1012568ar;;;;;;;;C;
CREM-EPCS - 133 ;Gavrel Frédéric;2011;;On the efficiency of participation with vertically differentiated workers;Economics Letters;;;;;;;; ,n° 112, pp. 100-102;;;;;;;;;;;;;;;;;;10.1016/j.econlet.2011.03.035;;;;;;;;B;3;
;Gilardone Muriel;2011;;Amartya Sen's approach of justice and the world: a situated but influential approach;Indigo. Humanities Magazine for young people;;;;;;;; vol 4, pp. 36-47;;;;;;;;;;;;;;;;;;;;;;;;;;;
CREM-MM - 128 ;Gonzalez Christine, Le Gall-Ely Marine, Urbain Caroline;2011;;Generation Y'S representations of who they are and how they give;Advances in Consumer Research;;;;;;;; vol 38, pp. 673;;;;;;;;;;;;;;;;;;;;;;;;;;;H;
CREM-EIEC - 123 ;Gordah Maher, Le Texier Thomas;2011;;Aide au développement et information asymétrique : une analyse principal-agent;Région et Développement;;;;;;;; ,n° 34, pp. 163-180;;;;;;;;;;;;;;;;;;;;;;;;;;C;4;
CREM-EPCS - 134 ;Gravel Nicolas, Tarroux Benoît;2011;;Freedom-based measurement of living standard;Annals of Economics and Statistics;;;;;;;; ,n° 101/102, pp. 37-69;;;;;;;;;;;;;;;;;;;;;;;;;;;2;
CREM-EPCS - 135 ;Grolier Jacques;2011;;Analyse coût-efficacité : Aide au dimensionnement d'un service lit-porte ou d'un pool d'infirmières;Finances hospitalières;;;;;;;; ,n° 49 et 50, pp. 8-16 et 6-11;;;;;;;;;;;;;;;;;;;;;;;;;;;0;
CREM-EPCS - 136 ;Grolier Jacques;2011;;Outils d'analyse de l'évolution des charges de personnels;Santé RH;;;;;;;; ,n° 24 et 25, pp. 13-18 et 9-15;;;;;;;;;;;;;;;;;;;;;;;;;;;0;
CREM-EPCS - 137 ;Guillotreau Patrice, Salladarré Frédéric, Dewals Patrice, Dagorn Laurent;2011;;Fishing tuna around Fish Aggregating Devices (FADs) vs free swimming schools: Skipper decision and other determining factors;Fisheries Research;;;;;;;; vol 109 ,n° 2-3, pp. 234-242;;;;;;;;;;;;;;;;;;;;;;;;;;;0;
CREM-EPCS - 138 ;Heresbach Denis, Josselin Jean-Michel, Et Alii .;2011;;Accuracy of computed tomographic colonography in a nationwide multicentre trial, and its relation to radiologist expertise;Gut;;;;;;;; vol 60 ,n° 5, pp. 658-665;;;;;;;;;;;;;;;;;;10.1136/gut.2010.225623;;;;;;;;;
CREM-MEF - 108 ;Khan Haroon, Hassairi Slim, Viviani Jean-Laurent;2011;;Herd behavior and market stress: The case of four European countries;International Business Research;;;;;;;; vol 4 ,n° 3, pp. 53-67;;;;;;;;;;;;;;;;;;10.5539/ibr.v4n3p53;;;;;;;;;E;
CREM-MM - 129 ;Kövesi K., Robert Demontrond Ph.;2011;;The Effect of Switching Barriers on Customer Commitment: an Application to Mobile Phone Services;Journal of Marketing Trends;;;;;;;; vol 1 ,n° 6, pp. 7-21;;;;;;;;;;;;;;;;;;;;;;;;;;;0;
CREM-EIEC - 124 ;Le Goff - Pronost Myriam, Picard Robert;2011;;Need for ICTs assessment in the health sector: A multidimensional framework;Communications and Strategies;;;;;;;; vol 83 ,n° 3, pp. 87-108;;;;;;;;;;;;;;;;;;;;;;;;;;;4;
CREM-EIEC - 125 ;Le Texier Thomas, Gordah Maher;2011;;Peer‐to‐peer networks and complementary goods: The impact of openness and innovation on profitable piracy;Economic Analysis;;;;;;;; vol 44 ,n° 1-2, pp. 15-37;;;;;;;;;;;;;;;;;;;;;;;;;;;E;
CREM-EPCS - 139 ;Lepelley Dominique, Vidu Laurent;2011;;Measurement of Voting Power: a Preliminary Analysis of an Historical French Electoral Episode Through Simulations;Annales d'Economie et Statistiques;;;;;;;; vol 101/102, pp. 71-85;;;;;;;;;;;;;;;;;;;;;;;;;;;
CREM-EPCS - 140 ;Lepelley Dominique, Merlin Vincent, Rouet Jean-Louis;2011;;Three ways to compute accurately the probability of the referendum paradox;Mathematical Social Sciences;;;;;;;; vol 62 ,n° 1, pp. 28-33;;;;;;;;;;;;;;;;;;10.1016/j.mathsocsci.2011.04.006;;;;;;;;A;2;
CREM-EPCS - 141 ;Leprince Matthieu;2011;;Intégration fiscale et « financière » : d’où viennent les différences entre intercommunalités à fiscalité propre ?;Pouvoirs locaux (ISSN : 0998-8289);;;;;;;; vol 88, pp. 43-46;;;;;;;;;;;;;;;;;;;;;;;;;;;
CREM-EPCS - 142 ;Losa Fabio Beniamino, Soldini Emiliano;2011;;The similar faces of Swiss working Poor. An empirical analysis across Swiss regions using logistic regression and classification trees.;Swiss Journal of Economics and Statistics;;;;;;;; vol 147 ,n° 1, pp. 17-44;;;;;;;;;;;;;;;;;;;;;;;;;;;
