Auteurs;Année;Année de soutenance;Titre;Titre journal;Année;Volume;Issue;Editeur scientifique;Titre ouvrage;Titre du volume;Editeur revue;Volume, Issue, Pages;ISBN;Titre conférence;Commentaire;Date congrès;Ville;Pays;Patent n°;Date de publication;Type de rapport;N°;Organisme de délivrance;Pages;Date de publication;Directeur de thèse;Université de soutenance;Année de soutenance;Organisme de délivrance;DOI;NNT;Pubmed;Référence;ArXiv;Description;Voir aussi;Réf. HAL;Rang HCERES;Rang CNRS
Naveed Ul Haque M., Flament J., Lamberton P., Mustiere C., Lemosquet-Simon S.;2015;;Changes in mammary metabolism in response to the provision of an “Ideal” amino acid profile at two levels of metabolizable protein supplies in dairy cows: consequences on efficiency;Journal of Dairy Science;;98;6;;;;;3951-3968;;;;;;;;;;;;;;;;;10.3168/jds.2014-8656;;;;;;;;;
Nesseler N., Launey Y., Aninat C., White J., Corlu A., Mallédant Y., Seguin P.;2015;;La dysfonction hépatique au cours du choc septique est associée à la mortalité a long terme;Anesthésie & Réanimation;;1, Supplement 1;;;;;;A218;;;;;;;;;;;;;;;;;10.1016/j.anrea.2015.07.333;;;;;;;;;
Noblet J., Dubois S., Lasnier J., Warpechowski M., Dimon P., Carré B., Van Milgen J., Labussière E.;2015;;Fasting heat production and metabolic BW in group-housed broilers;animal;;9;7;;;;;1138-1144;;;;;;;;;;;;;;;;;10.1017/S1751731115000403;;25772629;;;;;;;
Parois S., Prunier A., Mercat M.-J., Merlot E., Larzul C.;2015;;Genetic relationships between measures of sexual development, boar taint, health and aggressiveness in pigs;Journal of Animal Science;;;;;;;;np;;;;;;;;;;;;;;;;;10.2527/jas2014-8290;;;;;;;;;
Perrichet H., Gouëzec H., Beloeil H.;2015;;Pertinence d’utilisation des produits sanguins labiles d’un dépôt de sang d’urgence vitale;Transfusion Clinique et Biologique;;22;4;;;;;222-223;;;;;;;;;;;;;;;;;10.1016/j.tracli.2015.06.027;;;;;;;;;
Perruchot M.-H., Lefaucheur L., Louveau I., Mobuchon L., Palin M.-F., Farmer C., Gondret F.;2015;;Delayed muscle development in small pig fetuses around birth cannot be rectified by maternal early feed restriction and subsequent overfeeding during gestation;animal;;;;;;;;Sous presse;;;;;;;;;;;;;;;;;10.1017/S1751731115001202;;;;;;;;;
Peyraud J.-L., Richard G., Gascuel C.;2015;;Boucler les grands cycles biogéochimiques;Innovations Agronomiques;;43;;;;;;177-186;;;;;;;;;;;;;;;;;;;;;;;;;;
Picard B., Lebret B., Cassar-Malek I., Liaubet L., Berri C., Duval E., Lefèvre F., Hocquette J.-F., Renand G.;2015;;Des marqueurs génomiques au service de la qualité de la viande;INRA Productions Animales;;28;2;;;;;183-195;;;;;;;;;;;;;;;;;;;;;;;;;;
Pricope D., Deneuville E., Frain S., Chevrier S., Belaz S., Roussey M., Gangneux J.-P.;2015;;Exposition domiciliaire aux moisissures : quel impact sur le statut aspergillaire du patient atteint de mucoviscidose ?;Journal de Mycologie Médicale;;25;2;;;;;136-142;;;;;;;;;;;;;;;;;10.1016/j.mycmed.2015.03.005;;25910711;;;;;;;
Provost C., Tasseel-Ponche S., Lozeron P., Bonan I., Yelnik A.;2015;;Sensibilité visuelle et proprioceptive de la posture debout des patients atteints de polyradiculonévrites inflammatoires démyélinisantes chroniques (PIDC);Neurophysiologie Clinique/Clinical Neurophysiology;;45;4–5;;;;;398;;;;;;;;;;;;;;;;;10.1016/j.neucli.2015.10.026;;;;;;;;;
Ravel C., Kazdar N., Leveque J.;2015;;Fertilité et insuffisance ovarienne : de nouveaux traitements en perspective ?;Gynécologie Obstétrique and Fertilité;;44;1;;;;;56-62;;;;;;;;;;;;;;;;;10.1016/j.gyobfe.2015.10.008;;26597936;;;;;;;
Rescan P.-Y., Ralliere C., Lebret V., Fretaud M.;2015;;Analysis of muscle fibre input dynamics using a [i]myog[/i]: GFP transgenic trout model;Journal of Experimental Biology;;218;;;;;;1137-1142;;;;;;;;;;;;;;;;;10.1242/jeb.113704;;25657208;;;;;;;
Rioux-Leclercq N., Comperat E.;2015;;Révision du score de Gleason : un système de grading plus adapté au patient et au clinicien (éditorial) [The Gleason score: A more accurate grading system];Annales de Pathologie;;;;;;;;;;;;;;;;;;;;;;;;;10.1016/j.annpat.2015.09.003;;;;;;;;;
Rosenthal E., Fougerou-Leurent C., Renault A., Morlat P., Naqvi A., Teicher E., Lacombe K., Aumaitre H., Bailly F., Bellissant E., Bourlière M., Molina J. M.;2015;;Ledipasvir/sofosbuvir chez les patients co-infectés par le VIH et un VHC de génotype 1 prétraités par un inhibiteur de la protéase NS3/A4 du VHC (étude ANRS HC31 SOFTRIH);Revue de Médecine Interne;;36, Supplement 2;;;;;;A81;;;;;;;;;;;;;;;;;10.1016/j.revmed.2015.10.309;;;;;;;;;
Rouquette S., Cherrière F., Vagneur A., Godey F., Sun S., Jolivet-Gougeon A., Mesbah H., Audrain O., Bendavid C.;2015;;En reconstruction mammaire : intérêt du dépistage du portage de Staphylococcus aureus dans la prévention de l’infection du site opératoire;Annales de Chirurgie Plastique Esthétique;;60;6;;;;;490-494;;;;;;;;;;;;;;;;;10.1016/j.anplas.2015.07.007;;26321308;;;;;;;
Roux P.-F., Boitard S., Blum A., Parks B., Montagner A., Mouisel E., Djari A., Esquerre D., Désert C., Boutin M., Leroux S., Lecerf F., Duval E., Klopp C., Servin B.  et al.;2015;;Combined QTL and selective sweep mappings with coding SNP annotation and cis-eQTL analysis revealed PARK2 and JAG2 as new candidate genes for adiposity regulation.;G3;;5;;;;;;517-529;;;;;;;;;;;;;;;;;10.1534/g3.115.016865;;25653314;;;;;;;
Roux P.-F., Marthey S., Djari A., Moroldo M., Esquerre D., Estelle Fabrellas J., Klopp C., Lagarrigue S., Demeure O.;2015;;Comparison of whole-genome (13X) and capture (87X) resequencing methods for SNP and genotype callings;Animal Blood Groups and Biochemical Genetics;;46;1;;;;;82-86;;;;;;;;;;;;;;;;;10.1111/age.12248;;25515399;;;;;;;
Ryschawy J., Tichit M., Bertrand S., Allaire G., Plantureux S., Aznar O., Perrot C., Guinot C., Josien E., Lasseur J., Aubert C., Tchakérian E., Disenhaus C.;2015;;Comment évaluer les services rendus par l'élevage ? Une première approche méthodologique sur le cas de la France;INRA Productions Animales;;28;1;;;;;23-38;;;;;;;;;;;;;;;;;;;;;;;;;;
Sadoul B., Martin O., Prunet P., Friggens N.;2015;;On the use of a simple physical system analogy to study robustness features in animal sciences;PLoS ONE;;10;8;;;;;1-14;;;;;;;;;;;;;;;;;10.1371/journal.pone.0137333;;26322508;;;;;;;
Saintilan R., Brossard L., Vautier B., Sellier P., Bidanel J. P., Van Milgen J., Gilbert H.;2015;;Phenotypic and genetic relationships between growth and feed intake curves and feed efficiency and amino acid requirements in the growing pig;animal;;9;1;;;;;18-27;;;;;;;;;;;;;;;;;10.1017/S1751731114002171;;25192352;;;;;;;
Seiliez I., Froehlich J. M., Marandel L., Gabillard J.-C., Biga P. R.;2015;;Evolutionary history and epigenetic regulation of the three paralogous pax7 genes in rainbow trout;Cell and Tissue Research;;359;3;;;;;715-727;;;;;;;;;;;;;;;;;10.1007/s00441-014-2060-0;;;;;;;;;
Souberbielle J.-C., Deschênes G., Fouque D., Groussin L., Guggenbuhl P., Jean G., Linglart A., Thomas T.;2015;;Indications du dosage de la 25-hydroxyvitamine D [Recommendations for the measurement of blood 25-OH vitamin D];Annales de Biologie Clinique;;;;;;;;;;;;;;;;;;;;;;;;;10.1684/abc.2015.1107;;26711312;;;;;;;
Soumeh E. A., Van Milgen J., Sloth N. M., Corrent E., Poulsen H. D., Nørgaard J. V.;2015;;The optimum ratio of standardized ileal digestible leucine to lysine for 8 to 12 kg female pigs;Journal of Animal Science;;93;5;;;;;2218-2224;;;;;;;;;;;;;;;;;10.2527/jas2014-8699;;;;;;;;;
Soumeh E., Van Milgen J., Sloth N., Corrent E., Poulsen H., Norgaard J.;2015;;Requirement of standardized ileal digestible valine to lysine ratio for 8- to 14-kg pigs;animal;;9;8;;;;;1312-1318;;;;;;;;;;;;;;;;;10.1017/S1751731115000695;;;;;;;;;
Terlouw C., Cassar-Malek I., Picard B., Bourguet C., Deiss V., Arnould C., Berri C., Duval E., Lefèvre F., Lebret B.;2015;;Stress en élevage et à l’abattage : impacts sur les qualités des viandes;INRA Productions Animales;;28;2;;;;;169-182;;;;;;;;;;;;;;;;;;;;;;;;;;
Van Milgen J., Dourmad J.-Y.;2015;;Concept and application of ideal protein for pigs;Journal of Animal Science and Biotechnology;;6;;;;;;15;;;;;;;;;;;;;;;;;10.1186/s40104-015-0016-1;;;;;;;;;
Velasquez A., Marnet P.-G., Arias R.;2015;;Improvement in nutritional quality of fibrous food via in vitro digestion by Aspergillus niger;Ciencia e investigacion agraria;;42;1;;;;;45-55;;;;;;;;;;;;;;;;;10.4067/S0718-16202015000100005;;;;;;;;;
Vincent A., Louveau I., Gondret F., Trefeu C., Gilbert H., Lefaucheur L.;2015;;Divergent selection for residual feed intake affects the transcriptomic and proteomic profiles of pig skeletal muscle;Journal of Animal Science;;93;6;;;;;2745-2758;;;;;;;;;;;;;;;;;10.2527/jas2015-8928;;;;;;;;;
Vizziano-Cantonnet D., Mateo M., Alberro A., Barrios F., Fostier A.;2015;;17,20 beta-P and cortisol are the main in vitro metabolites of 17-hydroxy-progesterone produced by spermiating testes of Micropogonias furnieri (Desmarest, 1823) (Perciformes: Sciaenidae);Neotropical Ichthyology;;13;3;;;;;613-624;;;;;;;;;;;;;;;;;10.1590/1982-0224-20150013;;;;;;;;;
Wargelius A., Furmanek T., Montfort J., Le Cam A., Kleppe L., Juanchich A., Edvardsen R. B., Taranger G. L., Bobe J.;2015;;A comparison between egg trancriptomes of cod and salmon reveals species-specific traits in eggs for each species;Molecular reproduction and development;;82;;;;;;397-404;;;;;;;;;;;;;;;;;10.1002/mrd.22487;;25908546;;;;;;;

Auteurs;Année;Année de soutenance;Titre;Titre journal;Année;Volume;Issue;Editeur scientifique;Titre ouvrage;Titre du volume;Editeur revue;Volume, Issue, Pages;ISBN;Titre conférence;Commentaire;Date congrès;Ville;Pays;Source;Volume;Numéro;Pagination;Patent n°;Date de publication;Type de rapport;N°;Organisme de délivrance;Pages;Date de publication;Directeur de thèse;Université de soutenance;Année de soutenance;Organisme de délivrance;DOI;NNT;Pubmed;Référence;ArXiv;Description;Voir aussi;Réf. HAL;Rang HCERES;Rang CNRS
Al-Attrache H., Sharanek A., Abdel-Razzak Z., Morel I., Guillouzo A.;2015;;Differential impact of inflammation on diclofenac-induced cytotoxicity in differentiated and undifferentiated HepaRG cells;;;;;;;;;;;ABSTRACTS OF THE 51st Congress of the European Societies of Toxicology (EUROTOX);;13 septembre 2015;Porto;Portugal;;238;2, Supplement;S304;;;;;;;;;;;10.1016/j.toxlet.2015.08.871;;;;;;;;;
Allain C., Raynal J., Beck C., Delagarde R., Brocard V.;2015;;Models for predicting effects of management factors on per-cow and per-hectare pasture intake by grazing dairy cows;;;;;;;;;;;18. Symposium of the european grassland federation;;15-17 juin 2015;Wageningen;Pays-Bas;Grassland and forages in high output dairy farming systems;20;;np;;;;;;;;;;;;;;;;;;;;
Alves T. P., Lorinquer E., Edouard N.;2015;;Ammonia and greenhouse gas emissions from straw-based deep litter systems for dairy cattle fed with contrasting diets;;;;;;;;;;;International symposium on emissions of gas and dust from livestock. EMILI 2015;;24-26 mars 2015;Florianopolis;Brésil;EmiLi 2015;;;np;;;;;;;;;;;;;;;;;;;;
Antoine-Lorquin A., Lagarrigue S., Lecerf F., Nicolas J., Belleannée C.;2015;;Comparaison des cibles d’une matrice de score et d’une expression régulière. Application à la recherche de sites de fixation du facteur de transcription LXR;;;;;;;;;;;JOBIM 2015- 16e Journées Ouvertes en Biologie, Informatique et Mathématiques;;6 juillet 2015;Clermont-Ferrand;France;;;;;;;;;;;;;;;;;;;;;;;;
Assi M., Derbré F., Lefeuvre-Orfila L., Rébillard A.;2015;;OP17 - Natural antioxidants accelerate cachexia development in colon cancer;;;;;;;;;;;SFRR-E/SNFS;;Stuttgart;Allemagne;;86, Supplement 1;;S9--S10;;;;;;;;;;;10.1016/j.freeradbiomed.2015.07.044;;;;;;;;;
Audrey B., Sharanek A., Burbank M., Le Guevel R., Li R., Guillouzo A., Guguen-Guillouzo C.;2015;;Alteration of the Rho-kinase pathway activity disorganizes bile canaliculi dynamics and perturbs bile acid clearance in drug-induced cholestasis;;;;;;;;;;;ABSTRACTS OF THE 51st Congress of the European Societies of Toxicology (EUROTOX);;13 septembre 2015;Porto;Portugal;;238;2, Supplement;S303--S304;;;;;;;;;;;10.1016/j.toxlet.2015.08.870;;;;;;;;;
Baeza E., Chartrin P., Lessire M., Meteau K., Chesneau G., Guillevic M., Mourot J.;2015;;Effects of different dietary sources of n-3 fatty acids on the growth performance and technological, nutritional and sensorial quality of chicken meat;;;;;;;;;;;22. European Symposium on the Quality of Poultry Meat;;10-13 mai 2015;Nantes;France;XXIIth European Symposium on the Quality of Poultry Meat;;;np;;;;;;;;;;;;;;;;;;;;
Baeza E., Chartrin P., Lessire M., Meteau K., Chesneau G., Guillevic M., Mourot J.;2015;;Effects of different dietary sources of n-3 fatty acids on the laying performance and technological, nutritional and sensorial quality of eggs;;;;;;;;;;;XVIth European Symposium on the Quality of Eggs and Egg Products;;10-13 mai 2015;Nantes;France;XVIth European Symposium on the Quality of Eggs and Egg Products;;;np;;;;;;;;;;;;;;;;;;;;
Bahlis N., Corso A., Mügge L.-O., Shen Z.-X., Desjardins P., Stoppa A. M., Decaux O., Revel T., Granell M., Marit G., Nahi H., Demuynck H., Huang S.-Y., Basu S., Ervin-Haynes A.  et al.;2015;;Impact of Response in Patients (Pts) With Stem Cell Transplant (SCT)-Ineligible Newly Diagnosed Multiple Myeloma (NDMM) Treated With Continuous Lenalidomide + Low-Dose Dexamethasone (Rd) in the FIRST Trial;;;;;;;;;;;15th International Myeloma Workshop;;23 septembre 2015;Rome;Italie;;15, Supplement 3;;e56;;;;;;;;;;;10.1016/j.clml.2015.07.196;;;;;;;;;
Beaumont M., Peltier L., Collet N., Bendavid C., Poirier J. Y., Massart C.;2015;;Optimisation des performances cliniques des anticorps anti-thyroperoxydase dans le diagnostic des thyroïdites et des anticorps anti-thyroglobuline dans le suivi des cancers différenciés de la thyroïde;;;;;;;;;;;32e Congrès de la Société Française d'Endocrinologie;;Angers;France;;76;4;419;;;;;;;;;;;10.1016/j.ando.2015.07.385;;;;;;;;;
Bedere N., Delaby L., Ducrocq V., Colette S., Disenhaus C.;2015;;Towards a better understanding of the effect of genetic merit for milk production on post-partum cyclicity of first lactation dairy cows;;;;;;;;;;;ADSA-ASAS Joint Annual Meeting;Graduate student competition: ADSA production division graduate student oral competition, phd;12-16 juillet 2015;Orlando;États-Unis;2015 Joint annual meeting abstract book;98. Suppl. 2;;np;;;;;;;;;;;;;;;;;;;;
Biga P., Froehlich J. M., Gabillard J.-C., Seiliez I.;2015;;[i]In vitro[/i] myotubes derived from zebrafish myogenic precursor cells upregulate Pax-3 and-7 following starvation;;;;;;;;;;;Annual Meeting of the The Society for  Integrative and  Comparative Biology (SICB);;3-7 janvier 2015;West Palm Beach, Florida;États-Unis;SICB 2015 Annual Meeting Abstracts;55 (S1);;np;;;;;;;;;;;;;;;;;;;;
Boulon C., Desormais I., Boissier C., Bressollette L., Constans J., Lacroix P., Guilmot J. L., Le Hello C., Sevestre M.-A., Pernod G., Bura-Riviere A., Mahé G.;2015;;Analyse des flux Doppler : classification de Saint-Bonnet;;;;;;;;;;;14e Congrès de la Société Française de Médecine Vasculaire;;Nancy;France;;40;5;305;;;;;;;;;;;10.1016/j.jmv.2015.07.085;;;;;;;;;
Boutinaud M., Isaka N., Deflandre A., Wiart-Letort S., Lamberton P., De Prado Taranilla A. I., Lollivier V.;2015;;Dry-off facilitator cabergoline hastened the GLUT-1 decrease and lactoferrin increase in the mammary tissue during drying-off in dairy cows;;;;;;;;;;;ADSA-ASAS Joint Annual Meeting;;12-16 juillet 2015;Orlando;États-Unis;2015 Joint annual meeting abstract book;98. Suppl. 2;;np;;;;;;;;;;;;;;;;;;;;
Bouvry D., Jouneau S.;2015;;Fibrose pulmonaire idiopathique: nintedanib, pirfénidone, résultats complémentaires des essais cliniques;;;;;;;;;;;Mission ATS 2015 – Congrès annuel de l'American Thoracic Society;;Denver;États-Unis;;7;3;256--262;;;;;;;;;;;10.1016/S1877-1203(15)30063-X;;;;;;;;;
Burbank M., Sharanek A., Burban A., Weaver R. J., Guguen-Guillouzo C., Guillouzo A.;2015;;Selective bile canalicular changes induced by cholestatic drugs;;;;;;;;;;;ABSTRACTS OF THE 51st Congress of the European Societies of Toxicology (EUROTOX);;13 septembre 2015;Porto;Portugal;;238;2, Supplement;S301;;;;;;;;;;;10.1016/j.toxlet.2015.08.864;;;;;;;;;
Candek-Potokar M., Fontanesi L., Lebret B., Angels Oliver M., Fernandez A., Nieto R., Pugliese C., Gil J. M., Gesualdo L., Dalfino G.;2015;;Diversity of local pig breeds and production systems for high quality traditional products and sustainable pork chains (TREASURE): project presentation;;;;;;;;;;;8th Dry Cured Ham World Congress;Lié au projet européen H2020 Treasure : Grant Agreement number 634476;25-26 juin 2015;Toulouse;France;;;;np;;;;;;;;;;;;;;;;;;;;
Challois Leplaideur S., Jamal K., Leblong E., Chochina L., Bonan I.;2015;;CO35-004-e Effect of neck muscles and gluteus medius vibrations on standing balance in healthy subjects;;;;;;;;;;;30th Annual Congress of the French Society of Physical and Rehabilitation Medicine;;8 octobre 2015;Monpellier;France;;58, Supplement 1;;e110;;;;;;;;;;;10.1016/j.rehab.2015.07.267;;;;;;;;;
Chapuis H., Herault F., Varenne A., Romé H., Ruer T., Alleno C., Dehais P., Vignal A., Burlot T., Le Roy P.;2015;;Evaluation génomique du poids d'oeuf chez des poules pondeuses soumises à différents régimes alimentaires;;;;;;;;;;;11. Journées de la Recherche Avicole et Palmipèdes à Foie Gras;;25-26 mars 2015;Tours;France;11èmes Journées de la Recherche Avicole et Palmipèdes à Foie Gras;;;np;;;;;;;;;;;;;;;;;;;;
Chaudru S., De Müllenheim P.-Y., Le Faucheur A., Jaquinandi V., Mahé G.;2015;;Enseignement de l’index de pression systolique : un appel à l’action;;;;;;;;;;;14e Congrès de la Société Française de Médecine Vasculaire;;Nancy;France;;40;5;306;;;;;;;;;;;10.1016/j.jmv.2015.07.087;;;;;;;;;
Conde-Aguilera J. A., Tesseraud S., Lessire M., Geraert P.-A., Mercier Y., Van Milgen J.;2015;;A deficient supply of methionine changes the composition and metabolism of the pectoralis major muscle in growing broilers;;;;;;;;;;;26. Annual Australian Poultry Science Symposium;;9-11 février 2015;Sydney;Australie;26th Annual Australian Poultry Science Symposium;26;;np;;;;;;;;;;;;;;;;;;;;
Coquet J., Andrieux G., Nicolas J., Dameron O., Théret N.;2015;;Topological and semantic Web based method for analyzing TGF-β signaling pathways;;;;;;;;;;;JOBIM 2015;;6 décembre 2015;Clermont-Ferrand;France;JOBIM : Journées Ouvertes en Biologie, Informatique & Mathématiques;;;;;;;;;;;;;;;;;;;;;;;
De Müllenheim P.-Y., Chaudru S., Mahe G., Prioux J., Le Faucheur A.;2015;;Intérêts cliniques de la mesure ambulatoire de l’activité physique et de la capacité de marche dans l’artériopathie oblitérante des membres inférieurs;;;;;;;;;;;14e Congrès de la Société Française de Médecine Vasculaire;;Nancy;France;;40;5;306--307;;;;;;;;;;;10.1016/j.jmv.2015.07.088;;;;;;;;;
Decaux O., Moreau C., Autier B., Peltier L., Escoffre M., Lamy T., Sebillot M., Bendavid C., Guenet L., Grosbois B.;2015;;Comparison of polyclonal and monoclonal antibody based free light chain assays taking account of renal function;;;;;;;;;;;15th International Myeloma Workshop;;23 septembre 2015;Rome;Italie;;15, Supplement 3;;e247;;;;;;;;;;;10.1016/j.clml.2015.07.525;;;;;;;;;
Delaby L., Edouard N.;2015;;Make better use of nitrogen to limit losses, to mitigate environmental impacts and to improve N efficiency;;;;;;;;;;;L'agro-écologie dans le contexte du changement climatique;;3-5 juin 2015;Pekin;Chine;Conférence franco-chinoise sur l'agro-écologie dans le contexte du changement climatique;;;np;;;;;;;;;;;;;;;;;;;;
Delaby L., Duboc G., Cloet E., Martinot Y.;2015;;Pastur’Plan : a dynamic tool to support grazing management decision making in a rotational grazing system;;;;;;;;;;;18. Symposium of the european grassland federation;;15-17 juin 2015;Wageningen;Pays-Bas;Grassland and forages in high output dairy farming systems;20;;np;;;;;;;;;;;;;;;;;;;;
Delagarde R., Lemonnier J.-P.;2015;;Accuracy of the FeedPhone device for recording eating and rumination times in dairy cows;;;;;;;;;;;18. Symposium of the european grassland federation;;15-17 juin 2015;Wageningen;Pays-Bas;Grassland and forages in high output dairy farming systems;20;;np;;;;;;;;;;;;;;;;;;;;
Delagarde R.;2015;;Evolution of foraging system (and raw materials) in the next 50 years in the light of climate changes;;;;;;;;;;;Workshop du réseau Recolad : international network on adaptation of livestock to the consequences of climate change;Session 2 : Forecasting the impact of global environmental changes on livestock;11-12 février 2015;Paris;France;Workshop Recolad 2015 - Paris;;;np;;;;;;;;;;;;;;;;;;;;
Delagarde R., Delaby L., Peyraud J.-L., Faverdin P.;2015;;Models for predicting effects of management factors on per-cow and per-hectare pasture intake by grazing dairy cows;;;;;;;;;;;18. Symposium of the european grassland federation;;15-17 juin 2015;Wageningen;Pays-Bas;Grassland and forages in high output dairy farming systems;20;;np;;;;;;;;;;;;;;;;;;;;
Dolley-Hitze T., Oger E., Lombart M. L., Hamel D.;2015;;Utilisation du dialysat au citrate en HDF postdilutionnelle : expérience rétrospective à 1 an sur la sécurité d’utilisation et l’arrêt de l’anticoagulation en séance;;;;;;;;;;;17e Réunion commune de la Société de néphrologie (SN) et de la Société francophone de dialyse (SFD);;29 septembre 2015;Lyon;France;;11;5;325--326;;;;;;;;;;;10.1016/j.nephro.2015.07.162;;;;;;;;;
Doreau M., Faverdin P., Guyomard H., Peyraud J.-L.;2015;;Solutions for greenhouse gases mitigation in ruminant farming: how to favor their adoption?;;;;;;;;;;;3. Climate Smart Agriculture;;16-18 mars 2015;Montpellier;France;Abstracts of the climate smart agriculture 2015;;;np;;;;;;;;;;;;;;;;;;;;
Dorez H., Sablong R., Canaple L., Saint-Jalmes H., Gaillard S., Moussata D., Beuf O.;2015;;Autofluorescence spectroscopy for multimodal tissues characterization in colitis-associated cancer murine model;;;;;;;;;;;European Conference on Biomedical Optics;;21-25 juin 2015;Munich;Allemagne;;95370L;;;;;;;;;;;;;10.1117/12.2181548;;;;;;;;;
Dourmad J.-Y., Le Velly V., Lechartier C., Gourdine J.-L., Renaudeau D.;2015;;Effect of ambient temperature on lactating sows, a meta-analysis and modeling approach;;;;;;;;;;;3. Climate Smart Agriculture;;16-18 mars 2015;Montpellier;France;Abstracts of the climate smart agriculture 2015;;;np;;;;;;;;;;;;;;;;;;;;
Dourmad J.-Y.;2015;;Mathematical modeling of gas flows in livestock production;;;;;;;;;;;International symposium on emissions of gas and dust from livestock. EMILI 2015;;24-26 mars 2015;Florianopolis;Brésil;EmiLi 2015;;;np;;;;;;;;;;;;;;;;;;;;
Dréano S., Barloy J., Prunar F., Barloy-Hubler F., Prunar S.;2015;;Proposal of phylogenetic revision of the subgenus “Morphocarabus” on the basis of molecular biology criteria;;;;;;;;;;;EUROPEAN BIOTECHNOLOGY CONGRESS;;Bucharest;Roumanie;;208, Supplement;;S46;;;;;;;;;;;10.1016/j.jbiotec.2015.06.133;;;;;;;;;
Dupont-Nivet M., Colson V., Crusot M., Labbé L., Rigaudeau D., Leguen I.;2015;;Genetic variability and phenotypic characterization of thermotolerance in rainbow trout;;;;;;;;;;;Climate-Smart Agriculture: Global Science Conference;Poster session 2: Breeding and protecting crops and livestock;16-18 mars 2015;Montpellier;France;Climate-Smart Agriculture 2015;;;np;;;;;;;;;;;;;;;;;;;;
Dupont-Nivet M., Prunet P., Colson V., Labbé L., Cayron B., Quillet E., Leguen I.;2015;;THERMOTAC : variabilité génétique et caractérisation phénotypique de la thermotolérance chez la truite arc-en-ciel;;;;;;;;;;;Workshop 2015 ReColAD;Poster session;11-12 février 2015;Paris;France;;;;np;;;;;;;;;;;;;;;;;;;;
Eory V., Faverdin P., O'brien D.;2015;;Economic assessment of greenhouse gas mitigation on livestock farms;;;;;;;;;;;3. Climate Smart Agriculture;;16-18 mars 2015;Montpellier;France;Abstracts of the climate smart agriculture 2015;;;np;;;;;;;;;;;;;;;;;;;;
Eugène M., Nguyen V. T. N. G., Nguyen T. T. H., Morgavi D., Wilfart-Monziols A.;2015;;Environmental impacts of feed additives used in dairy production systems using LCA approach;;;;;;;;;;;Greenhouse Gases and Animal Agriculture Conference (GGAA);;22-25 juin 2015;Dublin;Royaume-Uni;;;;np;;;;;;;;;;;;;;;;;;;;
Fafin. C., Couchoud C., Vigneau C., Moranne O.;2015;;Facteurs pronostiques d’initiation de dialyse ou de décès chez des patients âgés arrivant au stade avancé de la maladie rénale chronique : cohorte PSPA;;;;;;;;;;;17e Réunion commune de la Société de néphrologie (SN) et de la Société francophone de dialyse (SFD);;29 septembre 2015;Lyon;France;;11;5;440--441;;;;;;;;;;;10.1016/j.nephro.2015.07.224;;;;;;;;;
Falentin H., Rault L., Bouchard D., Nicolas A., Lassalas J., Lamberton P., Aubry J. M., Marnet P.-G., Le Loir Y., Even S.;2015;;Microbiota of bovine udder and susceptibility to mastitis in dairy cows;;;;;;;;;;;Pathobiome: Pathogens in microbiota in host;;24-26 juin 2015;Paris;France;;;;np;;;;;;;;;;;;;;;;;;;;
Falentin H., Rault L., Bouchard D., Nicolas A., Lassalas J., Lamberton P., Aubry J. M., Marnet P.-G., Le Loir Y., Even S.;2015;;Microbiota of bovine udder foremilk and susceptibility to mastitis in dairy cows.;;;;;;;;;;;20. Edition du Club des Bactéries Lactiques;;17-19 juin 2015;Lille;France;;;;np;;;;;;;;;;;;;;;;;;;;
Faure J., Lefaucheur L., Lebret B.;2015;;Effects of cold rearing temperature on meat quality parameters on loin and ham muscles in pigs;;;;;;;;;;;ASAS/ADSA midwest meeting;;16-18 mars 2015;Des Moines;États-Unis;Abstract book of the ASAS/ADSA midwest meeting;;;np;;;;;;;;;;;;;;;;;;;;
Faverdin P.;2015;;How to solve the problem of scales to improve the efficiency in livestock production?;;;;;;;;;;;66. Annual Meeting of the European Federation of Animal Science (EAAP);;31 août-3 septembre 2015;Warsaw;Pologne;Book of Abstracts of the 66th Annual Meeting of the European Association for Animal Production;21;;np;;;;;;;;;;;;;;;;;;;;
