Auteurs;Année;Année de soutenance;Titre;Titre journal;Année;Volume;Issue;Editeur scientifique;Titre ouvrage;Titre du volume;Editeur revue;Volume, Issue, Pages;ISBN;Titre conférence;Commentaire;Date congrès;Ville;Pays;Patent n°;Date de publication;Type de rapport;N°;Organisme de délivrance;Pages;Date de publication;Directeur de thèse;Université de soutenance;Année de soutenance;Organisme de délivrance;DOI;NNT;Pubmed;Référence;ArXiv;Description;Voir aussi;Réf. HAL;Rang HCERES;Rang CNRS
Abdallah R., Djelad H., Amrane A., Sayed W., Fourcade F., Labasque T., Geneste F., Taha S., Floner D.;2016;;Dark fermentative hydrogen production by anaerobic sludge growing on glucose and ammonium resulting from nitrate electroreduction;International Journal of Hydrogen Energy;;41;12;;;;;5445-5455;;;;;;;;;;;;;;;;;;10.1016/j.ijhydene.2016.02.030;;;;;;;;;
Abdelfettah Y., Tiercelin J.-J., Tarits P., Hautot S., Maia M., Thuo P.;2016;;Subsurface structure and stratigraphy of the northwest end of the Turkana Basin, Northern Kenya Rift, as revealed by magnetotellurics and gravity joint inversion,;Journal of African Earth Sciences;;;;;;;;to appear;;;;;;;;;;;;;;;;;;10.1016/j.jafrearsci.2016.03.008;;;;;;;;;
Akrout D., Cobbold P. R., Ahmadi R., Mercier E., Montacer M.;2016;;Physical modelling of sub-salt gliding due to fluid overpressure in underlying sedimentary strata;Marine and Petroleum Geology;;;;;;;;to appear;;;;;;;;;;;;;;;;;;10.1016/j.marpetgeo.2016.01.019;;;;;;;;;
Babey T., Dreuzy J.-R., Ginn T.;2016;;From conservative to reactive transport under diffusion-controlled conditions;Water Resources Research;;;;;;;;to appear;;;;;;;;;;;;;;;;;;10.1002/2015WR018294;;;;;;;;;
Ballouard C., Poujol M., Boulvais P., Branquet Y., Tartese R., Vigneresse J. L.;2016;;Nb-Ta fractionation in peraluminous granites: A marker of the magmatic-hydrothermal transition;Geology;;44;3;;;;;231-234;;;;;;;;;;;;;;;;;;10.1130/G37475.1;;;;;;;;;
Bauer H., Bessin P., Saint-Marc P., Châteauneuf J.-J., Bourdillon C., Wyns R., Guillocheau F.;2016;;The Cenozoic history of the Armorican Massif: New insights from the deep CDB1 borehole (Rennes Basin, France);Comptes Rendus Géoscience;;;;;;;;to appear;;;;;;;;;;;;;;;;;;10.1016/j.crte.2016.02.002;;;;;;;;;
Blaise T., Clauer N., Cathelineau M., Boiron M.-C., Techer I., Boulvais P.;2016;;Reconstructing fluid-flow events in Lower-Triassic sandstones of the eastern Paris Basin by elemental tracing and isotopic dating of nanometric illite crystals;Geochimica et Cosmochimica Acta;;176;;;;;;157-184;;;;;;;;;;;;;;;;;;10.1016/j.gca.2015.12.018;;;;;;;;;
Boutin A., De Saint Blanquat M., Poujol M., Boulvais P., De Parseval P., Rouleau C., Robert J.-F.;2016;;Succession of Permian and Mesozoic metasomatic events in the eastern Pyrenees with emphasis on the Trimouns talc–chlorite deposit;International Journal of Earth Sciences;;105;3;;;;;747-770;;;;;;;;;;;;;;;;;;10.1007/s00531-015-1223-x;;;;;;;;;
Brun J.-P., Faccenna C., Gueydan F., Sokoutis D., Philippon M., Kydonakis K., Gorini C.;2016;;The two-stage aegean extension, from localized to distributed, a result of slab rollback acceleration;Canadian journal of earth sciences;;;;;;;;to appear;;;;;;;;;;;;;;;;;;10.1139/cjes-2015-0203;;;;;;;;;
Catrouillet C., Davranche M., Dia A., Bouhnik-Le Coz M., Demangeat E., Gruau G.;2016;;Does As(III) interact with Fe(II), Fe(III) and organic matter through ternary complexes?;Journal of Colloid and Interface Science;;470;;;;;;153-161;;;;;;;;;;;;;;;;;;10.1016/j.jcis.2016.02.047;;;;;;;;;
Cerqueira Cruz Pereira S., Figuereido Barbosa J. S., Santos Pinto M., Peucat J.-J., Paquette J.-L., Santos De Souza J., De Souza Martins V., Chemale Junior F., Carneiro M. A.;2016;;The Siderian-Orosirian magmatism in the Archean Gavião Paleoplate, Brazil: U-Pb geochronology, geochemistry and tectonic implications;Journal of South American Earth Sciences;;69;;;;;;43-79;;;;;;;;;;;;;;;;;;10.1016/j.jsames.2016.02.007;;;;;;;;;
Chelalou R., Nalpas T., Bousquet R., Prevost M., Lahfid A., Poujol M., Ringenbach J.-C., Ballard J.-F.;2016;;New sedimentological, structural and paleo-thermicity data in the Boucheville Basin (eastern North Pyrenean Zone, France);Comptes Rendus Géoscience;;348;3-4;;;;;312-321;;;;;;;;;;;;;;;;;;10.1016/j.crte.2015.11.008;;;;;;;;;
Cheng F., Jolivet M., Fu S., Zhang C., Zhang Q., Guo Z.;2016;;Large-scale displacement along the Altyn Tagh Fault (North Tibet) since its Eocene initiation: Insight from detrital zircon U–Pb geochronology and subsurface data;Tectonophysics;;677-678;;;;;;261-279;;;;;;;;;;;;;;;;;;10.1016/j.tecto.2016.04.023;;;;;;;;;
Corre B., Lagabrielle Y., Labaume P., Fourcade S., Clerc C., Ballèvre M.;2016;;Deformation associated with mantle exhumation in a distal, hot passive margin environment: New constraints from the Saraillé Massif (Chaînons Béarnais, North-Pyrenean Zone);Comptes Rendus Géoscience;;348;;;;;;279-289;;;;;;;;;;;;;;;;;;10.1016/j.crte.2015.11.007;;;;;;;;;
Dauteuil O., Moreau F., Qarqori K.;2016;;Structural pattern of the Saïss basin and Tabular Middle Atlas in northern Morocco: hydrological implications;Journal of African Earth Sciences;;;;;;;;to appear;;;;;;;;;;;;;;;;;;10.1016/j.jafrearsci.2016.04.001;;;;;;;;;
De Saint Blanquat M., Bajolet F., Grand 'homme A., Proietti A., Zanti M., Boutin A., Clerc C., Lagabrielle Y., Labaume P.;2016;;Cretaceous mantle exhumation in the central Pyrenees: New constraints from the peridotites in eastern Ariè ge (North Pyrenean zone, France);Comptes Rendus Géoscience;;348;2-4;;;;;268-278;;;;;;;;;;;;;;;;;;10.1016/j.crte.2015.12.003;;;;;;;;;
De Vicente I Bosch G., Van Den Driessche J., Babault J., Robert A., Carballo A., Le Carlier De Veslud C., Loget N., Prognon C., Wyns R., Baudin T.;2016;;Peneplanation and lithosphere dynamics in the Pyrenees;Comptes Rendus Géoscience;;348;3-4;;;;;194-202;;;;;;;;;;;;;;;;;;10.1016/j.crte.2015.08.005;;;;;;;;;
De Vicente I Bosch G., Teixell A., Jolivet M., Labaume P., Stockli D., Domenech M., Monie P.;2016;;Timing of Eocene–Miocene thrust activity in the Western Axial Zone and Chaînons Béarnais (west-central Pyrenees) revealed by multi-method thermochronology;Comptes Rendus Géoscience;;;;;;;;to appear;;;;;;;;;;;;;;;;;;10.1016/j.crte.2016.01.001;;;;;;;;;
Donnadieu Y., Pucéat E., Moiroud M., Guillocheau F., Deconinck J.-F.;2016;;A better-ventilated ocean triggered by Late Cretaceous changes in continental configuration;Nature Communications;;7;;;;;;Art. n°10316;;;;;;;;;;;;;;;;;;10.1038/ncomms10316;;26777897;;;;;;;
Duretz T., May D., Yamato P.;2016;;A free surface capturing discretization for the staggered grid finite difference scheme;Geophysical Journal International;;204;3;;;;;1518-1530;;;;;;;;;;;;;;;;;;10.1093/gji/ggv526;;;;;;;;;
Duretz T., Agard P., Yamato P., Ducassou C., Burov E., Gerya T.;2016;;Thermo-mechanical modeling of the obduction process based on the Oman Ophiolite case;Gondwana Research;;32;;;;;;1-10;;;;;;;;;;;;;;;;;;10.1016/j.gr.2015.02.002;;;;;;;;;
Eicker A., Forootan E., Springer A., Longuevergne L., Kusche J.;2016;;Does GRACE see the terrestrial water cycle ‘intensifying’?;Journal of Geophysical Research: Atmospheres;;121;2;;;;;733-745;;;;;;;;;;;;;;;;;;10.1002/2015JD023808;;;;;;;;;
Frasca G., Gueydan F., Brun J.-P., Monié P.;2016;;Deformation mechanisms in a continental rift up to mantle exhumation. Field evidence from the western Betics, Spain;Marine and Petroleum Geology;;;;;;;;to appear;;;;;;;;;;;;;;;;;;10.1016/j.marpetgeo.2016.04.020;;;;;;;;;
Furgerot L., Mouazé D., Tessier B., Perez L., Haquin S., Weill P., Crave A.;2016;;Sediment transport induced by tidal bores. An estimation from suspended matter measurements in the Sée River (Mont-Saint-Michel Bay, northwestern France);Comptes Rendus Géoscience;;;;;;;;to appear;;;;;;;;;;;;;;;;;;10.1016/j.crte.2015.09.004;;;;;;;;;
Gallagher K.;2016;;Comment on ‘A reporting protocol for thermochronologic modeling illustrated with data from the Grand Canyon’ by Flowers, Farley andKetcham;Earth and Planetary Science Letters;;441;;;;;;211-212;;;;;;;;;;;;;;;;;;10.1016/j.epsl.2015.09.053.;;;;;;;;;
Gardien V., Rabinowicz M., Vigneresse J. L., Dubois M., Boulvais P., Martini R.;2016;;Long-lived interaction between hydrothermal and magmatic fluids in the Soultz-sous-Forêts granitic system (Rhine Graben, France);Lithos;;246-247;;;;;;110-127;;;;;;;;;;;;;;;;;;10.1016/j.lithos.2015.12.002;;;;;;;;;
Guerit L., Barrier L., Jolivet M., Fu B., Métivier F.;2016;;Denudation intensity and control in the Chinese Tian Shan: new constraints from mass balance on catchment-alluvial fan systems;Earth Surface Processes and Landforms;;;;;;;;to appear;;;;;;;;;;;;;;;;;;10.1002/esp.3890;;;;;;;;;
Géraud B., Jones S., Cantat I., Dollet B., Méheust Y.;2016;;The flow of a foam in a two-dimensional porous medium;Water Resources Research;;52;2;;;;;773-790;;;;;;;;;;;;;;;;;;10.1002/2015WR017936;;;;;;;;;
Jimenez-Martinez J., Smith M., Pope D.;2016;;Prediction of groundwater-induced flooding in a chalk aquifer for future climate change scenarios;Hydrological Processes;;30;4;;;;;573-587;;;;;;;;;;;;;;;;;;10.1002/hyp.10619;;;;;;;;;
Jourde K., Gibert D., Marteau J., De Bremond D'ars J., Gardien S., Girerd C., Ianigro J.-C.;2016;;Monitoring temporal opacity fluctuations of large structures with muon tomography : a calibration experiment using a water tower tank;Scientific Reports;;6;;;;;;23054;;;;;;;;;;;;;;;;;;10.1038/srep23054;;;;1504.02230;;;;;
Khelil R., Jardé E., Cabello-Hurtado F., Hadj-Khelil A. O. E., Esnault M.-A.;2016;;Structure and composition of the wax of the date palm, Phoenixdactylifera L., from the septentrional Sahara;Scientia Horticulturae;;201;;;;;;238-246;;;;;;;;;;;;;;;;;;10.1016/j.scienta.2016.02.012;;;;;;;;;
Labaume P., Meresse F., Jolivet M., Teixell A., Lahfid A.;2016;;Tectono-thermal history of an exhumed thrust-sheet-top basin: an example from the south Pyrenean thrust belt;Tectonics;;;;;;;;to appear;;;;;;;;;;;;;;;;;;10.1002/2016TC004192;;;;;;;;;
Lagabrielle Y., Clerc C., Vauchez A., Lahfid A., Labaume P., Azambre B., Fourcade S., Dautria J.-M.;2016;;Very high geothermal gradient during mantle exhumation recorded in mylonitic marbles and carbonate breccias from a Mesozoic Pyrenean palaeomargin (Lherz area, North Pyrenean Zone, France);Comptes Rendus Géoscience;;348;3-4;;;;;290-300;;;;;;;;;;;;;;;;;;10.1016/j.crte.2015.11.004;;;;;;;;;
Lagabrielle Y., Saint-Blanquat M. D., Godard M.;2016;;From rifting to mountain building: The Pyrenean Belt;Comptes Rendus Géoscience;;348;;;;;;169-171;;;;;;;;;;;;;;;;;;10.1016/j.crte.2016.04.002;;;;;;;;;
Leray S., Engdahl N., Massoudieh A., Bresciani E., Mccallum J.;2016;;Residence time distributions for hydrologic systems: Mechanistic foundations and steady-state analytical solutions;Journal of Hydrology;;;;;;;;to appear;;;;;;;;;;;;;;;;;;10.1016/j.jhydrol.2016.01.068;;;;;;;;;
Manzotti P., Ballevre M., Poujol M.;2016;;Detrital zircon geochronology in the Dora-Maira and Zone Houillère: a record of sediment travel paths in the Carboniferous;Terra Nova;;;;;;;;to appear;;;;;;;;;;;;;;;;;;10.1111/ter.12219;;;;;;;;;
Michaud F., Proust J.-N., Dano A., Collot J.-Y., Guiyeligou G. D., Et A.;2016;;Flare-Shaped Acoustic Anomalies in the Water Column Along the Ecuadorian Margin: Relationship with Active Tectonics and Gas Hydrates;Pure and Applied Geophysics;;;;;;;;to appear;;;;;;;;;;;;;;;;;;10.1007/s00024-015-1230-7;;;;;;;;;
Mvondo Owono F., Ntamak-Nida M.-J., Dauteuil O., Guillocheau F., Njom B.;2016;;Morphology and long-term landscape evolution of the South African plateau in South Namibia;CATENA;;142;;;;;;47-65;;;;;;;;;;;;;;;;;;10.1016/j.catena.2016.02.012;;;;;;;;;
Noetinger B., Roubinet D., Russian A., Le Borgne T., Delay F., Dentz M., Dreuzy J.-R., Gouze P.;2016;;RandomWalk Methods for Modeling Hydrodynamic Transport in Porous and Fractured Media from Pore to Reservoir Scale;Transport in Porous Media;;;;;;;;to appear;;;;;;;;;;;;;;;;;;10.1007/s11242-016-0693-z;;;;;;;;;
Néraudeau D., Saint Martin S., Batten D., Colin J., Daviero-Gomez V., Girard V., Gomez B., Nohra Y., Polette F., Platel J.-P., Saint Martin J.-P., Vullo R.;2016;;Palaeontology of the upper Turonian paralic deposits of the Sainte-Mondane Formation, Aquitaine Basin, France;Geologica Acta;;14;1;;;;;53-69;;;;;;;;;;;;;;;;;;10.1344/GeologicaActa2016.14.1.5;;;;;;;;;
Peris D., Ruzzier E., Perrichot V., Delclos X.;2016;;Evolutionary and paleobiological implications of Coleoptera (Insecta) from Tethyan-influenced Cretaceous ambers;Geoscience Frontiers;;;;;;;;to appear;;;;;;;;;;;;;;;;;;10.1016/j.gsf.2015.12.007;;;;;;;;;
Pistis M., Dabard M.-P., Loi A.;2016;;Influence of relative sea-level variations on the genesis of palaeoplacers, the examples of Sarrabus (Sardinia, Italy) and the Armorican Massif (western France);Comptes Rendus Géoscience;;348;2;;;;;150-157;;;;;;;;;;;;;;;;;;10.1016/j.crte.2015.09.006;;;;;;;;;
Pochon A., Gapais D., Gloaguen E., Gumiaux C., Branquet Y., Cagnard F., Martelet G.;2016;;Antimony deposits in the Variscan Armorican belt, a link with mafic intrusives?;Terra Nova;;28;2;;;;;138-145;;;;;;;;;;;;;;;;;;10.1111/ter.12201;;;;;;;;;
Principaud M., Ponte J.-P., Mulder T., Gillet H., Robin C., Borgomano J.;2016;;Slope-to-basin stratigraphic evolution of the carbonate northwestern Great Bahama Bank (Bahamas) during the Neogene to Quaternary: interactions between downslope and bottom currents deposits;Basin Research;;;;;;;;;;;;;;;;;;;;;;;;;;10.1111/bre.12195;;;;;;;;;
Quesnel B., Boulvais P., Gautier P., Cathelineau M., John C., Dierick M., Agrinier P., Drouillet M.;2016;;Paired stable isotopes (O, C) and clumped isotope thermometry of magnesite and silica veins in the New Caledonia Peridotite Nappe;Geochimica et Cosmochimica Acta;;183;;;;;;234-249;;;;;;;;;;;;;;;;;;10.1016/j.gca.2016.03.021;;;;;;;;;
Quesnel B., Gautier P., Cathelineau M., Boulvais P., Couteau C., Drouillet M.;2016;;The internal deformation of the Peridotite Nappe of New Caledonia: a structural study of serpentine-bearing faults and shear zones in the Koniambo Massif;Journal of Structural Geology;;85;;;;;;51-67;;;;;;;;;;;;;;;;;;10.1016/j.jsg.2016.02.006;;;;;;;;;
Riegler T., Beaufort M.-F., Allard T., Pierson-Wickmann A.-C., Beaufort D.;2016;;Nanoscale relationships between uranium and carbonaceous material in alteration halos around unconformity-related uranium deposits of the Kiggavik camp, Paleoproterozoic Thelon Basin, Nunavut, Canada;Ore Geology Reviews;;;;;;;;to appear;;;;;;;;;;;;;;;;;;10.1016/j.oregeorev.2016.04.018;;;;;;;;;
Rolland Y., Bosch D., Guillot S., De Sigoyer J., Martinod J., Agard P., Yamato P.;2016;;Subduction and Orogeny: Introduction to the Special volume;Journal of Geodynamics;;96;;;;;;1-5;;;;;;;;;;;;;;;;;;10.1016/j.jog.2016.03.006;;;;;;;;;
Rossignol C., Bourquin S., Poujol M., Hallot E., Dabard M.-P., Nalpas T.;2016;;The volcaniclastic series from the luang prabang basin, Laos: A witness of a triassic magmatic arc?;journal of asian earth Sciences;;120;;;;;;159-183;;;;;;;;;;;;;;;;;;10.1016/j.jseaes.2016.02.001;;;;;;;;;
Schuite J., Longuevergne L., Bour O., Boudin F., Durand S., Lavenant N.;2016;;Inferring field-scale properties of a fractured aquifer from ground surface deformation during a well test;Geophysical Research Letters;;42;24;;;;;10696-10703;;;;;;;;;;;;;;;;;;10.1002/2015GL066387;;;;;;;;;
Serra-Kiel J., Gallardo-Garcia A., Razin P., Robinet J., Roger J., Grelaud C., Leroy S., Robin C.;2016;;Middle Eocene-Early Miocene larger foraminifera from Dhofar (Oman) and Socotra Island (Yemen);Arabian Journal of Geosciences;;9;5;;;;;1-95;;;;;;;;;;;;;;;;;;10.1007/s12517-015-2243-3;;;;;;;;;
Shakas A., Linde N., Baron L., Bochet O., Bour O., Le Borgne T.;2016;;Hydrogeophysical characterization of transport processes in fractured rock by combining push-pull and single-hole ground penetrating radar experiments;Water Resources Research;;52;2;;;;;938-953;;;;;;;;;;;;;;;;;;10.1002/2015WR017837;;;;;;;;;
Steelandt S., Pierson-Wickmann A.-C., Bhiry N., Marguerie D., Bouhnik-Le Coz M.;2016;;Chemical Differentiation between Immersed and Dry Wood Samples in Nunavik (Northern Quebec, Canada): Preliminary Results;Artic, Antartic, and Alpine Research;;;;;;;;to appear;;;;;;;;;;;;;;;;;;10.1657/AAAR0014-082;;;;;;;;;
Teixell A., Labaume P., Lagabrielle Y.;2016;;The crustal evolution of the west-central Pyrenees revisited: Inferences from a new kinematic scenario;Comptes Rendus Géoscience;;;;;;;;to appear;;;;;;;;;;;;;;;;;;10.1016/j.crte.2015.10.010;;;;;;;;;
Temizel I., Arslan M., Yücel C., Abdioğlu E., Ruffet G.;2016;;Geochronology and geochemistry of Eocene-aged volcanic rocks around the Bafra (Samsun, N Turkey) area: Constraints for the interaction of lithospheric mantle and crustal melts;Lithos;;;;;;;;to appear;;;;;;;;;;;;;;;;;;10.1016/j.lithos.2016.04.023;;;;;;;;;
Thomas Z., Rousseau-Gueutin P., Kolbe T., Abbott B. W., Marçais J., Peiffer S., Frei S., Bishop K., Pichelin P., Pinay G., Dreuzy J.-R.;2016;;Constitution of a catchment virtual observatory for sharing flow and transport models outputs;Journal of Hydrology;;;;;;;;to appear;;;;;;;;;;;;;;;;;;10.1016/j.jhydrol.2016.04.067;;;;;;;;;
Vullo R., Guinot G., Barbe G.;2016;;The first articulated specimen of the Cretaceous mackerel shark Haimirichia amonensis gen. nov. (Haimirichiidae fam. nov.) reveals a novel ecomorphological adaptation within the Lamniformes (Elasmobranchii);Journal of Systematic Palaeontology;;;;;;;;to appear;;;;;;;;;;;;;;;;;;10.1080/14772019.2015.1137983;;;;;;;;;
Wildman M., Brown R., Beucher R., Persano C., Stuart F., Gallagher K., Schwanethal J., Carter A.;2016;;The chronology and tectonic style of landscape evolution along the elevated Atlantic continental margin of South Africa resolved by joint apatite fission track and (U-Th-Sm)/He thermochronology;Tectonics;;;;;;;;to appear;;;;;;;;;;;;;;;;;;10.1002/2015TC004042;;;;;;;;;

