Collection;Auteurs;Année;Année de soutenance;Titre;Titre journal;Année;Volume;Issue;Editeur scientifique;Titre ouvrage;Titre du volume;Editeur revue;Volume, Issue, Pages;ISBN;Titre conférence;Commentaire;Date congrès;Ville;Pays;Patent n°;Date de publication;Type de rapport;N°;Organisme de délivrance;Pages;Date de publication;Directeur de thèse;Université de soutenance;Année de soutenance;Organisme de délivrance;DOI;NNT;Pubmed;Référence;ArXiv;Description;Voir aussi;Réf. HAL;Rang HCERES;Rang CNRS
CREM-EIEC - 51 ;Le Pape Nicolas, Zhao Kai;2014;;Horizontal Mergers and Uncertainty;Economics: The Open-Access, Open-Assessment E-Journal;;;;;;;; vol 8 ,n° 23, pp. 1-31;;;;;;;;;;;;;;;;;;10.5018/economics-ejournal.ja.2014-23;;;;;;;;;E;
CREM-EIEC - 52 ;Lecostey Sophie;2014;;A Model of Adverse Promotion;Recherches Economiques de Louvain - Louvain economic review;;;;;;;; vol 80 ,n° 4, pp. 7-23;;;;;;;;;;;;;;;;;;10.3917/rel.804.0007;;;;;;;;B;
CREM-EIEC - 53 ;Lei Vivian, Masclet David, Vesely Filip;2014;;Competition vs. communication: An experimental study on restoring trust;Journal of Economic Behavior and Organization;;;;;;;; vol 108, pp. 94-107;;;;;;;;;;;;;;;;;;10.1016/j.jebo.2014.09.001;;;;;;;;A;2;
CREM-MEF - 46 CREM-MM - 51 ;Lenormand Gaëlle, Touchais Lionel;2014;;IFRS 8 versus IAS 14 ? Approche managériale de l'information sectorielle : impacts et déterminants;Comptabilité Contrôle Audit;;;;;;;; vol 20 ,n° 1, pp. 93-119;;;;;;;;;;;;;;;;;;10.3917/cca.201.0093;;;;;;;;;2;
CREM-MEF - 47 CREM-MM - 52 ;Lenormand Gaëlle, Touchais Lionel;2014;;Le test de perte de valeur avec l’IAS 36 : difficultés et risques. Le cas du groupe PSA;Revue Française de Comptabilité;;;;;;;; vol 473, pp. 2-6;;;;;;;;;;;;;;;;;;;;;;;;;;;0;
CREM-EPCS - 56 ;Lepelley Dominique, Merlin Vincent, Rouet Jean-Louis, Vidu Laurent;2014;;Referendum paradox in a federal union with unequal populations: the three state case;Economics Bulletin;;;;;;;; vol 34 ,n° 4, pp. 2201-2207;;;;;;;;;;;;;;;;;;;;;;;;;;B;3;
CREM-MM - 53 ;Lux Gulliver;2014;;Homogenous managing groups of users in Health and Social Care Establishments:a suggested methodology and its application within the disability sector;Gestion 2000;;;;;;;; vol 31 ,n° 1, pp. 71-90;;;;;;;;;;;;;;;;;;;;;;;;;;;0;
CREM-MM - 54 ;Mandard Matthieu;2014;;L'influence des réseaux interorganisationnels sur l'activité des entreprises;Revue Française de Gestion;;;;;;;; vol 40 ,n° 238, pp. 139-151;;;;;;;;;;;;;;;;;;10.3166/rfg.238.139-151;;;;;;;;C;4;
CREM-MEF - 48 ;Martin Franck, Zhang Jiangxingyun;2014;;Correlation and volatility on bond markets during the EMU crisis: does the OMT change the process ?;Economics Bulletin;;;;;;;; vol 34 ,n° 2, pp. 1327-1349;;;;;;;;;;;;;;;;;;;;;;;;;;B;3;
CREM-EIEC - 54 ;Martin Ludivine, Poussing Nicolas;2014;;IT Outsourcing and Firm Characteristics: Empirical Evidence from Survey Data;International Journal of Human and Technology interaction;;;;;;;; vol 10 ,n° 1, pp. 1-18;;;;;;;;;;;;;;;;;;10.4018/ijthi.2014010101;;;;;;;;;
CREM-MM - 55 ;Meyssonnier François, Tahar Caroline;2014;;Gérer et contrôler le temps de l'interface prestataire - usager dans les services publics;Comptabilité Contrôle Audit;;;;;;;; vol 20 ,n° 2, pp. 41-69;;;;;;;;;;;;;;;;;;;;;;;;;;;2;
CREM-MEF - 49 ;Moraux Franck, Silaghi Florina;2014;;Inside debt renegotiation: Optimal debt reduction, timing, and the number of rounds;Journal of Corporate Finance;;;;;;;; vol 2014 ,n° 27, pp. 269-295;;;;;;;;;;;;;;;;;;10.1016/j.jcorpfin.2014.05.012;;;;;;;;A;2;
CREM-EIEC - 55 ;Mouline Aziz, Gaudron Pascal;2014;;Recension : Herman Simon, Stéphan Guinchard, " Les Champions Cachés du XXIe Siècle ", Economica, 2012, 340 pages;Management international;;;;;;;; vol 18 ,n° 2, pp. 209-213;;;;;;;;;;;;;;;;;;;;;;;;;;B;
CREM-EIEC - 56 ;Nguyen Godefroy Dang, Dejean Sylvain, Moreau François;2014;;On the complementarity between online and offline music consumption: the case of free streaming;American Journal of Agricultural Economics;;;;;;;; vol 38 ,n° 4, pp. 315-330;;;;;;;;;;;;;;;;;;10.1007/s10824-013-9208-8;;;;;;;;A;1;
CREM-EPCS - 57 ;Padovano Fabio, Petrarca Ilaria;2014;;Are the responsibility and yardstick competition hypotheses mutually consistent?;European Journal of Political Economy;;;;;;;; vol 34, pp. 459-477;;;;;;;;;;;;;;;;;;10.1016/j.ejpoleco.2013.09.006;;;;;;;;B;3;
CREM-EPCS - 58 ;Padovano Fabio;2014;;Distribution of transfers and soft budget spending behaviors: evidence from Italian regions;Public Choice;;;;;;;; vol 161 ,n° 1-2, pp. 11-29;;;;;;;;;;;;;;;;;;10.1007/s11127-013-0119-1;;;;;;;;A;1;
CREM-MEF - 50 CREM-MM - 56 ;Perdreau Frédéric, Le Nadant Anne-Laure, Cliquet Gérard;2014;;Human Capital Intangibles and Performance of Franchise Networks: A Complementary View between Agency and Critical Resource Perspectives;Managerial and Decision Economics;;;;;;;; vol 36, pp. 121-138;;;;;;;;;;;;;;;;;;10.1002/mde.2656;;;;;;;;B;3;
CREM-MEF - 51 ;Perman Roger, Stephan Gaëtan, Tavéra Christophe;2014;;Okun's Law - a Meta-analysis;Manchester School;;;;;;;; vol 83 ,n° 1, pp. 101-126;;;;;;;;;;;;;;;;;;10.1111/manc.12057;;;;;;;;B;3;
CREM-MM - 57 ;Perrigot Rozenn;2014;;Créer son emploi via la franchise : des perspectives qui dépendent de chacun;L'officiel de la franchise;;;;;;;; vol 147, pp. 15;;;;;;;;;;;;;;;;;;;;;;;;;;;
CREM-MM - 58 ;Perrigot Rozenn, Basset Guy, Briand Daniele, Cliquet Gérard;2014;;Network uniformity and risk of reclassification of the franchise contract;International Journal of Retail and Distribution Management;;;;;;;; vol 42 ,n° 10, pp. 884-901;;;;;;;;;;;;;;;;;;10.1108/IJRDM-06-2013-0129;;;;;;;;B;3;
CREM-MM - 59 ;Picot-Coupey Karine, Burt Steve L., Cliquet Gérard;2014;;Retailers׳ expansion mode choice in foreign markets: Antecedents for expansion mode choice in the light of internationalization theories;Journal of Retailing and Consumer Services;;;;;;;; vol 21 ,n° 6, pp. 976-991;;;;;;;;;;;;;;;;;;10.1016/j.jretconser.2014.08.018;;;;;;;;B;3;
CREM-MM - 60 ;Picot-Coupey Karine;2014;;The pop-up store as a foreign operation mode (FOM) for retailers;International Journal of Retail and Distribution Management;;;;;;;; vol 42 ,n° 7, pp. 643-670;;;;;;;;;;;;;;;;;;10.1108/IJRDM-01-2013-0032;;;;;;;;B;3;
CREM-MM - 61 ;Pin Anne-Claire, Picot-Coupey Karine, Droulers Olivier;2014;;Measuring the perceived risk of “gambling responsibly”;Journal de Gestion et d Economie Medicales;;;;;;;; vol 32 ,n° 3, pp. 227-239;;;;;;;;;;;;;;;;;;10.3917/jgem.143.0227;;;;;;;;;
CREM-MM - 62 ;Piot-Lepetit Isabelle, Perrigot Rozenn, Cliquet Gérard;2014;;Impact of the industry on franchise chain efficiency:a meta-DEA and context-dependent DEA approach;Journal of the Operational Research Society;;;;;;;; vol 65 ,n° 11, pp. 1692-1699;;;;;;;;;;;;;;;;;;10.1057/jors.2013.140;;;;;;;;A;2;
CREM-MM - 63 ;Piot-Lepetit Isabelle, Perrigot Rozenn, Cliquet Gérard;2014;;Organizational form and efficiency of franchise chains;International Journal of Retail and Distribution Management;;;;;;;; vol 42 ,n° 7, pp. 671-684;;;;;;;;;;;;;;;;;;10.1108/IJRDM-04-2013-0089;;;;;;;;B;3;
CREM-MM - 64 ;Poilpot-Rocaboy Gwénaëlle, Chevance Alain;2014;;Management et Prévention : Une analyse des accords et plans pénibilité en Bretagne;Semaine Sociale Lamy;;;;;;;; vol 1655 ,n° supplément spécial, pp. 107-112;;;;;;;;;;;;;;;;;;;;;;;;;;;
CREM-MEF - 52 ;Poutineau Jean-Christophe, Pentecôte Jean-Sébastien, Rondeau Fabien;2014;;Dynamique du commerce intra-européen et hétérogénéités entre la zone euro et les PECO;Studia Oeconomica Posnaniensia;;;;;;;; vol 2 ,n° 12, pp. 7-26;;;;;;;;;;;;;;;;;;;;;;;;;;;
CREM-MEF - 53 ;Poutineau Jean-Christophe, Vermandel Gauthier;2014;;Intégration bancaire et conjoncture macroéconomique dans une union monétaire hétérogène;Cahiers Economiques de Bruxelles;;;;;;;; vol 56 ,n° 3-4, pp. 241-260;;;;;;;;;;;;;;;;;;;;;;;;;;C;
CREM-EIEC - 57 ;Pénard Thierry, Rallet Alain;2014;;De l’économie des réseaux aux services en réseaux : nouveau paradigme, nouvelles orientations;Réseaux;;;;;;;; vol 2/3 ,n° 184-185, pp. 71-93;;;;;;;;;;;;;;;;;;10.3917/res.184-185.0071;;;;;;;;C;4;
CREM-MEF - 54 ;Rondeau Fabien, Roudaut Nolwenn;2014;;What Diversification of Trade Matters for Economic Growth of Developing Countries?;Economics Bulletin;;;;;;;; vol 34 ,n° 3, pp. 1485-1497;;;;;;;;;;;;;;;;;;;;;;;;;;B;3;
CREM-MM - 65 ;Roullet Bernard, Droulers Olivier;2014;;Décision managériale et neurosciences : une nouvelle vision de la gouvernance ?;Management & Avenir;;;;;;;; vol 69 ,n° 3, pp. 13-31;;;;;;;;;;;;;;;;;;10.3917/mav.069.0013;;;;;;;;C;
CREM-MM - 66 ;Ruiller Caroline, Van Der Heijden Beatrice, Patin-St-Mleux Bertille;2014;;The use of role playing in managerial learning: A socio constructivistic approach;Baltic Journal of Career Education and Management;;;;;;;; vol 2 ,n° 1, pp. 24-36;;;;;;;;;;;;;;;;;;;;;;;;;;;
CREM-EPCS - 59 ;Salladarré Frédéric, Hlaimi Boubaker;2014;;Women and part-time work in Europe;International Labour Review;;;;;;;; vol 153 ,n° 2, pp. 293-310;;;;;;;;;;;;;;;;;;;;;;;;;;B;3;
CREM-EIEC - 58 ;St-Pierre Josée, Defays Lucile, Benezech Danièle, Garcia Chantal;2014;;Le rôle du capital humain dans l’établissement de collaborations internationales des PME;Management International Review;;;;;;;; vol SPECIAL 2014 ,n° 18, pp. 72-84;;;;;;;;;;;;;;;;;;;;;;;;;;B;
CREM-EIEC - 59 ;Suire Raphaël, Vicente Jérôme;2014;;Clusters for life or life cycles of clusters: in search of the critical factors of clusters' resilience;Entrepreneurship and Regional Development;;;;;;;; vol 26 ,n° 1-2, pp. 142-164;;;;;;;;;;;;;;;;;;10.1080/08985626.2013.877985;;;;;;;;B;3;
CREM-MM - 67 ;Thiel Daniel, Vo Thi Le Hoa, Hovelaque Vincent;2014;;Forecasts impacts on sanitary risk during a crisis: a case study;International Journal of Logistics Management, The;;;;;;;; vol 25 ,n° 2, pp. 358-378;;;;;;;;;;;;;;;;;;10.1108/IJLM-04-2012-0028;;;;;;;;;3;
CREM-MEF - 55 ;Trowski Christophe;2014;;Acquisitions and Bidder Stock Valuations: Empirical Evidence from the French Market;Finance;;;;;;;; vol 35 ,n° 1, pp. 51-105;;;;;;;;;;;;;;;;;;;;;;;;;;;2;
CREM-EPCS - 60 ;Ujjayant Chakravorty, Hubert Marie-Hélène, Moreaux Michel;2014;;Land Allocation between Food and Energy;Frontiers of Economics in China;;;;;;;; vol 9 ,n° 1, pp. 52-69;;;;;;;;;;;;;;;;;;10.3868/s060-003-014-0004-8;;;;;;;;;
CREM-MM - 68 ;Valette A., Burellier F.;2014;;Quand l'habit fait le moine les chefs des pôles hospitaliers : devenir des hydrides " malgré tout " ?;Gérer et Comprendre. Annales des Mines;;;;;;;; ,n° n°116,p. 4-13;;;;;;;;;;;;;;;;;;;;;;;;;;C;4;
CREM-EPCS - 61 ;Vidu Laurent;2014;;Calcul par simulations du pouvoir des électeurs dans le cas de la loi électorale du 29 juin 1820;Revue économique;;;;;;;; vol 65 ,n° 3, pp. 669-680;;;;;;;;;;;;;;;;;;10.3917/reco.653.0669;;;;;;;;;3;
CREM-EIEC - 60 ;Zeroukhi Mourad, Pénard Thierry;2014;;open source software subsidies and network compatibility in a mixed duopoly;Economics Bulletin;;;;;;;; vol 34 ,n° 2, pp. 1174-1184;;;;;;;;;;;;;;;;;;;;;;;;;;B;3;
CREM-EIEC - 61 ;Abdellaoui Mohammed, Bleichrodt Han, L'haridon Olivier, Paraschiv Corina;2013;;Is There One Unifying Concept of Utility?An Experimental Comparison of Utility Under Risk and Utility Over Time;Management Science;;;;;;;; vol 59 ,n° 9, pp. 2153-2169;;;;;;;;;;;;;;;;;;10.1287/mnsc.1120.1690;;;;;;;;A;1;
CREM-EIEC - 62 ;Abdellaoui Mohammed, Bleichrodt Han, L’Haridon Olivier;2013;;Sign-dependence in intertemporal choice;Journal of Risk and Uncertainty;;;;;;;; vol 47 ,n° 3, pp. 225-253;;;;;;;;;;;;;;;;;;10.1007/s11166-013-9181-9;;;;;;;;A;2;
CREM-MEF - 56 ;Amadieu Paul, Maurel Carole, Viviani Jean-Laurent;2013;;Intangibles, Export Intensity, and Company Performance in the French Wine Industry;Journal of Wine Economics;;;;;;;; vol 8 ,n° 2, pp. 198-224;;;;;;;;;;;;;;;;;;;;;;;;;;B;
CREM-MEF - 57 ;André Le Pogamp Florence, Elbadraoui Khalid;2013;;Security design of callable convertible bonds and issuers' external financing costs;Brussels Economic Review;;;;;;;; vol 56 ,n° 1, pp. 57-77;;;;;;;;;;;;;;;;;;;;;;;;;;;
CREM-MEF - 58 ;Arouri Mohamed El Hedi, Ben Ameur Hachmi, Jawadi Nabila, Jawadi Fredj, Louhichi Waël;2013;;Are Islamic finance innovations enough for investors to escape from a financial downturn? Further evidence from portfolio simulations;Applied Economics;;;;;;;; vol 45 ,n° 24, pp. 3412-3420;;;;;;;;;;;;;;;;;;10.1080/00036846.2012.707776;;;;;;;;A;2;
CREM-EIEC - 63 ;Attema Arthur E., Brouwer Werner B.f., L’Haridon Olivier;2013;;Prospect theory in the health domain: A quantitative assessment;Journal of Health Economics;;;;;;;; vol 32 ,n° 6, pp. 1057-1065;;;;;;;;;;;;;;;;;;10.1016/j.jhealeco.2013.08.006;;;;;;;;A;1;
CREM-MEF - 59 ;Auray Stéphane, Eyquem Aurélien, Guimarães Luís, Poutineau Jean–Christophe;2013;;Comments on "The effect of a common currency on the volatility of the extensive margin of trade";Journal of International Money and Finance;;;;;;;; vol 33, pp. 426-431;;;;;;;;;;;;;;;;;;10.1016/j.jimonfin.2012.10.001;;;;;;;;A;2;
CREM-MM - 69 ;Ayadi Nawel, Giraud Magali, Gonzalez Christine;2013;;An investigation of consumers' self-control mechanisms when confronted with repeated purchase temptations: Evidence from online private sales;Journal of Retailing and Consumer Services;;;;;;;; vol 20 ,n° 3, pp. 272-281;;;;;;;;;;;;;;;;;;10.1016/j.jretconser.2013.01.010;;;;;;;;B;3;
CREM-EIEC - 64 ;Balland Pierre-Alexandre, Suire Raphaël, Vicente Jérôme;2013;;Structural and geographical patterns of knowledge networks in emerging technological standards: evidence from the European GNSS industry;Economics of Innovation and New Technology;;;;;;;; vol 22 ,n° 1, pp. 47-72;;;;;;;;;;;;;;;;;;10.1080/10438599.2012.699773;;;;;;;;A;2;
CREM-MM - 70 ;Baray Jérôme, Cliquet Gérard;2013;;Optimizing locations through a maximum covering/p-median hierarchical model: Maternity hospitals in France;Journal of Business Research;;;;;;;; vol 66 ,n° 1, pp. 127-132;;;;;;;;;;;;;;;;;;10.1016/j.jbusres.2012.09.003;;;;;;;;A;2;
CREM-EIEC - 65 ;Baslé Maurice;2013;;Méta‑évaluation des politiques publiques et qualité des évaluations;Revue Française d'Administration Publique;;;;;;;; vol 2013/4 ,n° 148, pp. 1017-1027;;;;;;;;;;;;;;;;;;10.3917/rfap.148.1017;;;;;;;;;4;
CREM-EIEC - 66 ;Bastié Françoise, Cieply Sylvie;2013;;Le prêt à la création d'entreprises est-il efficace ?;Revue Economique;;;;;;;; vol 64 ,n° 3, pp. 421-432;;;;;;;;;;;;;;;;;;10.3917/reco.643.0421;;;;;;;;;
CREM-EIEC - 67 ;Bastié Françoise, Cieply Sylvie, Cussy Pascal;2013;;The entrepreneur's mode of entry: the effect of social and financial capital;Small Business Economics;;;;;;;; vol 40 ,n° 4, pp. 865-877;;;;;;;;;;;;;;;;;;10.1007/s11187-011-9391-y;;;;;;;;A;2;
CREM-EPCS - 62 ;Baujard Antoinette, Gavrel Frédéric, Igersheim Herrade, Laslier Jean-François, Lebon Isabelle;2013;;Vote par approbation, vote par note : Une expérimentation lors des élections présidentielles du 22 avril 2012;Revue Economique;;;;;;;; vol 64 ,n° 2pp. 345-356;;;;;;;;;;;;;;;;;;;;;;;;;;;
CREM-EPCS - 63 ;Ben Zaied Younes;2013;;A long-run analysis of residential water consumption;Economics Bulletin;;;;;;;; vol 33 ,n° 1, pp. 536-544;;;;;;;;;;;;;;;;;;;;;;;;;;B;3;
CREM-EIEC - 68 ;Benezech Danièle, Karcher Thierry, Garcia Chantal;2013;;Dans quelle mesure l’orientation entrepreneuriale se traduit-elle en activités d’innovation dans les PME ?;Revue de l'Entrepreneuriat;;;;;;;; vol 12 ,n° 4, pp. 35-58;;;;;;;;;;;;;;;;;;;;;;;;;;;4;
CREM-EPCS - 64 ;Bigotta Maurizio, Oscar Gonzalez, Losa Fabio Beniamino;2013;;Free movement of people: joy or sorrow?;ValeurS;;;;;;;;, pp. 14-15;;;;;;;;;;;;;;;;;;;;;;;;;;;
CREM-EPCS - 65 ;Binet Marie-Estelle, Facchini François;2013;;Okun's Law in the French Regions: A Cross-Regional Comparison;Economics Bulletin;;;;;;;; vol 33 ,n° 1, pp. 420-433;;;;;;;;;;;;;;;;;;;;;;;;;;B;3;
CREM-EPCS - 66 ;Binet Marie-Estelle;2013;;The linear expenditure system and the demand for municipal public services: The median voter specification revisited;Urban Studies;;;;;;;; vol 50 ,n° 9, pp. 1689-1703;;;;;;;;;;;;;;;;;;10.1177/0042098012468341;;;;;;;;A;2;
CREM-EIEC - 69 ;Bocquet Rachel, Le Bas Christian, Mothe Caroline, Poussing Nicolas;2013;;Are firms with different CSR profiles equally innovative? Empirical analysis with survey data;European Management Journal;;;;;;;; vol 31 ,n° 6, pp. 642-654;;;;;;;;;;;;;;;;;;10.1016/j.emj.2012.07.001;;;;;;;;B;3;
CREM-MEF - 60 ;Bouaiss Karima, Lafontaine Jean-Philippe, Viviani Jean-Laurent;2013;;Crises environnementales, marchés financiers et communication environnementale des entreprises :;Revue des Sciences de Gestion (La RSG);;;;;;;; vol 263-264 ,n° 5, pp. 197-206;;;;;;;;;;;;;;;;;;10.3917/rsg.263.0197;;;;;;;;;
CREM-MEF - 61 ;Bouzgarrou Houssam, Navatte Patrick;2013;;Ownership structure and acquirers performance: Family vs. non-family firms;International Review of Financial Analysis;;;;;;;; ,n° 27, pp. 123-134;;;;;;;;;;;;;;;;;;10.1016/j.irfa.2013.01.002;;;;;;;;B;3;
CREM-MM - 71 ;Branellec Gurvan, Perrigot Rozenn;2013;;Franchise et e-commerce: une approche droit-marketing des problématiques liées à l'exclusivité territoriale;Décisions Marketing;;;;;;;; ,n° 71, pp. 31-44;;;;;;;;;;;;;;;;;;10.7193/DM.071.31.44;;;;;;;;B;4;
CREM-EPCS - 67 ;Bunel Mathieu, Gavrel Frédéric, Guironnet Jean-Pascal, Lebon Isabelle;2013;;Introduction au numéro spécial "Travail, emploi et politiques publiques";Revue d Economie Politique;;;;;;;; vol 123 ,n° 3, pp. 303-305;;;;;;;;;;;;;;;;;;;;;;;;;;B;
CREM-EPCS - 68 ;Bunel Mathieu;2013;;Evaluer un dispositif sectoriel d’aide à l’emploi : l’exemple des hôtels-cafés-restaurants;Revue Française d'Economie;;;;;;;; vol 28, pp. 73-121;;;;;;;;;;;;;;;;;;;;;;;;;;;
CREM-MEF - 62 ;Cadot Julien, Viviani Jean-Laurent;2013;;Contraintes financières et ordre de financement hiérarchique des entreprises agroalimentaires : une approche par données d'enquête;Économies et Sociétés série "systèmes agroalimentaires";;;;;;;; vol 35, pp. 1909-1929;;;;;;;;;;;;;;;;;;;;;;;;;;;
CREM-MEF - 63 ;Casares Miguel, Poutineau Jean-Christophe;2013;;Firm entry under financial frictions;Review of Development Economics;;;;;;;; vol 17 ,n° 2, pp. 301-318;;;;;;;;;;;;;;;;;;10.1111/rode.12033;;;;;;;;C;4;
CREM-EPCS - 69 ;Chakravorty Ujjayant, Hubert Marie-Hélène;2013;;Global impacts of the biofuel mandate under a carbon tax;American Journal of Agricultural Economics;;;;;;;; vol 95 ,n° 2, pp. 282-288;;;;;;;;;;;;;;;;;;10.1093/ajae/aas038;;;;;;;;A;1;
CREM-EPCS - 70 ;Chantreuil Frédéric, Trannoy Alain;2013;;Inequality decomposition values: the trade-off between marginality and efficiency;The Journal of Economic Inequality;;;;;;;; vol 11 ,n° 1, pp. 83-98;;;;;;;;;;;;;;;;;;10.1007/s10888-011-9207-y;;;;;;;;;
CREM-MEF - 64 ;Charles Amélie, Darné Olivier, Fouilloux Jessica;2013;;Market efficiency in the European carbon markets;Energy Policy;;;;;;;; vol 60, pp. 785-792;;;;;;;;;;;;;;;;;;10.1016/j.enpol.2013.05.036;;;;;;;;A;2;
CREM-EIEC - 70 ;Christin Clémence;2013;;Entry deterrence through cooperative R&D over-investment;Recherches Economiques de Louvain - Louvain economic review;;;;;;;; vol 79 ,n° 2, pp. 5-25;;;;;;;;;;;;;;;;;;10.3917/rel.792.0005;;;;;;;;B;
CREM-EIEC - 71 ;Cieply Sylvie;2013;;Le métier de chargé d’affaires entreprises en 2012 : la force de rappel de l’orthodoxie financière;Banques;;;;;;;; vol 765bis, pp. 44-46;;;;;;;;;;;;;;;;;;;;;;;;;;;
CREM-MM - 72 ;Cliquet Gérard, Guillo Pierre-Alain;2013;;Retail network spatial expansion: An application of the percolation theory to hard discounters;Journal of Retailing and Consumer Services;;;;;;;; vol 20 ,n° 2, pp. 173-181;;;;;;;;;;;;;;;;;;10.1016/j.jretconser.2012.11.005;;;;;;;;B;3;
CREM-MEF - 65 ;Cornée Simon, Szafarz Ariane;2013;;Vive la Différence: Social Banks and Reciprocity in the Credit Market;Journal of Business Ethics;;;;;;;; vol 125 ,n° 3, pp. 361-380;;;;;;;;;;;;;;;;;;10.1007/s10551-013-1922-9;;;;;;;;A;2;
CREM-EIEC - 72 ;Dang Nguyen Godefroy, Dejean Sylvain, Souquet Adrien;2013;;Les internautes moteurs des processus d'adoption et développement de l'e-gouvernement : une étude sur les communes bretonnes;Politiques et Management public;;;;;;;; vol 30 ,n° 1, pp. 29-49;;;;;;;;;;;;;;;;;;;;;;;;;;;
CREM-EIEC - 73 ;Dejean Sylvain, Pénard Thierry, Dang Nguyen Godefroy;2013;;La gratuité sur Internet : de la logique marchande à la logique communautaire;Réalités industrielles. Annales des mines;;;;;;;;, pp. 42-47;;;;;;;;;;;;;;;;;;;;;;;;;;;0;
CREM-EIEC - 74 ;Denant-Boèmont Laurent, L'haridon Olivier;2013;;La rationalité à l'épreuve de l'économie comportementale;Revue Française d'Economie;;;;;;;; vol XVIII ,n° 2, économie expérimentale et comportements, pp. 35-89;;;;;;;;;;;;;;;;;;;;;;;;;;;
CREM-EPCS - 71 ;Diaby Moussa, Ferrer Hélène, Valognes Fabrice;2013;;A social choice approach to primary resource management: The rubber tree case in Africa;Forest Policy and Economics;;;;;;;; vol 28, pp. 8-14;;;;;;;;;;;;;;;;;;10.1016/j.forpol.2013.01.002;;;;;;;;;0;
CREM-EPCS - 72 ;Doghmi Ahmed, Ziad Abderrahmane;2013;;On Partially Honest Nash Implementation in Private Good Economies with Restricted Domains: A Sufficient Condition;Journal of Institutional and Theoretical Economics;;;;;;;; vol 13 ,n° 1, pp. 415-428;;;;;;;;;;;;;;;;;;10.1515/bejte-2012-0028;;;;;;;;A;
CREM-EIEC - 75 ;Donfouet Hermann Pythagore Pierre, Mahieu Pierre-Alexandre, Malin Éric;2013;;Using respondents' uncertainty scores to mitigate hypothetical bias in community-based health insurance studies;European Journal of Health Economics;;;;;;;; vol 14 ,n° 2, pp. 277-285;;;;;;;;;;;;;;;;;;10.1007/s10198-011-0369-0;;;;;;;;A;2;
CREM-MM - 73 ;Droulers Olivier, Lajante Mathieu, Lacoste-Badie Sophie;2013;;Apport de la démarche neuroscientifique à la mesure des émotions: importation d'une nouvelle méthode de mesure de l'activité électrodermale;Décisions Marketing;;;;;;;; ,n° 72, pp. 87-101;;;;;;;;;;;;;;;;;;10.7193/DM.072.87.101;;;;;;;;B;4;
CREM-MM - 74 ;Droulers Olivier, Lajante Mathieu, Lacoste-Badie Sophie;2013;;Contribution of the neuroscience approach to the measurement of emotions: Importing a new EDA signal-processing method;Décisions Marketing;;;;;;;; ,n° 72, pp. 87-102;;;;;;;;;;;;;;;;;;;;;;;;;;B;4;
CREM-MM - 75 ;Droulers Olivier, Lajante Mathieu, Jamet Eric, Lacoste-Badie Sophie, Minvielle Morgane;2013;;Effet de la complexité visuelle du packaging sur l’attention portée à la marque;Revue des Sciences de Gestion;;;;;;;; vol 261-262, pp. 39-44;;;;;;;;;;;;;;;;;;;;;;;;;;;
CREM-MM - 76 ;Ducrocq Charles, Gervais Michel;2013;;Le coût complet par diplôme à l’université : quel apport vu les problèmes de mesure ?;Finance Contrôle Stratégie;;;;;;;; vol 16 ,n° 4, pp. 1-29;;;;;;;;;;;;;;;;;;10.4000/fcs.1417;;;;;;;;B;3;
CREM-MM - 77 ;Dumas Marc, Ruiller Caroline;2013;;Etre cadre de santé de proximité à l'hôpital, quels rôles à tenir ?;Revue de Gestion des Ressources Humaines;;;;;;;; ,n° 87, pp. 42-58;;;;;;;;;;;;;;;;;;;;;;;;;;;3;
CREM-EPCS - 73 ;Dutheil De La Rochère Ghislain, Josselin Jean-Michel, Rocaboy Yvon;2013;;SDI, NATO, and the Social Composition Function;Defence and Peace Economics;;;;;;;; vol 25 ,n° 2, pp. 85-95;;;;;;;;;;;;;;;;;;10.1080/10242694.2013.774772;;;;;;;;;E;
CREM-EIEC - 76 ;Figuieres Charles, Masclet David, Willinger Marc;2013;;Weak Moral Motivation Leads to the Decline of Voluntary Contributions;Journal of Public Economic Theory;;;;;;;; vol 15 ,n° 5, pp. 745-772;;;;;;;;;;;;;;;;;;10.1111/jpet.12036;;;;;;;;A;2;
CREM-EPCS - 74 ;Flammini Michele, Moscardelli Luca, Fanelli Angelo;2013;;Stackelberg strategies for network design games;Internet Mathematics;;;;;;;; vol 9 ,n° 4, pp. 336-359;;;;;;;;;;;;;;;;;;10.1080/15427951.2012.727772;;;;;;;;;
CREM-MM - 78 ;Gallopel Karine, Gabriel Patrick, Le Gall-Ely Marine, Rieunier Sophie, Urien Bertrand;2013;;Plain packaging and public health: the case of tobacco;Journal of Business Research;;;;;;;; vol 66 ,n° 1, pp. 133-136;;;;;;;;;;;;;;;;;;10.1016/j.jbusres.2012.09.004;;;;;;;;A;2;
CREM-MEF - 66 ;Garcia-Peñalosa Cecilia, Orgiazzi Elsa;2013;;Factor components of inequality : a cross-country study;Review of Income and Wealth;;;;;;;; vol 59 ,n° 4, pp. 689-727;;;;;;;;;;;;;;;;;;10.1111/roiw.12054;;;;;;;;A;
CREM-EPCS - 75 ;Grolier Jacques;2013;;Présentation de critères de gestion : la démarche de l'EPRD-EGESS;Finances hospitalières;;;;;;;; vol 72, pp. 6-14;;;;;;;;;;;;;;;;;;;;;;;;;;;0;
CREM-MM - 79 ;Hussain Dildar, Perrigot Rozenn, Mignonac Karim, El Akremi Asâad, Herrbach Olivier;2013;;Determinants of multi-unit franchising: an organizational economics framework;Managerial and Decision Economics;;;;;;;; ,n° 34, pp. 161-169;;;;;;;;;;;;;;;;;;10.1002/mde.2580;;;;;;;;B;3;
CREM-EIEC - 77 ;Jacquemet Nicolas, L'haridon Olivier, Morin Pierre;2013;;Économie expérimentale et comportements : introduction;Revue Française d'Economie;;;;;;;;, pp. 197;;;;;;;;;;;;;;;;;;;;;;;;;;;
CREM-MEF - 67 ;Jawadi Fredj, Louhichi Waël, Ben Ameur Hachmi;2013;;Do the US trends drive the UK-French market linkages?: empirical evidence from a threshold intraday analysis;Applied Economics Letters;;;;;;;; vol 20 ,n° 5, pp. 499-503;;;;;;;;;;;;;;;;;;10.1080/13504851.2012.714064;;;;;;;;C;4;
CREM-EPCS - 76 ;Josselin Jean-Michel, Padovano Fabio, Rocaboy Yvon;2013;;Grant legislation vs. political factors as determinants of soft budget spending behaviors. Comparison between Italian and French regions;The European Journal of Comparative Economics;;;;;;;; vol 10 ,n° 3, pp. 217-254;;;;;;;;;;;;;;;;;;;;;;;;;;B;3;
CREM-EIEC - 78 ;Kadohognon Ouattara Sylvain;2013;;Managerial incentives in mixed duopoly: the case of partial privatization;Revue d Economie Politique;;;;;;;; vol 123 ,n° 4, pp. 495-517;;;;;;;;;;;;;;;;;;10.3917/redp.234.0495;;;;;;;;B;
CREM-EPCS - 77 ;Kamwa Eric;2013;;The Kemeny rule and committees elections;Economics Bulletin;;;;;;;; vol 33 ,n° 1, pp. 648-654;;;;;;;;;;;;;;;;;;;;;;;;;;B;3;
