Auteurs;Année;Année de soutenance;Titre;Titre journal;Année;Volume;Issue;Editeur scientifique;Titre ouvrage;Titre du volume;Editeur revue;Volume, Issue, Pages;ISBN;Titre conférence;Commentaire;Date congrès;Ville;Pays;Patent n°;Date de publication;Type de rapport;N°;Organisme de délivrance;Pages;Date de publication;Directeur de thèse;Université de soutenance;Année de soutenance;Organisme de délivrance;DOI;NNT;Pubmed;Référence;ArXiv;Description;Voir aussi;Réf. HAL;Rang HCERES;Rang CNRS
Damouche A., Lazure T., Avettand-Fenoël V., Huot N., Dejucq-Rainsford N., Satie A.-P., Mélard A., David L., Gommet C., Ghosn J., Noel N., Pourcher G., Martinez V., Benoist S., Béréziat V.  et al.;2015;;Adipose Tissue Is a Neglected Viral Reservoir and an Inflammatory Site during Chronic HIV and SIV Infection;PLoS Pathogens;;11;9;;;;;e1005153;;;;;;;;;;;;;;;;;10.1371/journal.ppat.1005153;;26402858;;;;;;;
Danger Y., Danard S., Gringoire V., Peyrard T., Riou P., Semana G., Vérité F.;2015;;Characterization of a new human monoclonal antibody directed against the Vel antigen;Vox Sanguinis;;;;;;;;In press;;;;;;;;;;;;;;;;;10.1111/vox.12321;;26382919;;;;;;;
De Mercanti S. F., Rolla S., Cucci A., Bardina V., Vacca A., Cocco E., Vladic A., Soldo-Butkovic S., Habek M., Adamec I., Horakova D., Annovazzi P., Edan G., Novelli F., Durelli L.  et al.;2015;;T helper subsets changes in alemtuzumab multiple sclerosis treated patients: the recovery of immune system capacity as a possible indicator to treatment;Multiple Sclerosis;;21;11;;;;;550;;;;;;;;;;;;;;;;;;;;;;;;;;
De Müllenheim P.-Y., Chaudru S., Mahe G., Prioux J., Le Faucheur A.;2015;;Clinical Interest of Ambulatory Assessment of Physical Activity and Walking Capacity in Peripheral Artery Disease;Scandinavian Journal of Medicine & Science in Sports;;;;;;;;in press;;;;;;;;;;;;;;;;;10.1111/sms.12512;;26173488;;;;;;;
Defontaine A., Tirel O., Costet N., Beuchée A., Ozanne B., Gaillot T., Arnaud A. P., Wodey E.;2015;;Transvesical Intra-Abdominal Pressure Measurement in Newborn: What Is the Optimal Saline Volume Instillation?;Pediatric Critical Care Medicine;;;;;;;;;;;;;;;;;;;;;;;;;10.1097/PCC.0000000000000580;;26669641;;;;;;;
Dejeans N., Barroso K., Fernandez-Zapico M. E., Samali A., Chevet E.;2015;;Novel roles of the Unfolded Protein Response in the control of tumor development and aggressiveness;Seminars in Cancer Biology;;33;;;;;;67-73;;;;;;;;;;;;;;;;;10.1016/j.semcancer.2015.04.007;;25953433;;;;;;;
Delpla I., Jones T. G., Monteith D. T., Hughes D. D., Baurès E., Jung A.-V., Thomas O., Freeman C.;2015;;Heavy Rainfall Impacts on Trihalomethane Formation in Contrasting Northwestern European Potable Waters;Journal of Environmental Quality;;44;4;;;;;1241;;;;;;;;;;;;;;;;;10.2134/jeq2014.10.0442;;;;;;;;;
Denis B., Guiguet M., Castro N., Méchaï F., Revest M., Melica G., Costagliola D., Lortholary O.;2015;;Relevance of EORTC Criteria for the Diagnosis of Invasive Aspergillosis in HIV-Infected Patients, and Survival Trends Over a 20-Year Period in France;Clinical Infectious Diseases;;61;8;;;;;1273-1280;;;;;;;;;;;;;;;;;10.1093/cid/civ492;;26123932;;;;;;;
Desert R., Canlet C., Costet N., Cordier S., Bonvallot N.;2015;;Impact of maternal obesity on the metabolic profiles of pregnant women and their offspring at birth;Metabolomics;;11;6;;;;;1896-1907;;;;;;;;;;;;;;;;;10.1007/s11306-015-0836-1;;;;;;;;;
Devy R., Lehert P., Genty M., Edan G.;2015;;A revolutionary new way of looking at the link between quality of life (QoL) and multiple sclerosis (MS) progression;Multiple Sclerosis;;21;11;;;;;334-335;;;;;;;;;;;;;;;;;;;;;;;;;;
Dina C., Bouatia-Naji N., Tucker N., Delling F. N., Toomer K., Durst R., Perrocheau M., Fernandez-Friera L., Solis J., Investigators P., Le Tourneau T., Chen M.-H., Probst V., Bosse Y., Pibarot P.  et al.;2015;;Genetic association analyses highlight biological pathways underlying mitral valve prolapse;Nature Genetics;;;;;;;;In press;;;;;;;;;;;;;;;;;10.1038/ng.3383;;26301497;;;;;;;
Diotel N., Vaillant C., Kah O., Pellegrini E.;2015;;Mapping of Brain lipid binding protein (Blbp) in the brain of adult zebrafish, co-expression with aromatase B and links with proliferation;Gene expression patterns: GEP;;20;1;;;;;42-54;;;;;;;;;;;;;;;;;10.1016/j.gep.2015.11.003;;26611722;;;;;;;
Donadieu J., Bernard F., Noesel M. V., Barkaoui M., Bardet O., Mura R., Arico M., Piguet C., Gandemer V., Armari Alla C., Clausen N., Jeziorski E., Lambilliote A., Weitzman S., Henter J. I.  et al.;2015;;Cladribine and cytarabine in refractory multisystem Langerhans cell histiocytosis: results of an international phase 2 study;Blood;;126;12;;;;;1415-1423;;;;;;;;;;;;;;;;;10.1182/blood-2015-03-635151;;26194764;;;;;;;
Donal E., Feneon D., Galli E.;2015;;Reply to the Editor—LA function is not the only key for best selection of candidates for cardiac resynchronization therapy, but LA strain provides valuable information!;Heart Rhythm;;12;12;;;;;e141-e142;;;;;;;;;;;;;;;;;10.1016/j.hrthm.2015.08.024;;26291763;;;;;;;
Donal E., Behagel A., Feneon D.;2015;;Value of left atrial strain: a highly promising field of investigation;European Heart Journal - Cardiovascular Imaging;;16;4;;;;;356-357;;;;;;;;;;;;;;;;;10.1093/ehjci/jeu230;;25433030;;;;;;;
Dougados M., Soubrier M., Perrodeau E., Gossec L., Fayet F., Gilson M., Cerato M.-H., Pouplin S., Flipo R.-A., Chabrefy L., Mouterde G., Euller-Ziegler L., Schaeverbeke T., Fautrel B., Saraux A.  et al.;2015;;Impact of a nurse-led programme on comorbidity management and impact of a patient self-assessment of disease activity on the management of rheumatoid arthritis: results of a prospective, multicentre, randomised, controlled trial (COMEDRA);Annals of the Rheumatic Diseases;;74;9;;;;;1725-1733;;;;;;;;;;;;;;;;;10.1136/annrheumdis-2013-204733;;24872377;;;;;;;
Dubost C., Pasquier P., Kearns K., Ficko C., Rapp C., Wolff M., Richard J.-C., Diehl J.-L., Le Tulzo Y., Mérat S.;2015;;Preparation of an intensive care unit in France for the reception of a confirmed case of Ebola virus infection;Anaesthesia, Critical Care & Pain Medicine;;;;;;;;;;;;;;;;;;;;;;;;;10.1016/j.accpm.2015.10.002;;26620545;;;;;;;
Ducassou A., Gambart M., Munzer C., Padovani L., Carrie C., Haas-Kogan D., Bernier-Chastagner V., Demoor C., Claude L., Helfre S., Bolle S., Leseur J., Huchet A., Rubié H., Valteau-Couanet D.  et al.;2015;;Long-term side effects of radiotherapy for pediatric localized neuroblastoma;Strahlentherapie und Onkologie;;191;7;;;;;604-612;;;;;;;;;;;;;;;;;10.1007/s00066-015-0837-z;;;;;;;;;
Dupin C., Siproudhis L., Hénno S., Minjolle S., Arvieux C., Tattevin P.;2015;;Use of human papillomavirus genotyping and biomarkers for targeted screening of anal dysplasia in human immunodeficiency virus-infected patients;Digestive and Liver Disease;;47;5;;;;;423-428;;;;;;;;;;;;;;;;;10.1016/j.dld.2015.01.150;;25682992;;;;;;;
Dusseux P., Zhao Y., Cordier M.-O., Corpetti T., Delaby L., Gascuel C., Hubert-Moy L.;2015;;PaturMata, a model to manage grassland under climate change.;Agronomy for Sustainable Development;;35;3;;;;;1087-1093;;;;;;;;;;;;;;;;;;;;;;;;;;
Edan G., Freedman M., Montalban X., Miller D., Hartung H., Hemmer B., Fox E., Barkhof F., Schippling S., Schulze A., Pleimes D., Pohl C., Sandbrink R., Suarez G., Wicklein E.-M.  et al.;2015;;Long-term Impact of Early MS Treatment with Interferon Beta-1b (IFNB-1b): Clinical, MRI, Employment, and Patient-Reported Outcomes (PROs) at the 11-Year Follow-up of BENEFIT (BENEFIT 11) (P7.012);Neurology;;84;14 Supplement;;;;;P7.012;;;;;;;;;;;;;;;;;;;;;;;;;;
Edeline J., Coulouarn C., Crouzet L., Pracht M., Lepareur N., Clément B., Garin E.;2015;;Gemcitabine and Oxaliplatin, but Not Sorafenib or Paclitaxel, Have a Synergistic Effect with Yttrium-90 in Reducing Hepatocellular Carcinoma and Cholangiocarcinoma Cell Line Viability;Journal of vascular and interventional radiology: JVIR;;26;12;;;;;1874-1878.e2;;;;;;;;;;;;;;;;;10.1016/j.jvir.2015.06.032;;26596183;;;;;;;
Edeline J., Crouzet L., Campillo-Gimenez B., Rolland Y., Pracht M., Guillygomarc'h A., Boudjema K., Lenoir L., Adhoute X., Rohou T., Boucher E., Clément B., Blanc J.-F., Garin E.;2015;;Selective internal radiation therapy compared with sorafenib for hepatocellular carcinoma with portal vein thrombosis;European Journal of Nuclear Medicine and Molecular Imaging;;;;;;;;;;;;;;;;;;;;;;;;;10.1007/s00259-015-3210-7;;26455499;;;;;;;
El Chehadeh S., Faivre L., Mosca-Boidron A.-L., Malan V., Amiel J., Nizon M., Touraine R., Prieur F., Pasquier L., Callier P., Lefebvre M., Marle N., Dubourg C., Julia S., Sarret C.  et al.;2015;;Large national series of patients with Xq28 duplication involving MECP2: Delineation of brain MRI abnormalities in 30 affected patients;American Journal of Medical Genetics. Part A;;;;;;;;;;;;;;;;;;;;;;;;;10.1002/ajmg.a.37384;;26420639;;;;;;;
El Khattabi L., Jaillard S., Andrieux J., Pasquier L., Perrin L., Capri Y., Benmansour A., Toutain A., Marcorelles P., Vincent-Delorme C., Journel H., Henry C., De Barace C., Devisme L., Dubourg C.  et al.;2015;;Clinical and molecular delineation of Tetrasomy 9p syndrome: Report of 12 new cases and literature review;American Journal of Medical Genetics Part A;;167;6;;;;;1252-1261;;;;;;;;;;;;;;;;;10.1002/ajmg.a.36932;;25847481;;;;;;;
Emond C., Britos T. N.;2015;;Human Risk Assessment and Its Application to Nanotechnology: A Challenge for Assessors;Journal of Physics: Conference Series;;617;;;;;;012039;;;;;;;;;;;;;;;;;10.1088/1742-6596/617/1/012039;;;;;;;;;
Emrani Bidi R., Rébillard A., Lefeuvre L., Gratas-Delamarche A., Davies K. J. A., Cillard J.;2015;;The Calcineurin Antagonist, RCAN1-4 is Induced by Exhaustive Exercise in Rat Skeletal Muscle;Free Radical Biology and Medicine;;87;;;;;;290-299;;;;;;;;;;;;;;;;;10.1016/j.freeradbiomed.2015.06.023;;26122706;;;;;;;
Etchevers A., Glorennec P., Le Strat Y., Lecoffre C., Bretin P., Le Tertre A.;2015;;Screening for Elevated Blood Lead Levels in Children: Assessment of Criteria and a Proposal for New Ones in France;International Journal of Environmental Research and Public Health;;12;12;;;;;15366-15378;;;;;;;;;;;;;;;;;10.3390/ijerph121214989;;26633457;;;;;;;
Fagherazzi G., Vilier A., Affret A., Balkau B., Bonnet F., Clavel-Chapelon F.;2015;;The association of body shape trajectories over the life course with type 2 diabetes risk in adulthood: a group-based modeling approach;Annals of Epidemiology;;25;10;;;;;785-787;;;;;;;;;;;;;;;;;10.1016/j.annepidem.2015.06.002;;26254818;;;;;;;
Faghihi-Kashani S., Bonnet F., Hafezi-Nejad N., Heidari B., Aghajani Nargesi A., Sheikhbahaei S., Ebadi M., Esteghamati A.;2015;;Fasting hyperinsulinaemia and 2-h glycaemia predict coronary heart disease in patients with type 2 diabetes;Diabetes and Metabolism;;;;;;;;;;;;;;;;;;;;;;;;;10.1016/j.diabet.2015.10.001;;26531321;;;;;;;
Fares-Taie L., Gerber S., Tawara A., Ramirez-Miranda A., Douet J.-Y., Verdin H., Guilloux A., Zenteno J. C., Kondo H., Moisset H., Passet B., Yamamoto K., Iwai M., Tanaka T., Nakamura Y.  et al.;2015;;Submicroscopic Deletions at 13q32.1 Cause Congenital Microcoria.;American Journal of Human Genetics;;96;4;;;;;631-639;;;;;;;;;;;;;;;;;10.1016/j.ajhg.2015.01.014;;25772937;;;;;;;
Feillant M., Jezequel C., Lison H., Delluc A., Tanné F., Le Gruyer A., Ben Ali Z., Renard I., Latournerie M., Deugnier Y., Garioud A., Cadranel J.-F., Guyader D., Robaszkiewicz M., Nousbaum J.-B.;2015;;Chronic hepatitis C: treat or wait? A prospective study on reasons for treatment or nontreatment in the era of first-generation protease inhibitors;EUROPEAN JOURNAL OF GASTROENTEROLOGY & HEPATOLOGY;;;;;;;;;;;;;;;;;;;;;;;;;10.1097/MEG.0000000000000506;;26560750;;;;;;;
Feuillet T., Saint-Jalmes H., Seurin M.-J., Bordelois A., Beuf O.;2015;;Universal radio-frequency receive-coil connector: Concept and validation at 3 T;Concepts in Magnetic Resonance Part B: Magnetic Resonance Engineering;;45;3;;;;;125-133;;;;;;;;;;;;;;;;;10.1002/cmr.b.21291;;;;;;;;;
Feuillâtre H., Nunes J.-C., Toumoulin C.;2015;;An improved graph matching algorithm for the spatio-temporal matching of a coronary artery 3D tree sequence;IRBM;;;;;;;;;;;;;;;;;;;;;;;;;10.1016/j.irbm.2015.09.002;;;;;;;;;
Fitzgerald K. C., Munger K., Freedman M. S., Hartung H.-P., Montalban X., Edan G., Barkhof F., Sandbrink R., Kappos L., Suarez G., Pohl C., Ascherio A.;2015;;Vitamin D and the development and evolution of permanent black holes among patients with clinically isolated syndrome;Multiple Sclerosis;;21;11;;;;;399-400;;;;;;;;;;;;;;;;;;;;;;;;;;
Foley F., Penner I.-K., Edan G., Freedman M. S., Montalban X., Hartung H.-P., Hemmer B., Fox E. J., Barkhof F., Schippling S., Koelbach R., Pleimes D., Pohl C., Sandbrink R., Suarez G.  et al.;2015;;Impact of early treatment of MS with interferon beta-1b: cognitive outcomes at the 11-year follow-up of BENEFIT (BENEFIT 11);Multiple Sclerosis;;21;11;;;;;249-251;;;;;;;;;;;;;;;;;;;;;;;;;;
Forouzanfar M. H., Alexander L., Anderson H. R., Bachman V. F., Biryukov S., Brauer M., Burnett R., Casey D., Coates M. M., Cohen A., Delwiche K., Estep K., Frostad J. J., Astha K. C., Kyu H. H.  et al.;2015;;Global, regional, and national comparative risk assessment of 79 behavioural, environmental and occupational, and metabolic risks or clusters of risks in 188 countries, 1990-2013: a systematic analysis for the Global Burden of Disease Study 2013.;Lancet;;386;10010;;;;;2287-323;;;;;;;;;;;;;;;;;;;26364544;;;;;;;
Fumery M., Chambrun G. P., Stefanescu C., Buisson A., Bressenot A., Beaugerie L., Amiot A., Altwegg R., Savoye G., Abitbol V., Bouguen G., Simon M., Duffas J.-P., Hebuterne X., Nancey S.  et al.;2015;;Detection of Dysplasia or Cancer in 3.5% of Patients with Inflammatory Bowel Disease and Colonic Strictures;Clinical Gastroenterology and Hepatology;;13;10;;;;;1770-1775;;;;;;;;;;;;;;;;;10.1016/j.cgh.2015.04.185;;26001338;;;;;;;
Galderisi M., Cardim N., D'andrea A., Bruder O., Cosyns B., Davin L., Donal E., Edvardsen T., Freitas A., Habib G., Kitsiou A., Plein S., Petersen S. E., Popescu B. A., Schroeder S.  et al.;2015;;The multi-modality cardiac imaging approach to the Athlete's heart: an expert consensus of the European Association of Cardiovascular Imaging;European Heart Journal - Cardiovascular Imaging;;16;4;;;;;353-353r;;;;;;;;;;;;;;;;;10.1093/ehjci/jeu323;;25681828;;;;;;;
Gall-David S. L., Zenbaa N., Bouchard D., Lavault M.-T., Bonnaure-Mallet M., Jolivet-Gougeon A., Bousarghin L.;2015;;Hypermutator Salmonella Heidelberg induces an early cell death in epithelial cells;Veterinary Microbiology;;180;1-2;;;;;65-74;;;;;;;;;;;;;;;;;10.1016/j.vetmic.2015.07.034;;2632060;;;;;;;
Galli E., Guirette Y., Feneon D., Daudin M., Fournet M., Leguerrier A., Flécher E., Mabo P., Donal E.;2015;;Prevalence and prognostic value of right ventricular dysfunction in severe aortic stenosis;European Heart Journal - Cardiovascular Imaging;;16;5;;;;;531-538;;;;;;;;;;;;;;;;;10.1093/ehjci/jeu290;;25539785;;;;;;;
Gannon T., Perveen R., Schlecht H., Ramsden S., Anderson B., Kerr B., Day R., Banka S., Suri M., Berland S., Gabbett M., Ma A., Lyonnet S., Cormier-Daire V., Yilmaz R.  et al.;2015;;Further delineation of the KAT6B molecular and phenotypic spectrum;European journal of human genetics: EJHG;;23;9;;;;;1165-1170;;;;;;;;;;;;;;;;;10.1038/ejhg.2014.248;;25424711;;;;;;;
Garin E., Rolland Y., Laffont S., Edeline J.;2015;;Clinical impact of (99m)Tc-MAA SPECT/CT-based dosimetry in the radioembolization of liver malignancies with (90)Y-loaded microspheres;European Journal of Nuclear Medicine and Molecular Imaging;;;;;;;;In press;;;;;;;;;;;;;;;;;10.1007/s00259-015-3157-8;;26338177;;;;;;;
Gaudriot B., Uhel F., Gregoire M., Gacouin A., Biedermann S., Roisne A., Flécher E., Le Tulzo Y., Tarte K., Tadié J.-M.;2015;;Immune Dysfunction After Cardiac Surgery with Cardiopulmonary Bypass: Beneficial Effects of Maintaining Mechanical Ventilation;Shock (Augusta, Ga.);;44;3;;;;;228-233;;;;;;;;;;;;;;;;;10.1097/SHK.0000000000000416;;26052959;;;;;;;
Gautier M., Godeberge P., Ganansia R., Bozio G., Godart B., Bigard M. A., Barthet M., Siproudhis L.;2015;;Easy clip to treat anal fistula tracts: a word of caution;International Journal of Colorectal Disease;;30;5;;;;;621-624;;;;;;;;;;;;;;;;;10.1007/s00384-015-2146-5;;25675886;;;;;;;
Gelu-Simeon M., Bayan T., Ostos M., Boufassa F., Teicher E., Steyaert J.-M., Bertucci I., Anty R., Pageaux G.-P., Meyer L., Duclos-Vallée J.-C.;2015;;MELD Score Kinetics in Decompensated HIV+/HCV+ Patients: A Useful Prognostic Tool (ANRS HC EP 25 PRETHEVIC Cohort Study);Medicine;;94;30;;;;;e1239;;;;;;;;;;;;;;;;;10.1097/MD.0000000000001239;;26222860;;;;;;;
Gemmel M., Rayen I., Lotus T., Donkelaar E., Steinbusch H. W., De Lacalle S., Kokras N., Dalla C., Pawluski J. L.;2015;;Developmental fluoxetine and prenatal stress effects on serotonin, dopamine, and synaptophysin density in the PFC and hippocampus of offspring at weaning;Developmental Psychobiology;;;;;;;;;;;;;;;;;;;;;;;;;10.1002/dev.21372;;26477449;;;;;;;
Germain C., Guillaudeux T., Galsgaard E. D., Hervouet C., Tekaya N., Gallouët A.-S., Fassy J., Bihl F., Poupon G., Lazzari A., Spee P., Anjuère F., Pangault C., Tarte K., Tas P.  et al.;2015;;Lectin-like transcript 1 is a marker of germinal center-derived B-cell non-Hodgkin's lymphomas dampening natural killer cell functions;OncoImmunology;;4;8;;;;;e1026503;;;;;;;;;;;;;;;;;10.1080/2162402X.2015.1026503;;26405582;;;;;;;
Gernigon M., Fouasson-Chailloux A., Colas-Ribas C., Noury-Desvaux B., Le Faucheur A., Abraham P.;2015;;Test-retest Reliability of GPS derived Measurements in Patients with Claudication;European Journal of Vascular and Endovascular Surgery;;;;;;;;In press;;;;;;;;;;;;;;;;;10.1016/j.ejvs.2015.07.009;;;;;;;;;
Ghesquières H., Slager S. L., Jardin F., Veron A. S., Asmann Y. W., Maurer M. J., Fest T., Habermann T. M., Bene M. C., Novak A. J., Mareschal S., Haioun C., Lamy T., Ansell S. M., Tilly H.  et al.;2015;;Genome-Wide Association Study of Event-Free Survival in Diffuse Large B-Cell Lymphoma Treated With Immunochemotherapy;Journal of Clinical Oncology: Official Journal of the American Society of Clinical Oncology;;33;33;;;;;3930-3937;;;;;;;;;;;;;;;;;10.1200/JCO.2014.60.2573;;26460308;;;;;;;
Gibbs P., Hazel G. A., Heinemann V., Sharma N. K., Findlay M. P. N., Ricke J., Peeters M., Perez D., Robinson B., Strickland A., Ferguson T., Rodrigez J., Kroening H., Wolf I., Ganju V.  et al.;2015;;SIRFLOX: Randomized phase III trial comparing first-line mFOLFOX6 \+/-\ bevacizumab (bev) versus mFOLFOX6 + selective internal radiation therapy (SIRT) \+/-\ bev in patients (pts) with metastatic colorectal cancer (mCRC);Asia-Pacific Journal of Clinical Oncology;;11;Special issue: ASCO Annual Meeting;;;;;68-69;;;;;;;;;;;;;;;;;;;;;;;;;;
Girard A., Jouneau S., Chabanne C., Khouatra C., Lannes M., Traclet J., Turquier S., Delaval P., Cordier J.-F., Cottin V.;2015;;Severe Pulmonary Hypertension Associated with COPD: Hemodynamic Improvement with Specific Therapy;Respiration; International Review of Thoracic Diseases;;90;3;;;;;220-228;;;;;;;;;;;;;;;;;10.1159/000431380;;26277885;;;;;;;
Gold M. R., Daubert C., Abraham W. T., Ghio S., St. John Sutton M., Hudnall J. H., Cerkvenik J., Linde C.;2015;;The effect of reverse remodeling on long-term survival in mildly symptomatic patients with heart failure receiving cardiac resynchronization therapy: Results of the REVERSE study;Heart Rhythm;;12;3;;;;;524-530;;;;;;;;;;;;;;;;;10.1016/j.hrthm.2014.11.014;;25460860;;;;;;;
Grillet G., Marjanovic N., Diverrez J.-M., Tattevin P., Tadié J.-M., L’Her E.;2015;;Intensive care medical procedures are more complicated, more stressful, and less comfortable with Ebola personal protective equipment: A simulation study;Journal of Infection;;71;6;;;;;703-706;;;;;;;;;;;;;;;;;10.1016/j.jinf.2015.09.003;;26391677;;;;;;;
Grouin A., Brochard C., Siproudhis L., Lévêque J., Bretagne J.-F., Poulain P., Bouguen G.;2015;;Perianal Crohn's disease results in fewer pregnancies but is not exacerbated by vaginal delivery;Digestive and Liver Disease;;;;;;;;In press;;;;;;;;;;;;;;;;;10.1016/j.dld.2015.08.001;;;;;;;;;
Gryn A., Peyronnet B., Manunta A., Beauval J.-B., Bounasr E., Nouhaud F.-A., Rioux-Leclercq N., Caron P., Thoulouzan M., Verhoest G., Soulié M., Bensalah K., Huyghe E.;2015;;Patient selection for laparoscopic excision of adrenal metastases: a multicenter cohort study;International Journal of Surgery;;24 Part A;;;;;;75-80;;;;;;;;;;;;;;;;;10.1016/j.ijsu.2015.10.038;;;;;;;;;
Guerrier D., Folléa N., Voltzenlogel M. C., Pasquier L., Morcel K.;2015;;Mutational Analysis of the LHX1 Gene in a French National Cohort of Patients with Mayer-Rokitansky-Küster-Hauser Syndrome;Journal of Genital System & Disorders;;4;;;;;;2;;;;;;;;;;;;;;;;;10.4172/2325-9728.1000137;;;;;;;;;
Guihaire J., Revest M., Heautot J.-F., Verhoye J.-P.;2015;;Frozen elephant trunk procedure for extensive pneumococcal thoracic aortitis;Asian cardiovascular & thoracic annals;;;;;;;;;;;;;;;;;;;;;;;;;10.1177/0218492315609836;;26424746;;;;;;;
Guillien A., Puyraveau M., Soumagne T., Guillot S., Rannou F., Marquette D., Berger P., Jouneau S., Monnet E., Mauny F., Laplante J.-J., Dalphin J.-C., Degano B.;2015;;Prevalence and risk factors for COPD in farmers: a cross-sectional controlled study;The European Respiratory Journal;;47;1;;;;;;;;;;;;;;;;;;;;;;10.1183/13993003.00153-2015;;26453630;;;;;;;
Gély-Pernot A., Hao C., Becker E., Stuparevic I., Kervarrec C., Chalmel F., Primig M., Jégou B., Smagulova F.;2015;;The epigenetic processes of meiosis in male mice are broadly affected by the widely used herbicide atrazine;BMC Genomics;;16;1;;;;;885;;;;;;;;;;;;;;;;;10.1186/s12864-015-2095-y;;26518232;;;;;;;
Hardonnière K., Huc L., Podechard N., Fernier M., Tekpli X., Gallais I., Sergent O., Lagadic-Gossmann D.;2015;;Benzo[a]pyrene-induced nitric oxide production acts as a survival signal targeting mitochondrial membrane potential;Toxicology in Vitro;;29;7;;;;;1597-1608;;;;;;;;;;;;;;;;;10.1016/j.tiv.2015.06.010;;26086121;;;;;;;
Harnoy Y., Rayar M., Levi Sandri G. B., Zamreek A., Turner K., Sulpice L., Boudjema K., Meunier B.;2015;;Intravascular Leiomyomatosis with Intracardiac Extension;Annals of Vascular Surgery;;;;;;;;In press;;;;;;;;;;;;;;;;;10.1016/j.avsg.2015.06.094;;;;;;;;;
Harnoy Y., Desfourneaux V., Bouguen G., Rayar M., Meunier B., Siproudhis L., Boudjema K., Sulpice L.;2015;;Sexuality and fertility outcomes following hand-sewn versus stapled ileal pouch anal anastomosis for ulcerative colitis;Journal of Surgical Research;;;;;;;;In press;;;;;;;;;;;;;;;;;10.1016/j.jss.2015.06.054;;;;;;;;;
Hascoet P., Chesnel F., Le Goff C., Le Goff X., Arlot-Bonnemains Y.;2015;;Unconventional functions of mitotic kinases in kidney tumorigenesis;Molecular and Cellular Oncology;;;;;;;;241;;;;;;;;;;;;;;;;;10.3389/fonc.2015.00241;;;;;;;;;
Hes O., Compérat E. M., Rioux-Leclerc N.;2015;;Clear cell papillary renal cell carcinoma, renal angiomyoadenomatous tumor and renal cell carcinoma with leiomyomatous stroma-relationship of three types of renal tumors: A review;Annals of Diagnostic Pathology;;;;;;;;In press;;;;;;;;;;;;;;;;;10.1016/j.anndiagpath.2015.11.003;;;;;;;;;
Hetz C., Chevet E., Oakes S. A.;2015;;Erratum: Proteostasis control by the unfolded protein response;Nature Cell Biology;;17;8;;;;;1088;;;;;;;;;;;;;;;;;10.1038/ncb3221;;26239530;;;;;;;
Hetz C., Chevet E.;2015;;THEME SERIES - UPR in Cancer;Seminars in Cancer Biology;;33;;;;;;1-2;;;;;;;;;;;;;;;;;10.1016/j.semcancer.2015.04.008;;25957480;;;;;;;
Houot R., Schultz L. M., Marabelle A., Kohrt H.;2015;;T-cell-based Immunotherapy: Adoptive Cell Transfer and Checkpoint Inhibition;Cancer Immunology Research;;3;10;;;;;1115-1122;;;;;;;;;;;;;;;;;10.1158/2326-6066.CIR-15-0190;;26438444;;;;;;;
Humeau-Heurtier A., Mahé G., Abraham P.;2015;;Multi-Dimensional Complete Ensemble Empirical Mode Decomposition With Adaptive Noise Applied to Laser Speckle Contrast Images;IEEE transactions on medical imaging;;34;10;;;;;2103-2117;;;;;;;;;;;;;;;;;10.1109/TMI.2015.2419711;;25850087;;;;;;;
Iszatt N., Stigum H., Verner M.-A., White R. A., Govarts E., Palkovicova Murinova L., Schoeters G., Trnovec T., Legler J., Pelé F., Botton J., Chevrier C., Wittsiepe J., Ranft U., Vandentorren S.  et al.;2015;;Prenatal and Postnatal Exposure to Persistent Organic Pollutants and Infant Growth: A Pooled Analysis of Seven European Birth Cohorts;Environmental Health Perspectives;;123;7;;;;;730-736;;;;;;;;;;;;;;;;;10.1289/ehp.1308005;;25742056;;;;;;;
Iung B., Doco-Lecompte T., Chocron S., Strady C., Delahaye F., Le Moing V., Poyart C., Alla F., Cambau E., Tattevin P., Chirouze C., Obadia J.-F., Duval X., Hoen B.;2015;;Cardiac surgery during the acute phase of infective endocarditis: discrepancies between European Society of Cardiology guidelines and practices;European Heart Journal;;;;;;;;;;;;;;;;;;;;;;;;;10.1093/eurheartj/ehv650;;26685134;;;;;;;
Jabouille A., Delugin M., Pineau R., Dubrac A., Soulet F., Lhomond S., Pallares-Lupon N., Prats H., Bikfalvi A., Chevet E., Touriol C., Moenner M.;2015;;Glioblastoma invasion and cooption depend on IRE1α endoribonuclease activity;Oncotarget;;;;;;;;In press;;;;;;;;;;;;;;;;;10.18632/oncotarget.4679;;26325176;;;;;;;
Joste M., Mendes V., Tixier S., Palpacuer C., Laviolle B., Lévêque J., Ouldamer L.;2015;;Non-menopausal Status, High Nuclear Grade, Tumor Size \textgreater30 mm and Positive Resection Margins Are Predictors of Residual Tumor After Lumpectomy for Ductal Carcinoma In Situ of the Breast;Anticancer Research;;35;6;;;;;3471-3477;;;;;;;;;;;;;;;;;;;26026112;;;;;;;
Just P.-A., Poncy A., Charawi S., Dahmani R., Traore M., Dumontet T., Drouet V., Dumont F., Gilgenkrantz H., Colnot S., Terris B., Coulouarn C., Lemaigre F., Perret C.;2015;;LKB1 and Notch Pathways Interact and Control Biliary Morphogenesis;PLoS ONE;;10;12;;;;;e0145400;;;;;;;;;;;;;;;;;10.1371/journal.pone.0145400;;26689699;;;;;;;
