Auteurs;Année;Année de soutenance;Titre;Titre journal;Année;Volume;Issue;Editeur scientifique;Titre ouvrage;Titre du volume;Editeur revue;Volume, Issue, Pages;ISBN;Titre conférence;Commentaire;Date congrès;Ville;Pays;Patent n°;Date de publication;Type de rapport;N°;Organisme de délivrance;Pages;Date de publication;Directeur de thèse;Université de soutenance;Année de soutenance;Organisme de délivrance;DOI;NNT;Pubmed;Référence;ArXiv;Description;Voir aussi;Réf. HAL;Rang HCERES;Rang CNRS
Abbott B. W., Jones J., Schuur E., Chapin F. S., Bowden W., Bret-Harte M. S., Epstein H., Flannigan M., Harms T. K., Hollingsworth T., Mack M., Mcguire A. D., Natali S. M., Rocha A., Tank S. E., Turetsky M. R., Vonk J. E., Wickland K. P., Aiken G., Alexander H., Amon R. M., Benscoter B., Bergeron Y., Bishop K., Blarquez O., Bond-Lamberty B., Breen A., Buffam I., Cai Y., Carcaillet C., Carey S. K., Chen J. M., Chen H. Y., Christensen T. R., Cooper L. W., Cornelissen J. H. C., De Groot W. J., Deluca T. H., Dorrepaal E., Fetcher N., Finlay J. C., Forbes B. C., French N. H., Gauthier S., Girardin M. P., Goetz S., Goldammer J. G., Gough L., Grogan P., Guo L., Higuera P. E., Hinzman L., Hu F. S., Hugelius G., Jafarov E., Jandt R., Johnstone J. F., Karlsson J., Kasischke E. S., Kattner G., Kelly R., Keuper F., Kling G. W., Kortelainen P., Kouki J., Kuhry P., Laudon H., Laurion I., Macdonald R., Mann P. J., Martikainen P. J., Mc Clelland J. W., Molau U., Oberbauer S. F., Olefeldt D., Paré D., Parisien M.-A., Payette S., Peng C., Pokrovsky O. S., Rastetter E. B., Raymond P. A., Raynolds M., Rein G., Reynolds J. F., Robard M., Rogers B. M., Schädel C., Schaefer K., Schmidt I. K. K., Shvidenko A., Sky J., Spencer R. G., Starr G., Striegl R. G., Teisserenc R., Tranvik L. J., Virtanen T., Welker J. M., Zimov S.;2016;;Biomass offsets little or none of permafrost carbon release from soils, streams, and wild␣re: an expert assessment;Environmental Research Letters;;11;;;;;;1-13;;;;;;;;;;;;;;;;;10.1088/1748-9326/11/3/034014;;;;;;;;;
Bartish I. V., Ozinga W. A., Bartish M. I., Wamelink G. W. W., Hennekens S. M., Prinzing A.;2016;;Different habitats within a region contain evolutionary heritage from different epochs depending on the abiotic environment;Global Ecology and Biogeography;;25;;;;;;274-285;;;;;;;;;;;;;;;;;10.1111/geb.12408;;;;;;;;;
Boutte J., Aliaga B., Lima O., Carvalho J. F. D., Aïnouche A., Macas J., Rousseau-Gueutin M., Coriton O., Ainouche M., Salmon A.;2016;;Haplotype Detection from Next-Generation Sequencing in High-Ploidy-Level Species: 45S rDNA Gene Copies in the Hexaploid Spartina maritima;G3;;6;1;;;;;29-40;;;;;;;;;;;;;;;;;10.1534/g3.115.023242;;26530424;;;;;;;
Briand E., Humbert J.-F., Tambosco K., Bormans M., Gerwick W. H.;2016;;Role of bacteria in the production and degradation of Microcystis cyanopeptides;MicrobiologyOpen;;;;;;;;;;;;;;;;;;;;;;;;;10.1002/mbo3.343;;;;;;;;;
Cañedo-Argüelles M., Hawkins C. P., Kefford B. J., Schäfer R. B., Dyack B. J., Brucet S., Buchwalter D., Dunlop J., Frör O., Lazorchak J., Coring E., Fernandez H. R., Goodfellow W., Achem A. L. G., Hatfield-Dodds S., Karimov B. K., Mensah P., Olson J. R., Piscart C., Prat N., Ponsá S., Schulz C.-J., Timpano A. J.;2016;;WATER. Saving freshwater from salts;Science (New York, N.Y.);;351;6276;;;;;914-916;;;;;;;;;;;;;;;;;10.1126/science.aad3488;;26917752;;;;;;;
Chapelain A., Pimbert P., Aubé L., Perrocheau O., Barbu S., Debunne G., Bellido A., Blois-Heulin C.;2016;;Correction: Can Population-Level Laterality Stem from Social Pressures? Evidence from Cheek Kissing in Humans;PLoS ONE;;11;1;;;;;e0148456;;;;;;;;;;;;;;;;;10.1371/journal.pone.0148456;;;;;;;;;
Couée I.;2016;;Hidden Attraction: Empirical Rationality in GMO Opposition;Trends in Plant Science;;21;2;;;;;91;;;;;;;;;;;;;;;;;10.1016/j.tplants.2015.12.002;;26712079;;;;;;;
Cramer E. R. A., Stensrud E., Marthinsen G., Hogner S., Johannessen L. E., Laskemoen T., Eybert M.-C., Slagsvold T., Lifjeld J. T., Johnsen A.;2016;;Sperm performance in conspecific and heterospecific female fluid;Ecology and Evolution;;;;;;;;in press;;;;;;;;;;;;;;;;;10.1002/ece3.1977;;;;;;;;;
Dahirel M., Ansart A., Madec L.;2016;;Potential syndromes linking dispersal and reproduction in the hermaphrodite land snail \textitCornu aspersum;Journal of Zoology;;;;;;;;in press;;;;;;;;;;;;;;;;;10.1111/jzo.12328;;;;;;;;;
De Roissart A., Wybouw N., Renault D., Van Leeuwen T., Bonte D.;2016;;Life-history evolution in response to changes in metapopulation structure in an arthropod herbivore;Functional Ecology;;;;;;;;in press;;;;;;;;;;;;;;;;;10.1111/1365-2435.12612;;;;;;;;;
Duflot R., Ernoult A., Burel F., Aviron S.;2016;;Landscape level processes driving carabid crop assemblage in dynamic farmlands;Population Ecology;;58;2;;;;;265-275;;;;;;;;;;;;;;;;;10.1007/s10144-015-0534-x;;;;;;;;;
Foucreau N., Piscart C., Puijalon S., Hervant F.;2016;;Foucreau, N., Piscart, C., Puijalon, S., Hervant, F., 2016 - Effects of rising temperature on a functional process: consumption and digestion of leaf litter by a freshwater shredder. Fundamental and Applied Limnology, 187(4) : 295-306.;Fundamental and Applied Limnology;;187;4;;;;;295-306;;;;;;;;;;;;;;;;;;;;;;;;;;
Gerard C., Hervé M., Réveillac E., Acou A.;2016;;Spatial distribution and impact of the gill-parasitic Mazocraes alosae (Monogenea Polyopisthocotylea) on Alosa alosa and A. fallax (Actinopterygii, Clupeidae);Hydrobiologia;;763;1;;;;;371-379;;;;;;;;;;;;;;;;;10.1007/s10750-015-2391-1;;;;;;;;;
Hamilton R. L., Trimmer M., Bradley C., Pinay G.;2016;;Deforestation for oil palm alters the fundamental balance of the soil N cycle;Soil Biology and Biochemistry;;95;;;;;;223-232;;;;;;;;;;;;;;;;;10.1016/j.soilbio.2016.01.001;;;;;;;;;
Harun S., Baker A., Bradley C., Pinay G.;2016;;Spatial and seasonal variations in the composition of dissolved organic matter in a tropical catchment: the Lower Kinabatangan River, Sabah, Malaysia;Environmental Science. Processes & Impacts;;18;;;;;;137-150;;;;;;;;;;;;;;;;;10.1039/c5em00462d;;26666759;;;;;;;
Khelil R., Jardé E., Cabello-Hurtado F., Hadj-Khelil A. O. E., Esnault M.-A.;2016;;Structure and composition of the wax of the date palm, Phoenixdactylifera L., from the septentrional Sahara;Scientia Horticulturae;;201;;;;;;238-246;;;;;;;;;;;;;;;;;10.1016/j.scienta.2016.02.012;;;;;;;;;
Lalouette L., Pottier M.-A., Wycke M.-A., Boitard C., Bozzolan F., Maria A., Demondion E., Chertemps T., Lucas P., Renault D., Maïbèche M., Siaussat D.;2016;;Unexpected effects of sublethal doses of insecticide on the peripheral olfactory response and sexual behavior in a pest insect;Environmental Science and Pollution Research International;;23;4;;;;;3073-3085;;;;;;;;;;;;;;;;;10.1007/s11356-015-5923-3;;26686856;;;;;;;
Lemtiri A., Liénard A., Alabi T., Brostaux Y., Cluzeau D., Francis F., Colinet G.;2016;;Earthworms Eisenia fetida affect the uptake of heavy metals by plants Vicia faba and Zea mays in metal-contaminated soils;Applied Soil Ecology;;;;;;;;;;;;;;;;;;;;;;;;;10.1016/j.apsoil.2015.11.021;;;;;;;;;
Loranger J., Violle C., Shipley B., Lavorel S., Bonis A., Cruz P., Louault F., Loucougaray G., Mesléard F., Yavercovski N., Garnier E.;2016;;Recasting the dynamic equilibrium model through a functional lens: the interplay of trait-based community assembly and climate;Journal of Ecology;;;;;;;;in press;;;;;;;;;;;;;;;;;10.1111/1365-2745.12536;;;;;;;;;
Lê Van A., Duhamel M., Quaiser A., Vandenkoornhuyse P.;2016;;Stable-Isotope Probing RNA to Study Plant/Fungus Interactions;Methods in Molecular Biology -Clifton then Totowa-;;1399;;;;;;151-166;;;;;;;;;;;;;;;;;10.1007/978-1-4939-3369-3_9;;26791502;;;;;;;
Mamai W., Mouline K., Parvy J.-P., Le Lannic J., Dabiré K. R., Ouédraogo G. A., Renault D., Simard F.;2016;;Morphological changes in the spiracles of Anopheles gambiae s.l (Diptera) as a response to the dry season conditions in Burkina Faso (West Africa);Parasites and Vectors;;9;1;;;;;11;;;;;;;;;;;;;;;;;10.1186/s13071-015-1289-0;;26739500;;;;;;;
Mas A., Jamshidi S., Lagadeuc Y., Eveillard D., Vandenkoornhuyse P.;2016;;Beyond the Black Queen Hypothesis.;The ISME journal;;;;;;;;;;;;;;;;;;;;;;;;;;;26953598;;;;;;;
Molleman F., Depoilly A., Vernon P., Müller J., Bailey R., Jarzabek-Müller A., Prinzing A.;2016;;The island rule of body size demonstrated on individual hosts: phytophagous click beetle species grow larger and predators smaller on phylogenetically isolated trees;Journal of Biogeography;;;;;;;;in press;;;;;;;;;;;;;;;;;10.1111/jbi.12725;;;;;;;;;
Perez G., Bastian S., Agoulon A., Bouju A., Durand A., Faille F., Lebert I., Rantier Y., Plantard O., Butet A.;2016;;Effect of landscape features on the relationship between Ixodes ricinus ticks and their small mammal hosts;Parasites and Vectors;;9;1;;;;;20;;;;;;;;;;;;;;;;;10.1186/s13071-016-1296-9;;26767788;;;;;;;
Saiz H., Bittebière A.-K., Benot M.-L., Jung V., Mony C.;2016;;Understanding clonal plant competition for space over time: a fine-scale spatial approach based on experimental communities;Journal of Vegetation Science;;;;;;;;in press;;;;;;;;;;;;;;;;;10.1111/jvs.12392;;;;;;;;;
Sauvadet M., Chauvat M., Cluzeau D., Maron P.-A., Villenave C., Bertrand I.;2016;;The dynamics of soil micro-food web structure and functions vary according to litter quality;Soil Biology and Biochemistry;;95;;;;;;262-274;;;;;;;;;;;;;;;;;10.1016/j.soilbio.2016.01.003;;;;;;;;;
Thiébaut G., Gillard M., Deleu C.;2016;;Growth, regeneration and colonisation of Egeria densa fragments: the effect of autumn temperature increases;Aquatic Ecology;;;;;;;;1-11;;;;;;;;;;;;;;;;;10.1007/s10452-016-9566-3;;;;;;;;;
Van Baaren J., Dufour C.-S., Pierre J.-S., Martel V., Louâpre P.;2016;;Evolution of life-history traits and mating strategy in males: a case study on two populations of a Drosophila parasitoid.;Biological Journal of the Linnean Society;;117;2;;;;;231-240;;;;;;;;;;;;;;;;;10.1111/bij.12644;;;;;;;;;
Zachos F. E., Frantz A. C., Kuehn R., Bertouille S., Colyn M., Niedzialkowska M., Pérez-González J., Skog A., Sprĕm N., Flamand M.-C.;2016;;Genetic structure and effective population sizes in European red deer (Cervus elaphus) at a continental scale: insights from microsatellite DNA;The Journal of Heredity;;;;;;;;;;;;;;;;;;;;;;;;;10.1093/jhered/esw011;;26912909;;;;;;;

