Collection;Auteurs;Année;Année de soutenance;Titre;Titre journal;Année;Volume;Issue;Editeur scientifique;Titre ouvrage;Titre du volume;Editeur revue;Volume, Issue, Pages;ISBN;Titre conférence;Commentaire;Date congrès;Ville;Pays;Patent n°;Date de publication;Type de rapport;N°;Organisme de délivrance;Pages;Date de publication;Directeur de thèse;Université de soutenance;Année de soutenance;Organisme de délivrance;DOI;NNT;Pubmed;Référence;ArXiv;Description;Voir aussi;Réf. HAL;Rang HCERES;Rang CNRS
CREM-EIEC - 28 ;Martin Ludivine, Thuc Uyen Nguyen-Thi;2015;;The Relationship Between Innovation and Productivity Based on R&D and ict Use. An Empirical Analysis of Firms in Luxembourg;Revue économique;;;;;;;;online;;;;;;;;;;;;;;;;;;10.3917/reco.pr2.0048;;;;;;;;;3;
CREM-EIEC - 29 CREM-EPCS - 35 ;Masclet David, Peterle Emmanuel, Larribeau Sophie;2015;;Gender differences in tournament and flat-wage schemes: An experimental study;Journal of Economic Psychology;;;;;;;; vol 47, pp. 103-115;;;;;;;;;;;;;;;;;;10.1016/j.joep.2015.01.003;;;;;;;;B;3;
;Masclet David, Puppe Clemens;2015;;Introduction to the special issue “Experiments on conflicts and conflict resolution”;Social Choice and Welfare;;;;;;;; vol 45 ,n° 3, pp. 479-488;;;;;;;;;;;;;;;;;;10.1007/s00355-015-0925-0;;;;;;;;A;1;
CREM-EPCS - 36 ;Moizeau Fabien;2015;;Dynamics of social norms in the city;Regional Science and Urban Economics;;;;;;;; vol 51, pp. 70-87;;;;;;;;;;;;;;;;;;10.1016/j.regsciurbeco.2015.01.005;;;;;;;;A;2;
CREM-MEF - 20 ;Moraux Franck, Navatte Patrick;2015;;How do reservation prices impact distressed debt rescheduling?;Economic Modelling;;;;;;;; vol 46, pp. 269-282;;;;;;;;;;;;;;;;;;10.1016/j.econmod.2014.12.004;;;;;;;;A;2;
CREM-MEF - 21 ;Palombi Silvia, Perman Roger, Tavera Christophe;2015;;Commuting effects in Okun's Law among British areas: Evidence from spatial panel econometrics;Papers in Regional Science;;;;;;;;online;;;;;;;;;;;;;;;;;;10.1111/pirs.12166;;;;;;;;A;2;
CREM-MEF - 22 ;Palombi Silvia, Perman Roger, Tavéra Christophe;2015;;Regional growth and unemployment in the medium run: asymmetric cointegrated Okun’s Law for UK regions;Applied Economics;;;;;;;;online;;;;;;;;;;;;;;;;;;10.1080/00036846.2015.1068922;;;;;;;;A;2;
CREM-MEF - 23 ;Pentecôte Jean-Sébastien, Poutineau Jean-Christophe, Rondeau Fabien;2015;;Trade Integration and Business Cycle Synchronization in the EMU: The Negative Effect of New Trade Flows;Open Economies Review;;;;;;;; vol 26 ,n° 1, pp. 61-79;;;;;;;;;;;;;;;;;;10.1007/s11079-014-9318-8;;;;;;;;B;3;
CREM-MEF - 24 ;Pentecôte Jean-Sébastien, Rondeau Fabien;2015;;Trade Spillovers on Output Growth During the 2008 Financial Crisis;International Economics;;;;;;;; vol 143, pp. 36-47;;;;;;;;;;;;;;;;;;10.1016/j.inteco.2015.04.003;;;;;;;;;
CREM-MM - 25 ;Perrigot Rozenn, Hussain Dildar, Windsperger Josef;2015;;An investigation into independent small business owners’ perception of franchisee relationships;International Journal of Retail and Distribution Management;;;;;;;; vol 43 ,n° 8, pp. 693-711;;;;;;;;;;;;;;;;;;10.1108/IJRDM-01-2014-0010;;;;;;;;B;3;
CREM-MM - 26 ;Perrigot Rozenn, Oxibar Bruno, Déjean Frédérique;2015;;Corporate Social Disclosure in the Franchising Sector: Insights from French Franchisors’ Websites;Journal of Small Business Management;;;;;;;; vol 53 ,n° 2, pp. 321-339;;;;;;;;;;;;;;;;;;10.1111/jsbm.12074;;;;;;;;A;2;
CREM-MM - 27 ;Picot-Coupey Karine, Cliquet Gérard;2015;;Guest Editorial;International Review of Retail, Distribution and Consumer Research;;;;;;;;online;;;;;;;;;;;;;;;;;;10.1080/09593969.2015.1089305;;;;;;;;;0;
CREM-MEF - 25 ;Poutineau Jean-Christophe, Vermandel Gauthier;2015;;A primer on macroprudential policy;Journal of Economic Education;;;;;;;; vol 46 ,n° 1, pp. 1-15;;;;;;;;;;;;;;;;;;10.1080/00220485.2014.980527;;;;;;;;B;
CREM-MEF - 26 ;Poutineau Jean-Christophe, Sobczak Karolina, Vermandel Gauthier;2015;;The analytics of the New Keynesian 3-equation Model;Economics and business review;;;;;;;; vol 1(15) ,n° 2, pp. 110-129;;;;;;;;;;;;;;;;;;;;;;;;;;;
CREM-MEF - 27 ;Poutineau Jean-Christophe, Vermandel Gauthier;2015;;Cross-border banking flows spillovers in the Eurozone: Evidence from an estimated DSGE model;Journal of Economic Dynamics and Control;;;;;;;; vol 51, pp. 378-403;;;;;;;;;;;;;;;;;;10.1016/j.jedc.2014.11.006;;;;;;;;;
CREM-MEF - 28 ;Poutineau Jean-Christophe, Vermandel Gauthier;2015;;Financial frictions and the extensive margin of activity;Research in Economics;;;;;;;; vol 69 ,n° 4, pp. 525-554;;;;;;;;;;;;;;;;;;10.1016/j.rie.2015.09.005;;;;;;;;B;3;
CREM-EIEC - 30 ;Pénard Thierry, Poussing Nicolas, Mukoko Blaise, Tamokwe Piaptie Georges Bertrand;2015;;Internet adoption and usage patterns in Africa: Evidence from Cameroon;Technology in Society;;;;;;;; vol 42, pp. 71-80;;;;;;;;;;;;;;;;;;10.1016/j.techsoc.2015.03.004;;;;;;;;;
CREM-MEF - 29 ;Revelli Christophe, Viviani Jean-Laurent;2015;;Financial performance of socially responsible investing (SRI): what have we learned? A meta-analysis;Business Ethics: A European Review;;;;;;;; vol 24 ,n° 2, pp. 158-185;;;;;;;;;;;;;;;;;;10.1111/beer.12076;;;;;;;;C;
CREM-MM - 28 ;Robert Demontrond Philippe;2015;;De la pauvreté à la simplicité volontaire : étude exploratoire d'une cité en construction;Gazette du Palais;;;;;;;; vol 4 ,n° 2, pp. 297-323;;;;;;;;;;;;;;;;;;;;;;;;;;;
CREM-EPCS - 37 ;Rocaboy Yvon;2015;;Competition Among National Football Leagues. Does It Exist? Should We Regulate?;Scottish Journal of Political Economy;;;;;;;;online;;;;;;;;;;;;;;;;;;10.1111/sjpe.12101;;;;;;;;B;
CREM-MM - 29 ;Ruiller Caroline, Van Der Heijden Beatrice I.j.m.;2015;;Socio-Emotional Support in French Hospitals: Effects on French Nurses' and Nurse Aides’ Affective Commitment;Applied Nursing Research;;;;;;;;online;;;;;;;;;;;;;;;;;;10.1016/j.apnr.2015.06.006;;;;;;;;;
CREM-MM - 30 ;Sabaj Omar, José O. Valderrama, González-Vergara Carlos, Pina-Stranger Alvaro;2015;;Relationship between the duration of peer-review, publication decision, and agreement among reviewers in three Chilean journals;European Science Editing;;;;;;;; vol 41 ,n° 4, pp. 87-90;;;;;;;;;;;;;;;;;;;;;;;;;;;
CREM-MEF - 30 ;Stephan Gaëtan, Lecumberry Julien;2015;;The German unemployment since the Hartz reforms: Permanent or transitory fall?;Economics Letters;;;;;;;; vol 136, pp. 49-54;;;;;;;;;;;;;;;;;;10.1016/j.econlet.2015.08.003;;;;;;;;B;3;
CREM-EIEC - 31 ;Suire Raphaël, Vicente Jérôme;2015;;Récents enseignements de la théorie des réseaux en faveur de la politique et du management des clusters;Revue d'économie industrielle;;;;;;;; ,n° 152, pp. 91-120;;;;;;;;;;;;;;;;;;;;;;;;;;B;
CREM-MM - 31 ;Tahar Caroline;2015;;Transposer le modèle des centres d’appel au service public ? Étude de trois centres de contact municipaux;Politiques et management public - PMP;;;;;;;; vol 32 ,n° 2, pp. 147-169;;;;;;;;;;;;;;;;;;10.3166/pmp.32.147-169;;;;;;;;;
CREM-EPCS - 38 ;Tarroux Benoît;2015;;Comparing two-dimensional distributions: a questionnaire-experimental approach;Social Choice and Welfare;;;;;;;; vol 44 ,n° 1, pp. 87-108;;;;;;;;;;;;;;;;;;10.1007/s00355-014-0829-4;;;;;;;;A;1;
CREM-MEF - 31 ;Tavéra Christophe, Poutineau Jean-Christophe, Pentecôte Jean-Sébastien, Cadoret Isabelle, Charpentier Arthur, Guéguen Chantal, Huchet-Bourdon Marilyne, Licheron Julien, Loeillet Guillaume, Payelle Nathalie, Pommier Sébastien;2015;;The “Mother of All Puzzles” at Thirty: A Meta-Analysis;International Economics;;;;;;;; vol 141, pp. 80-96;;;;;;;;;;;;;;;;;;10.1016/j.inteco.2015.01.001;;;;;;;;;
;Tavéra Christophe, Poutineau Jean-Christophe, Pentecôte Jean-Sébastien, Cadoret-David Isabelle, Charpentier Arthur, Guéguen Chantal, Huchet-Bourdon Maryline, Licheron Julien, L'oeillet Guillaume, Payelle Nathalie, Pommier Sébastien;2015;;The "Mother of All Puzzles" at thirty: a meta-analysis;International Economics;;;;;;;; vol 141, pp. 80-96;;;;;;;;;;;;;;;;;;10.1016/j.inteco.2015.01.001;;;;;;;;;
CREM-MM - 32 ;Tremeau Audrey, Martin Dominique Philippe, Devillez Arnaud;2015;;Institutional work in academic technological facilities: A multi-case study from the field of biotechnology in France;Journal of High Technology Management Research;;;;;;;; vol 26 ,n° 2, pp. 137-148;;;;;;;;;;;;;;;;;;10.1016/j.hitech.2015.09.009;;;;;;;;C;
CREM-EPCS - 39 ;Walraevens Benoît, Ormann Andreas;2015;;Book review :The Oxford Handbook of Adam Smith, by Christopher J. Berry, Maria Pia Paganelli, Craig Smith, Oxford University Press, 2013, 656 pp;European Journal of the History of Economic Thought;;;;;;;; vol 22 ,n° 2, pp. 340-343;;;;;;;;;;;;;;;;;;10.1080/09672567.2015.1008303;;;;;;;;A;2;
CREM-EPCS - 40 ;Abdessalam A.h. Ould, Kamwa Eric;2014;;Tax Competition and the Determination of the Quality of Public Goods;Journal of Economics;;;;;;;; vol 8 ,n° 12, pp. 1-20;;;;;;;;;;;;;;;;;;10.5018/economics-ejournal.ja.2014-12;;;;;;;;;
CREM-EIEC - 32 CREM-MEF - 32 ;Abdesselam Rafik, Bonnet Jean, Renou-Maissant Patricia;2014;;Typology of the French regional development: revealing the refugee/Schumpeter effects in new-firms startups;Applied Economics;;;;;;;; vol 46 ,n° 28, pp. 3437-3451;;;;;;;;;;;;;;;;;;10.1080/00036846.2014.931920;;;;;;;;A;2;
CREM-MEF - 33 ;André Le Pogamp Florence, Navatte Patrick;2014;;L'impact de la diversification sur la valeur de la firme. Vers une approche contingente;Revue Française de Gestion;;;;;;;; vol 40 ,n° 241, pp. 107-120;;;;;;;;;;;;;;;;;;10.3166/rfg.241.107-120;;;;;;;;C;4;
CREM-MEF - 34 ;Aubry Mathilde, Renou-Maissant Patricia;2014;;Semiconductor industry cycles: Explanatory factors and forecasting;Economic Modelling;;;;;;;; vol 39, pp. 221-231;;;;;;;;;;;;;;;;;;10.1016/j.econmod.2014.02.039;;;;;;;;A;2;
CREM-EIEC - 33 CREM-MEF - 35 ;Aubry Mathilde, Bonnet Jean, Renou-Maissant Patricia;2014;;Cycle économique et comportement entrepreneurial sur données régionales françaises;Revue d'Economie Régionale et Urbaine ( RERU);;;;;;;; vol 4, pp. 643-675;;;;;;;;;;;;;;;;;;;;;;;;;;;
CREM-EPCS - 41 ;Azam Jean-Paul, Thelen Véronique;2014;;The Geo-Politics of Foreign Aid and Transnational Terrorism;Revue d'Economie du Développement;;;;;;;; vol 28, pp. 263-288;;;;;;;;;;;;;;;;;;;;;;;;;;;
;Baslé Maurice, Berthet Thierry;2014;;Introduction;Formation Emploi. Revue française de sciences sociales;;;;;;;; ,n° 126, pp. 7-15;;;;;;;;;;;;;;;;;;;;;;;;;;C;
CREM-EIEC - 34 ;Baslé Maurice, Berthet Thierry;2014;;Qu'apprend-on des expérimentations sociales ?;Formation Emploi. Revue française de sciences sociales;;;;;;;; vol 2/2014 ,n° 126, pp. 7-15;;;;;;;;;;;;;;;;;;;;;;;;;;C;
CREM-MM - 33 ;Basso Frédéric, Robert-Demontrond Philippe, Hayek Maryvonne, Anton Jean-Luc, Nazarian Bruno, Roth Muriel, Oullier Olivier, Robin Donald A.;2014;;Why People Drink Shampoo? Food Imitating Products Are Fooling Brains and Endangering Consumers for Marketing Purposes;PLoS ONE;;;;;;;; vol 9 ,n° 9online;;;;;;;;;;;;;;;;;;10.1371/journal.pone.0100368;;;;;;;;;
CREM-EPCS - 42 ;Baujard Antoinette, Gavrel Frédéric, Igersheim Herrade, Lebon Isabelle, Laslier Jean-François;2014;;Vote par approbation, vote par note. Une réponse au commentaire d’Allisson et Brisset;Revue économique;;;;;;;; vol 65 ,n° 3, pp. 687-691;;;;;;;;;;;;;;;;;;10.3917/reco.653.0687;;;;;;;;;3;
CREM-EPCS - 43 ;Baujard Antoinette, Igersheim Herrade, Lebon Isabelle, Gavrel Frédéric, Laslier Jean-François;2014;;Who's favored by evaluative voting? An experiment conducted during the 2012 French presidential election;Electoral Studies;;;;;;;; vol 34, pp. 131-145;;;;;;;;;;;;;;;;;;10.1016/j.electstud.2013.11.003;;;;;;;;;0;
CREM-EIEC - 35 ;Bazart Cécile, Bonein Aurélie;2014;;Reciprocal relationships in tax compliance decisions;Journal of Economic Psychology;;;;;;;; vol 40 ,n° Special Issue on Behavioral Dynamics of Tax Evasion, pp. 83-102;;;;;;;;;;;;;;;;;;10.1016/j.joep.2012.10.002;;;;;;;;B;3;
CREM-EIEC - 36 ;Ben Youssef Adel, Martin Ludivine, Omrani Nessrine;2014;;The complementarities between Infomation and Communication Technologies Use, New Organizational Practices and Employee's Contextual Performance: Evidence from Europe in 2005 and 2010;Revue d Economie Politique;;;;;;;; vol 124 ,n° 4, pp. 493-504;;;;;;;;;;;;;;;;;;;;;;;;;;B;
CREM-EIEC - 37 ;Benallou Khadidja, Movahedi Mohammad, Bonnet Jean;2014;;Comparative study of organizational innovation and its link with technological innovation in Lower Normandy SMEs;Resaddersse International;;;;;;;; vol 17, pp. 29-77;;;;;;;;;;;;;;;;;;;;;;;;;;;
CREM-MEF - 36 ;Bertoni Fabio, Le Nadant Anne-Laure, Perdreau Frédéric;2014;;Innovation and R&D investments by leveraged buyout companies in times of crisis;Economics Bulletin;;;;;;;; vol 34 ,n° 2, pp. 856-864;;;;;;;;;;;;;;;;;;;;;;;;;;B;3;
CREM-EPCS - 44 ;Binet Marie-Estelle, Carlevaro Fabrizio, Paul Michel;2014;;Estimation of Residential Water Demand with Imperfect Price Perception;Environmental and Resource Economics;;;;;;;; vol 59 ,n° 4, pp. 561-581;;;;;;;;;;;;;;;;;;10.1007/s10640-013-9750-z;;;;;;;;;2;
CREM-MM - 34 ;Bouille J., Robert-Demontrond P., Basso F.;2014;;Mesurer la force persuasive de l'activisme consumeriste : une etude experimentale de la theorie des cites appliquee aux food imitating products;Recherche et Applications en Marketing (French Edition);;;;;;;; vol 29 ,n° 1, pp. 79-113;;;;;;;;;;;;;;;;;;10.1177/0767370113505948;;;;;;;;A;
CREM-EIEC - 38 ;Bourreau Marc, Drouard Joeffrey;2014;;Progressive entry and the incentives to invest in alternative infrastructures;Journal of Regulatory Economics;;;;;;;; vol 45 ,n° 3, pp. 329-351;;;;;;;;;;;;;;;;;;10.1007/s11149-014-9248-9;;;;;;;;A;2;
CREM-MM - 35 ;Bouville Gregor, Alis David;2014;;The effects of lean organizational practices on employees' attitudes and workers' health: evidence from France;International Journal of Human Resource Management;;;;;;;; vol 25 ,n° 21, pp. 3016-3037;;;;;;;;;;;;;;;;;;10.1080/09585192.2014.951950;;;;;;;;B;
CREM-MEF - 37 ;Bouzgarrou Houssam, Navatte Patrick;2014;;Family Firms and the Choice of Payment Method in Domestic and International Acquisitions;International Management (Europe edition);;;;;;;; vol 18 ,n° 4, pp. 107-124;;;;;;;;;;;;;;;;;;10.7202/1026032ar;;;;;;;;;
CREM-EPCS - 45 ;Breunig Robert, Garrett-Rumba Bronwyn, Jardin Mathieu, Rocaboy Yvon;2014;;Wage dispersion and team performance: a theoretical model and evidence from baseball;Applied Economics;;;;;;;; vol 46 ,n° 3, pp. 271-281;;;;;;;;;;;;;;;;;;10.1080/00036846.2013.839864;;;;;;;;A;2;
CREM-EPCS - 46 ;Bunel M., Tovar E.;2014;;Key Issues in Local Job Accessibility Measurement: Different Models Mean Different Results;Urban Studies;;;;;;;; vol 51 ,n° 6, pp. 1322-1338;;;;;;;;;;;;;;;;;;10.1177/0042098013495573;;;;;;;;A;2;
CREM-MEF - 38 ;Cadoret-David Isabelle, Payelle Nathalie, Pommier Sébastien;2014;;Public debt and growth in Europe: the role of institutions;Studia Oeconomica Posnaniensia;;;;;;;; vol 2014/2 ,n° 273, pp. 96-120;;;;;;;;;;;;;;;;;;;;;;;;;;;
CREM-EIEC - 39 ;Campart Sandy, Pfister Etienne;2014;;Technological races and stock market value: evidence from the pharmaceutical industry;Economics of Innovation and New Technology;;;;;;;; vol 23 ,n° 3, pp. 215-238;;;;;;;;;;;;;;;;;;10.1080/10438599.2013.825427;;;;;;;;A;2;
CREM-MM - 36 ;Caverot Guy, Martin Dominique, Boldrini Jean-Claude;2014;;Comment développer des capacités dynamiques pour une performance accrue ? Le rôle clé des technological gatekeepers dans les PME.;Gérer et Comprendre. Annales des Mines;;;;;;;; ,n° 116, pp. 30-42;;;;;;;;;;;;;;;;;;;;;;;;;;C;4;
CREM-EIEC - 40 ;Charness Gary, Masclet David, Villeval Marie Claire;2014;;The Dark Side of Competition for Status;Management Science;;;;;;;; vol 60 ,n° 1pp. 38-55;;;;;;;;;;;;;;;;;;10.1287/mnsc.2013.1747;;;;;;;;A;1;
CREM-EPCS - 47 CREM-MEF - 39 ;Charpentier Arthur, Le Maux Benoît;2014;;Natural catastrophe insurance: How should the government intervene?;Journal of Public Economics;;;;;;;; vol 115, pp. 1-17;;;;;;;;;;;;;;;;;;10.1016/j.jpubeco.2014.03.004;;;;;;;;A;1;
CREM-EPCS - 48 ;Chauvin Pauline, Josselin Jean-Michel, Heresbach Denis;2014;;The influence of waiting times on cost-effectiveness: a case study of colorectal cancer mass screening;The European Journal of Health Economics;;;;;;;; vol 15 ,n° 8, pp. 801-812;;;;;;;;;;;;;;;;;;10.1007/s10198-013-0525-9;;;;;;;;;
CREM-EPCS - 49 ;Cherrier Béatrice;2014;;Toward a History of Economics at MIT, 1940-72;History of Political Economy;;;;;;;; vol 46 ,n° Supplement 1, pp. 15-44;;;;;;;;;;;;;;;;;;10.1215/00182702-2716100;;;;;;;;A;
CREM-MM - 37 ;Chédotel Frédérique, Krohmer Cathy;2014;;Les règles, leviers de développement d'une compétence collective – deux études de cas;@GRH;;;;;;;; vol 12 ,n° 3, pp. 15-38;;;;;;;;;;;;;;;;;;10.3917/grh.012.0015;;;;;;;;;0;
CREM-MM - 38 ;Chédotel Frédérique, Vignikin Aristide;2014;;Quel lien entre la mémoire des organisations et l’efficacité de l’improvisation ? Résultats d’une enquête longitudinale;Management international;;;;;;;; vol 18 ,n° 2, pp. 80-91;;;;;;;;;;;;;;;;;;10.7202/1024195ar;;;;;;;;B;
CREM-EIEC - 41 ;Cieply Sylvie;2014;;Les banquiers rationnent-ils plus le crédit aux entreprises ? Résultats d’une enquête régionale;Revue d'économie financière;;;;;;;; vol 116 ,n° 4, pp. 317-332;;;;;;;;;;;;;;;;;;10.3917/ecofi.104.0141;;;;;;;;;
CREM-MM - 39 ;Cliquet Gérard, Picot-Coupey Karine, Huré Elodie, Gahinet Marie-Christine;2014;;Shopping with a Smartphone: A French-Japanese Perspective;Marketing ZFP Journal of Research and Management;;;;;;;; vol 2014 ,n° 2, pp. 96-106;;;;;;;;;;;;;;;;;;;;;;;;;;;0;
CREM-MEF - 40 ;Cornée Simon;2014;;Soft Information and Default Prediction in Cooperative and Social Banks;Journal of Entrepreneurial and Organizational Diversity;;;;;;;; vol 3 ,n° 1, pp. 89-109;;;;;;;;;;;;;;;;;;10.5947/jeod.2014.005;;;;;;;;;
CREM-MEF - 41 ;Coulmont Baptiste, Charpentier Arthur, Gombin Joël;2014;;Un homme, deux voix. Le vote par procuration;La vie des idées;;;;;;;;en ligne;;;;;;;;;;;;;;;;;;;;;;;;;;;
CREM-EPCS - 50 ;Courtin Sébastien, Mbih Boniface, Moyouwou Issofa;2014;;Are Condorcet procedures so bad according to the reinforcement axiom?;Social Choice and Welfare;;;;;;;; vol 42 ,n° 4, pp. 927-940;;;;;;;;;;;;;;;;;;10.1007/s00355-013-0758-7;;;;;;;;A;1;
CREM-EIEC - 42 ;Crespo Joan, Suire Raphaël, Vicente Jérôme;2014;;Lock-in or lock-out ? How structural properties of knowledge networks affect regional resilience;Journal of Economic Geography;;;;;;;; vol 14 ,n° 1, pp. 199-219;;;;;;;;;;;;;;;;;;10.1093/jeg/lbt006;;;;;;;;A;1;
CREM-EIEC - 43 ;Darmon Eric, Rufini Alexandra, Torre Dominique;2014;;Publisher's Announcements and Piracy-Monitoring Devices in Software Adoption;Annals of Economics and Statistics;;;;;;;; ,n° 115-116pp.409-430;;;;;;;;;;;;;;;;;;;;;;;;;;;2;
CREM-MEF - 42 ;Diop Mamadou, Diaw Adama;2014;;Politique budgétaire et stabilité macroéconomique en union économique et monétaire : le cas de l'UEMOA;Revue de l'OFCE;;;;;;;; vol Débats et Politiques ,n° 137, pp. 181-209;;;;;;;;;;;;;;;;;;;;;;;;;;C;4;
CREM-EIEC - 44 ;Dixit Vinayak, Denant-Boemont Laurent;2014;;Is Equilibrium in Transport Pure Nash, Mixed or Stochastic? Evidence from Laboratory Experiments;Transportation Research Part C: Emerging Technologies;;;;;;;; vol 48, pp. 301-310;;;;;;;;;;;;;;;;;;10.1016/j.trc.2014.09.002;;;;;;;;;
CREM-EIEC - 45 ;Donfouet Hermann Pythagore Pierre, Jeanty P. Wilner, Mahieu P.-A.;2014;;Dealing with internal inconsistency in double-bounded dichotomous choice: an application to community-based health insurance;Empirical Economics;;;;;;;; vol 46 ,n° 1, pp. 317-328;;;;;;;;;;;;;;;;;;10.1007/s00181-012-0665-2;;;;;;;;C;4;
CREM-MM - 40 ;Droulers O., Roullet B.;2014;;Contexte de programme violent a la television et memorisation des publicites : Roles respectifs du niveau de violence et de la narrativite;Recherche et Applications en Marketing (French Edition);;;;;;;; vol 29 ,n° 1, pp. 61-78;;;;;;;;;;;;;;;;;;10.1177/0767370113505950;;;;;;;;A;
CREM-MM - 41 ;Dumas Marc, Ruiller Caroline;2014;;Le télétravail : les risques d'un outil de gestion des frontières entre vie personnelle et vie professionnelle ?;Management & Avenir;;;;;;;; vol 74 ,n° 8, pp. 71-95;;;;;;;;;;;;;;;;;;10.3917/mav.074.0071;;;;;;;;C;
CREM-MEF - 43 ;Elbadraoui Khalid, Ouenniche Jamal;2014;;The Long-Run Performance Following Convertible Debt Offerings: Does The Design Matter?;Journal of Applied Business Research;;;;;;;; vol 30 ,n° 3online;;;;;;;;;;;;;;;;;;10.19030/jabr.v30i3.8573;;;;;;;;B;3;
CREM-EIEC - 46 ;Franck Bernard, Le Pape Nicolas, Kadohognon Ouattara Sylvain;2014;;Ouverture à la concurrence et obligations de service universel;Revue d'économie industrielle;;;;;;;; ,n° 147, pp. 87-109;;;;;;;;;;;;;;;;;;;;;;;;;;B;
CREM-EPCS - 51 ;Frere Q., Leprince M., Paty S.;2014;;The Impact of Intermunicipal Cooperation on Local Public Spending;European Urban and Regional Studies;;;;;;;; vol 51 ,n° 8, pp. 1741-1760;;;;;;;;;;;;;;;;;;10.1177/0042098013499080;;;;;;;;;
CREM-MM - 42 ;Gahinet Marie-Christine;2014;;Les nouveaux formats alimentaires de proximité : regards croisés des distributeurs et des consommateurs;Management & Avenir;;;;;;;; vol 71 ,n° 5, pp. 153-168;;;;;;;;;;;;;;;;;;10.3917/mav.071.0153;;;;;;;;C;
CREM-MEF - 44 CREM-MM - 43 ;Gaugain Marc, Viviani Jean-Laurent, Vo Thi Le Hao;2014;;Le financement collaboratif entre client et fournisseur. Un moyen de renforcer la compétitivité des chaînes logistiques;Revue Française de Gestion;;;;;;;; vol 40 ,n° 239, pp. 107-120;;;;;;;;;;;;;;;;;;10.3166/rfg.239.107-120;;;;;;;;C;4;
CREM-EIEC - 47 ;Gayant Jean-Pascal, Le Pape Nicolas;2014;;Mesure de la COMPETITIVE BALANCE dans les ligues de sports professionnels : faut-il distinguer les ligues fermées des ligues avec promotion et relégation ?;Revue Economique;;;;;;;; vol 66 ,n° 2, pp. 427-448;;;;;;;;;;;;;;;;;;10.3917/reco.pr2.0040;;;;;;;;;
CREM-MM - 44 ;Gervais Michel, Allain Elodie;2014;;Réflexion sur les calculs de coûts complets en comptabilité de gestion;Revue Recherches en Sciences de Gestion - Management Sciences - Ciencias de Gestion;;;;;;;; vol 102 ,n° 3, pp. 119-150;;;;;;;;;;;;;;;;;;10.3917/resg.102.0119;;;;;;;;;
CREM-EPCS - 52 ;Gilles Henri, Guironnet Jean-Pascal, Parent Antoine;2014;;Géographie économique des morts de 14-18 en France;Revue économique;;;;;;;; vol 65 ,n° 3, pp. 519-532;;;;;;;;;;;;;;;;;;10.3917/reco.653.0519;;;;;;;;;3;
CREM-EIEC - 48 ;Ginon Emilie, Combris Pierre, Loheac Youenn, Enderli Géraldine, Issanchou Sylvie;2014;;What do we learn from comparing hedonic scores and willingness-to-pay data?;Food Quality and Preference;;;;;;;; vol 33, pp. 54-63;;;;;;;;;;;;;;;;;;10.1016/j.foodqual.2013.11.003;;;;;;;;;0;
CREM-EPCS - 53 ;Grolier Jacques;2014;;L'optimisation de la mise à disposition de lits et l'amélioration de la recherche de lits d'aval en SSR : L'amélioration de la recherche de lits d'aval en SSR;Finances hospitalières;;;;;;;; ,n° 86, pp. 13-19;;;;;;;;;;;;;;;;;;;;;;;;;;;0;
CREM-EPCS - 54 ;Grolier Jacques;2014;;L’optimisation de la mise à disposition de lits et l’amélioration de la recherche de lits d’aval en SSR;Finances hospitalières;;;;;;;; ,n° 85, pp. 13-19;;;;;;;;;;;;;;;;;;;;;;;;;;;0;
CREM-MM - 45 ;Herriau Christophe, Touchais Lionel;2014;;The Role of Control Systems in the Process of Change: Application to a Family Business Succession;Journal of Change Management;;;;;;;; vol 15 ,n° 1, pp. 19-42;;;;;;;;;;;;;;;;;;10.1080/14697017.2014.922603;;;;;;;;C;
CREM-MM - 46 ;Hovelaque V, Bironneau L;2014;;The carbon-constrained EOQ model with carbon emission dependent demand;International Journal of Production Economics;;;;;;;; vol 164, pp. 285-291;;;;;;;;;;;;;;;;;;10.1016/j.ijpe.2014.11.022;;;;;;;;A;1;
CREM-EIEC - 49 ;Jacquemet Nicolas, L 'haridon Olivier, Vialle Isabelle;2014;;Marché du travail, évaluation et économie expérimentale;Revue Française d'Economie;;;;;;;; vol XXIX ,n° 1, pp. 189-226;;;;;;;;;;;;;;;;;;;;;;;;;;;
CREM-MM - 47 ;Jacques-François Diouf;2014;;The luxury metaphor of alcoholic beverages marketing: a necessary focus and understanding to help public health;Journal de Gestion et d Economie Medicales;;;;;;;; vol 32 ,n° 3, pp. 209-225;;;;;;;;;;;;;;;;;;10.3917/jgem.143.0209;;;;;;;;;
CREM-EIEC - 50 ;Joffily Mateus, Masclet David, Noussair Charles, Villeval Marie Claire;2014;;Emotions, sanctions and cooperation;Southern Economic Journal;;;;;;;; vol 80 ,n° 4pp. 1002-1027;;;;;;;;;;;;;;;;;;10.4284/0038-4038-2012.067;;;;;;;;A;2;
CREM-MM - 48 ;Joyeau Anne, Robert Demontrond Philippe;2014;;La recherche herméneutique en management face à la juridictionnalisation de l’activité scientifique : analyse du problème et exploration de réponses;Management international;;;;;;;; vol 18 ,n° 2, pp. 92-105;;;;;;;;;;;;;;;;;;10.7202/1024196ar;;;;;;;;B;
CREM-MM - 49 ;Joyeau Anne, Poilpot-Rocaboy Gwénaëlle;2014;;Enjeux et perspectives du métier de responsable des ressources humaines à temps partagé : une réponse au besoin d'innovation en matière d'emploi ?;Gestion -Montreal-;;;;;;;; vol 39 ,n° 1, pp. 79-92;;;;;;;;;;;;;;;;;;10.3917/riges.391.0079;;;;;;;;C;
CREM-MM - 50 ;Lacoste-Badie Sophie, Droulers Olivier;2014;;Advertising memory: The power of mirror neurons.;Journal of Neuroscience, Psychology, and Economics;;;;;;;; vol 7 ,n° 4, pp. 195-202;;;;;;;;;;;;;;;;;;10.1037/npe0000025;;;;;;;;;
CREM-EPCS - 55 ;Lagona Francesco, Maruotti Antonello, Padovano Fabio;2014;;Multilevel multivariate modelling of legislative count data, with a hidden Markov chain;Journal of the Royal Statistical Society: Series A;;;;;;;; vol 178 ,n° 3, pp. 705-723;;;;;;;;;;;;;;;;;;10.1111/rssa.12089;;;;;;;;;
CREM-MEF - 45 ;Le Nadant Anne-Laure, Perdreau Frédéric;2014;;Ex-post innovation profile of LBO targets: evidence from CIS data for the Netherlands;Strategic Change;;;;;;;; vol 23 ,n° 1-2, pp. 93-105;;;;;;;;;;;;;;;;;;10.1002/jsc.1962;;;;;;;;B;3;
