Collection;Auteurs;Année;Année de soutenance;Titre;Titre journal;Année;Volume;Issue;Editeur scientifique;Titre ouvrage;Titre du volume;Editeur revue;Volume, Issue, Pages;ISBN;Titre conférence;Commentaire;Date congrès;Ville;Pays;Patent n°;Date de publication;Type de rapport;N°;Organisme de délivrance;Pages;Date de publication;Directeur de thèse;Université de soutenance;Année de soutenance;Organisme de délivrance;DOI;NNT;Pubmed;Référence;ArXiv;Description;Voir aussi;Réf. HAL;Rang HCERES;Rang CNRS
CREM-EIEC - 1 ;Abdellaoui Mohammed, Bleichrodt Han, L’Haridon Olivier, Van Dolder Dennie;2016;;Measuring Loss Aversion under Ambiguity: A Method to Make Prospect Theory Completely Observable;Journal of Risk and Uncertainty;;;;;;;;online;;;;;;;;;;;;;;;;;;10.1007/s11166-016-9234-y;;;;;;;;A;2;
CREM-EPCS - 1 ;Abidi Zineb, Di Porto Edoardo, Parenti Angela, Paty Sonia;2016;;Local government cooperation at work: A control function approach;Journal of Economic Geography;;;;;;;;A paraître;;;;;;;;;;;;;;;;;;;;;;;;;;A;1;
CREM-MM - 1 ;Basso Frédéric, Bouillé Julien, Le Goff Kevin, Robert-Demontrond Philippe, Oullier Olivier;2016;;Assessing the Role of Shape and Label in the Misleading Packaging of Food Imitating Products: From Empirical Evidence to Policy Recommendation;Frontiers in Psychology;;;;;;;; vol 7, pp. 450;;;;;;;;;;;;;;;;;;10.3389/fpsyg.2016.00450;;;;;;;;;
CREM-MM - 2 ;Berthe Bénédicte, Dumas Marc, Poilpot - Rocaboy Gwénaëlle;2016;;Le syndrome de la "femme parfaite". Et si le sentiment de culpabilité générait l’inégalité professionnelle entre les femmes et les hommes dans les entreprises françaises ?;Revue internationale de psychosociologie et de gestion des comportements organisationnels;;;;;;;; vol 22 ,n° 54, pp. 187-206;;;;;;;;;;;;;;;;;;;;;;;;;;;0;
CREM-EIEC - 2 ;Bonein Aurélie, Vialle Isabelle;2016;;Rémunération et effort des travailleurs dans un cadre collectif;Actualite Economique;;;;;;;;à paraître;;;;;;;;;;;;;;;;;;;;;;;;;;C;
CREM-MM - 3 ;Briec Louise, Mandard Matthieu;2016;;L’échec de la certification forestière. Le cas de la certification FSC examiné au travers de la sociologie de la traduction;Mondes en Développement;;;;;;;; vol 1 ,n° 173, pp. 63-78;;;;;;;;;;;;;;;;;;10.3917/med.173.0063;;;;;;;;C;
CREM-EPCS - 2 CREM-MEF - 1 ;Cadoret Isabelle, Padovano Fabio;2016;;The political drivers of renewable energies policies;Energy Economics;;;;;;;;online;;;;;;;;;;;;;;;;;;10.1016/j.eneco.2016.03.003;;;;;;;;A;
CREM-MEF - 2 CREM-MM - 4 ;Cornée Simon, Thenet Gervais;2016;;Efficience des institutions de microfinance en Bolivie et au Pérou : une approche data envelopment analysis en deux étapes;Finance Contrôle Stratégie;;;;;;;; vol 19 ,n° 1online;;;;;;;;;;;;;;;;;;;;;;;;;;B;3;
CREM-EIEC - 3 ;Crespo Joan, Suire Raphaël, Vicente Jérôme;2016;;Network structural properties for cluster long-run dynamics: evidence from collaborative R&D networks in the European mobile phone industry;Industrial and Corporate Change;;;;;;;; vol 25 ,n° 2, pp. 261-282;;;;;;;;;;;;;;;;;;10.1093/icc/dtv032;;;;;;;;A;
CREM-EIEC - 4 ;Denant-Boemont Laurent, Diecidue Enrico, L'haridon Olivier;2016;;Patience and time consistency in collective decisions;Experimental Economics;;;;;;;;online;;;;;;;;;;;;;;;;;;10.1007/s10683-016-9481-4;;;;;;;;A;1;
CREM-EIEC - 5 ;Gaté Romain, Latruffe Laure;2016;;Problems encountered with farm transfers : the case of Brittany;Economie Rurale;;;;;;;; ,n° 351, pp. 5-24;;;;;;;;;;;;;;;;;;10.4000/economierurale.4792;;;;;;;;C;
CREM-EPCS - 3 ;Ghabri Salah, Hamers Françoise F., Josselin Jean Michel;2016;;Exploring Uncertainty in Economic Evaluations of Drugs and Medical Devices: Lessons from the First Review of Manufacturers’ Submissions to the French National Authority for Health;PharmacoEconomics;;;;;;;;online;;;;;;;;;;;;;;;;;;10.1007/s40273-016-0381-4;;;;;;;;A;2;
CREM-MM - 5 ;Kacker Manish, Perrigot Rozenn;2016;;Retailer use of a professional social media network: Insights from franchising;Journal of Retailing and Consumer Services;;;;;;;; vol 30, pp. 222-233;;;;;;;;;;;;;;;;;;10.1016/j.jretconser.2016.01.020;;;;;;;;B;3;
CREM-EIEC - 6 ;Khelil Nabil;2016;;The many faces of entrepreneurial failure: Insights from an empirical taxonomy;Journal of Business Venturing;;;;;;;; vol 31 ,n° 1, pp. 72-94;;;;;;;;;;;;;;;;;;10.1016/j.jbusvent.2015.08.001;;;;;;;;A;
CREM-MEF - 3 ;Laminou Abdou Souleymane, Moraux Franck;2016;;Pricing and hedging American and hybrid strangles with finite maturity;Journal of Banking and Finance;;;;;;;; vol 62, pp. 112-125;;;;;;;;;;;;;;;;;;10.1016/j.jbankfin.2015.10.003;;;;;;;;A;2;
;Mellios Constantin, Six Pierre, Lai Anh Ngoc;2016;;Dynamic speculation and hedging in commodity futures markets with a stochastic convenience yield;European Journal of Operational Research;;;;;;;; vol 250 ,n° 2, pp. 493-504;;;;;;;;;;;;;;;;;;10.1016/j.ejor.2015.10.045;;;;;;;;A;1;
CREM-MM - 6 ;Picot-Coupey Karine, Huré Elodie, Piveteau Lauren;2016;;Channel design to enrich customers’ shopping experiences: synchronizing clicks with bricks in an omni-channel perspective - the Direct Optic case;International Journal of Retail and Distribution Management;;;;;;;; vol 44 ,n° 3online;;;;;;;;;;;;;;;;;;10.1108/IJRDM-04-2015-0056;;;;;;;;B;3;
CREM-MM - 7 ;Poilpot - Rocaboy Gwénaëlle, Saint-Onge Sylvie;2016;;Les relations entre les perceptions des conflits et des enrichissements travail-famille et le bien-être;Revue de Gestion des Ressources Humaines;;;;;;;; vol 100à paraître;;;;;;;;;;;;;;;;;;;;;;;;;;;3;
CREM-EIEC - 7 ;Renault Michel;2016;;Le marché est-il naturel ? Un essai sur les usages politiques, idéologiques et moraux du « marché biologique » dans le champ économique;Tétralogiques;;;;;;;; ,n° 21, pp. 219-246;;;;;;;;;;;;;;;;;;;;;;;;;;;
CREM-EIEC - 8 ;Renault Michel;2016;;Une approche transactionnelle des démarches d’élaboration participative d’indicateurs sociétaux. La méthode du Conseil de l'Europe.;Innovations - Revue d’économie et de management de l'innovation;;;;;;;; vol 49 ,n° 1, pp. 203-225;;;;;;;;;;;;;;;;;;10.3917/inno.049.0203;;;;;;;;;
CREM-MM - 8 ;Sabaj Meruane Omar, González Vergara Carlos, Pina-Stranger Álvaro;2016;;What We Still Don't Know About Peer Review;Journal of Scholarly Publishing;;;;;;;; vol 47 ,n° 2, pp. 180-212;;;;;;;;;;;;;;;;;;10.3138/jsp.47.2.180;;;;;;;;;
CREM-EPCS - 4 ;Salladarré Frédéric, Brécard Dorothée, Lucas Sterenn, Ollivier Pierrick;2016;;Are French consumers ready to pay a premium for eco-labeled seafood products? A contingent valuation estimation with heterogeneous anchoring;Agricultural Economics;;;;;;;;online;;;;;;;;;;;;;;;;;;10.1111/agec.12226;;;;;;;;B;
CREM-EPCS - 5 ;Ujjayant Chakravorty, Hubert Marie-Hélène, Moreaux Michel, Nøstbakken Linda;2016;;The Long Run Impact of Biofuels on Food Prices;Scandinavian Journal of Economics;;;;;;;;à paraître;;;;;;;;;;;;;;;;;;;;;;;;;;A;
CREM-EIEC - 9 CREM-MM - 9 ;Alis David, Baslé Maurice, Dubois Jean-Marie, Mouline Aziz;2015;;Développer au sein de l’Université l’objectif d’insertion professionnelle des étudiants. Une étude de cas d’ambidextrie organisationnelle;Revue Politiques et Management Public;;;;;;;; vol 32 ,n° 1, pp. 45-61;;;;;;;;;;;;;;;;;;;;;;;;;;;
CREM-EIEC - 10 ;Attallah May;2015;;Représentativité et hétérogénéité des préférences dans les expériences de laboratoire;Actualite Economique;;;;;;;;à paraitre;;;;;;;;;;;;;;;;;;;;;;;;;;C;
CREM-EIEC - 11 ;Attema Arthur E., Brouwer Werner B.f., L’Haridon Olivier, Pinto Jose Luis;2015;;Estimating sign-dependent societal preferences for quality of life;Journal of Health Economics;;;;;;;; vol 43, pp. 229-243;;;;;;;;;;;;;;;;;;10.1016/j.jhealeco.2015.07.006;;;;;;;;A;1;
CREM-EIEC - 12 ;Aubry Mathilde, Bonnet Jean, Renou-Maissant Patricia;2015;;Entrepreneurship and the business cycle: the “Schumpeter” effect versus the “refugee” effect—a French appraisal based on regional data;The Annals of Regional Science;;;;;;;; vol 54 ,n° 1, pp. 23-55;;;;;;;;;;;;;;;;;;10.1007/s00168-014-0645-x;;;;;;;;;
CREM-EPCS - 6 ;Augustine J., Chen Ning, Elkind Edith, Fanelli Angelo, Gravin Nick, Shiryaev Dmitry;2015;;Dynamics of profit- sharing games;Internet Mathematics;;;;;;;; vol 11 ,n° 1, pp. 1-22;;;;;;;;;;;;;;;;;;10.1080/15427951.2013.830164;;;;;;;;;
CREM-EPCS - 7 ;Augustine John, Caragiannis Ioannis, Fanelli Angelo, Kalaitzis Christos;2015;;Enforcing Efficient Equilibria in Network Design Games via Subsidies;Algorithmica;;;;;;;; vol 72 ,n° 1, pp. 44-82;;;;;;;;;;;;;;;;;;10.1007/s00453-013-9845-5;;;;;;;;;0;
CREM-EIEC - 13 ;Auriol E., Biancini S.;2015;;Powering Up Developing Countries through Integration?;The World Bank Economic Review;;;;;;;; vol 29 ,n° 1, pp. 1-40;;;;;;;;;;;;;;;;;;10.1093/wber/lht021;;;;;;;;;
CREM-MM - 10 ;Basset Guy, Perrigot Rozenn;2015;;Franchisees’ Resale Price Policy Facing Legal, Contractual and Professional Constraints: Insights from European and French Perspectives;Research in Law and Economics;;;;;;;; vol 27, pp. 119-142;;;;;;;;;;;;;;;;;;10.1108/S0193-589520150000027009;;;;;;;;;
CREM-MEF - 4 ;Bastos Marco T., Mercea Dan, Charpentier Arthur;2015;;Tents, Tweets, and Events: The Interplay Between Ongoing Protests and Social Media;Journal of Communication;;;;;;;; vol 65 ,n° 2, pp. 320-350;;;;;;;;;;;;;;;;;;10.1111/jcom.12145;;;;;;;;;
CREM-EPCS - 8 CREM-MEF - 5 ;Ben Zaied Younes, Ben Cheikh Nidhaleddine;2015;;Long-Run Versus Short-Run Analysis of Climate Change Impacts on Agricultural Crops;Environmental Modelling and Assessment;;;;;;;; vol 20 ,n° 3, pp. 259-271;;;;;;;;;;;;;;;;;;10.1007/s10666-014-9432-4;;;;;;;;;
CREM-EPCS - 9 ;Ben Zaied Younes, Binet Marie-Estelle;2015;;Modelling seasonality in residential water demand: the case of Tunisia;Advances in Applied Microeconomics;;;;;;;; vol 47 ,n° 19, pp. 1983-1996;;;;;;;;;;;;;;;;;;10.1080/00036846.2014.1002896;;;;;;;;;
CREM-MEF - 6 CREM-EPCS - 10 ;Benjamin Catherine, Cadoret David Isabelle, Hubert Marie-Hélène;2015;;The European Climate Policy is Ambitious: Myth or Reality?;Revue d Economie Politique;;;;;;;; vol 125 ,n° 5, pp. 731-753;;;;;;;;;;;;;;;;;;10.3917/redp.255.0731;;;;;;;;B;
CREM-MEF - 7 ;Bernard Carole, Moraux Franck, Rüschendorf Ludger, Vanduffel Steven;2015;;Optimal payoffs under state-dependent preferences;Quantitative Finance;;;;;;;; vol 15 ,n° 7, pp. 1157-1173;;;;;;;;;;;;;;;;;;10.1080/14697688.2014.981576;;;;;;;;B;3;
CREM-EPCS - 11 ;Bervoets Sebastian, Merlin Vincent;2015;;On avoiding vote swapping;Social Choice and Welfare;;;;;;;;online;;;;;;;;;;;;;;;;;;10.1007/s00355-015-0923-2;;;;;;;;A;1;
CREM-EPCS - 12 ;Bervoets Sebastian, Merlin Vincent, Woeginger Gerhard J.;2015;;Vote trading and subset sums;Operations Research Letters;;;;;;;; vol 43 ,n° 1, pp. 99-102;;;;;;;;;;;;;;;;;;10.1016/j.orl.2014.12.007;;;;;;;;A;
CREM-EPCS - 13 CREM-MEF - 8 ;Binet Marie-Estelle, Pentecôte Jean-Sébastien;2015;;Macroeconomic idiosyncrasies and European monetary unification: A sceptical long run view;Economic Modelling;;;;;;;; vol 51, pp. 412-423;;;;;;;;;;;;;;;;;;10.1016/j.econmod.2015.08.030;;;;;;;;A;2;
CREM-EPCS - 14 ;Binet Marie-Estelle, Facchini François;2015;;The factors determining firm start-ups in French regions and the heterogeneity of regional labor markets;The Annals of Regional Science;;;;;;;; vol 54 ,n° 1, pp. 251-268;;;;;;;;;;;;;;;;;;10.1007/s00168-014-0653-x;;;;;;;;;
CREM-EIEC - 14 ;Bonein Aurélie, Denant-Boèmont Laurent;2015;;Self-control, commitment and peer pressure:a laboratory experiment;Experimental Economics;;;;;;;; vol 18 ,n° 4, pp. 543-568;;;;;;;;;;;;;;;;;;10.​1007/​s10683-014-9419-7;;;;;;;;A;1;
CREM-MM - 11 ;Bouille Julien, Robert-Demontrond Philippe;2015;;Webactivisme et dynamiques de la résistance consumériste. Cadre analytique et étude expérimentale;RIMHE : Revue Interdisciplinaire Management, Homme(s) & Entreprise;;;;;;;; vol 16 ,n° 2, pp. 37-59;;;;;;;;;;;;;;;;;;10.3917/rimhe.016.0037;;;;;;;;;
CREM-EPCS - 15 ;Bunel Mathieu, L'horty Yannick, Petit Pascale;2015;;Discrimination based on place of residence and access to employment;Urban Studies;;;;;;;;online;;;;;;;;;;;;;;;;;;10.1177/0042098014563470;;;;;;;;A;2;
CREM-EIEC - 15 ;Chambolle Claire, Christin Clémence, Meunier Guy;2015;;Optimal Production Channel for Private Labels: Too Much or Too Little Innovation?;Journal of Economics and Management Strategy;;;;;;;; vol 24 ,n° 2, pp. 348-368;;;;;;;;;;;;;;;;;;10.1111/jems.12098;;;;;;;;A;
CREM-EPCS - 16 ;Chantreuil Frédéric, Lebon Isabelle;2015;;Gender contribution to income inequality;Economics Letters;;;;;;;; vol 133, pp. 27-30;;;;;;;;;;;;;;;;;;10.1016/j.econlet.2015.05.009;;;;;;;;B;3;
CREM-MEF - 9 ;Charpentier Arthur, Diogo Barry Amadou;2015;;BIG DATA : passer d'une analyse de corrélation à une interprétation causale;Risques;;;;;;;; ,n° 101, pp. 107-111;;;;;;;;;;;;;;;;;;;;;;;;;;;0;
;Charpentier Arthur, Gallic Ewen;2015;;Kernel density estimation based on Ripley’s correction;GeoInformatica;;;;;;;;online;;;;;;;;;;;;;;;;;;10.1007/s10707-015-0232-z;;;;;;;;;
CREM-MEF - 10 ;Charpentier Arthur, Durand Marilou;2015;;Modeling earthquake dynamics;Journal of Seismology;;;;;;;; vol 19 ,n° 3, pp. 721-739;;;;;;;;;;;;;;;;;;10.1007/s10950-015-9489-9;;;;;;;;;
CREM-MEF - 11 ;Charpentier Arthur, Denuit Michel M., Elie Romuald;2015;;Segmentation et mutualisation, les deux faces d'une même pièce?;Risques;;;;;;;; ,n° 103, pp. 19-23;;;;;;;;;;;;;;;;;;;;;;;;;;;0;
CREM-MEF - 12 CREM-EPCS - 17 ;Charpentier Arthur, Cherrier Béatrice;2015;;«Mathiness» et assurance;Risques;;;;;;;; ,n° 104, pp. 111-116;;;;;;;;;;;;;;;;;;;;;;;;;;;0;
CREM-EPCS - 18 ;Chaudhuri Basudeb;2015;;Identity, Nations and the Requirements of Global Justice: Limits of the Debate in Democratic Politics;Journal of Interdisciplinary Economics;;;;;;;; vol 27 ,n° 2, pp. 129-151;;;;;;;;;;;;;;;;;;10.1177/0260107914560863;;;;;;;;;
CREM-MM - 12 ;Chédotel Frédérique, Stimec Arnaud, Vignikin Aristide;2015;;Management des équipes projet : l’impact de la gestion des conflits et de l’improvisation organisationnelle sur la performance;Revue de Gestion des Ressources Humaines;;;;;;;; vol 2 ,n° 96, pp. 24-41;;;;;;;;;;;;;;;;;;;;;;;;;;;3;
CREM-MM - 13 ;Croizean Jean-Philippe, Vyt Dany;2015;;Temps subjectif et temps mesuré : faut-il revoir la définition des zones de chalandise ?;GÉOgraphie ÉCOnomie SOCiété;;;;;;;; vol 17, pp. 201-224;;;;;;;;;;;;;;;;;;10.3166/ges.17.201-224;;;;;;;;C;
CREM-EIEC - 16 ;Danau Daniel, Vinella Annalisa;2015;;Public-Private Contracting under Limited Commitment;Journal of Public Economic Theory;;;;;;;; vol 17 ,n° 1, pp. 78-110;;;;;;;;;;;;;;;;;;10.1111/jpet.12113;;;;;;;;A;2;
CREM-EIEC - 17 ;Darmon Eric, Dejean Sylvain, Pénard Thierry;2015;;La réponse graduée de l’Hadopi a-t-elle eu des effets sur le piratage de musique et de films ? Une étude empirique des pratiques de consommation en ligne;Revue économique;;;;;;;;à paraitre;;;;;;;;;;;;;;;;;;;;;;;;;;;3;
CREM-MEF - 13 ;De La Bruslerie Hubert, Fouilloux Jessica;2015;;Interest Term Premiums and C-CAPM: A Test of a Parsimonious Model;Finance;;;;;;;; vol 35 ,n° 3, pp. 97-145;;;;;;;;;;;;;;;;;;;;;;;;;;;2;
CREM-MEF - 14 ;Debon Maxime, Moraux Franck, Navatte Patrick;2015;;Le coût du financement par obligations rachetables : une étude empirique;Finance Contrôle Stratégie;;;;;;;; vol 18 ,n° 2online;;;;;;;;;;;;;;;;;;;;;;;;;;B;3;
CREM-EIEC - 18 ;Dejean Sylvain, Jullien Nicolas;2015;;Big from the beginning: Assessing online contributors' behavior by their first contribution;Research Policy;;;;;;;; vol 44, pp. 1226-1239;;;;;;;;;;;;;;;;;;10.1016/j.respol.2015.03.001;;;;;;;;A;2;
CREM-EPCS - 19 ;Dellemotte Jean, Walraevens Benoît;2015;;Adam Smith on the subordination of wage-earners in the commercial society;European Journal of the History of Economic Thought;;;;;;;; vol 22 ,n° 4, pp. 692-727;;;;;;;;;;;;;;;;;;10.1080/09672567.2013.792375;;;;;;;;A;2;
CREM-EIEC - 19 ;Dickinson David L., Masclet David;2015;;Emotion venting and punishment in public good experiments;Journal of Public Economics;;;;;;;; vol 122, pp. 55-67;;;;;;;;;;;;;;;;;;10.1016/j.jpubeco.2014.10.008;;;;;;;;A;1;
CREM-EIEC - 20 ;Dickinson David, Masclet David, Villeval Marie Claire;2015;;Norm Enforcement in Social Dilemmas An Experiment with Police Commissioners;Journal of Public Economics;;;;;;;; ,n° 126, pp. 74-85;;;;;;;;;;;;;;;;;;10.1016/j.jpubeco.2015.03.012;;;;;;;;A;1;
CREM-EPCS - 20 ;Doghmi Ahmed, Ziad Abderrahmane;2015;;Nash implementation in private good economies with single-plateaued preferences and in matching problems;Mathematical Social Sciences;;;;;;;; vol 73, pp. 32-39;;;;;;;;;;;;;;;;;;10.1016/j.mathsocsci.2014.11.002;;;;;;;;A;2;
CREM-EIEC - 21 ;Donfouet Hermann Pythagore Pierre, Cook Joseph, Jeanty P. Wilner;2015;;The economic value of improved air quality in urban Africa: a contingent valuation survey in Douala, Cameroon;Environment and Development Economics;;;;;;;; vol 20 ,n° 05, pp. 630-649;;;;;;;;;;;;;;;;;;10.1017/S1355770X14000552;;;;;;;;B;
CREM-MM - 14 ;Douard Jean-Pierre, Heitz Michèle, Cliquet Gérard;2015;;Retail attraction revisited: From gravitation to purchase flows, a geomarketing application;Recherche et Applications en Marketing (English Edition);;;;;;;; vol 30 ,n° 1, pp. 110-129;;;;;;;;;;;;;;;;;;10.1177/2051570714565066;;;;;;;;;
CREM-EIEC - 22 ;Draperi Jean-François, Le Corroller Cécile;2015;;Coopératives et territoires en France : des liens spécifiques et complexes;Revue internationale de l'économie sociale : RECMA.;;;;;;;; vol 335, pp. 53-68;;;;;;;;;;;;;;;;;;;;;;;;;;;
CREM-MM - 15 ;Droulers Olivier, Safaa Adil;2015;;Could Face Presence In Print Ads Influence Memorization?;Journal of Applied Business Research;;;;;;;; vol 31 ,n° 4, pp. 1403-1408;;;;;;;;;;;;;;;;;;10.19030/jabr.v31i4.9326;;;;;;;;B;3;
CREM-MM - 16 ;Droulers Olivier, Amar Jennifer;2015;;The legibility of food package information in France: an equal challenge for young and elderly consumers?;Public Health Nutrition;;;;;;;;à paraître;;;;;;;;;;;;;;;;;;10.1017/S1368980015002141;;;;;;;;;
CREM-MM - 17 ;Droulers Olivier, Lacoste-Badie Sophie, Malek Faten;2015;;Age-Related Differences in Emotion Regulation within the Context of Sad and Happy TV Programs;Psychology and Marketing;;;;;;;; vol 32 ,n° 8, pp. 795-807;;;;;;;;;;;;;;;;;;10.1002/mar.20819;;;;;;;;;
CREM-MM - 18 ;Droulers Olivier, Adil Safaa;2015;;Perceived gaze direction modulates ad memorization.;Journal of Neuroscience, Psychology, and Economics;;;;;;;; vol 8 ,n° 1, pp. 15-26;;;;;;;;;;;;;;;;;;10.1037/npe0000029;;;;;;;;;
CREM-EPCS - 21 ;Dubois Eric, Leprince Matthieu;2015;;Do Closeness and Stake Increase Voter Turnout? Evidence from Election Results in Small French Towns in Brittany;Regional Studies;;;;;;;;à paraître;;;;;;;;;;;;;;;;;;;;;;;;;;A;
CREM-MM - 19 ;El Akremi Assâad, Perrigot Rozenn, Piot-Lepetit Isabelle;2015;;Examining the drivers for franchised chains performance through the lens of the dynamic capabilities approach;Journal of Small Business Management;;;;;;;; vol 53 ,n° 1, pp. 145-165;;;;;;;;;;;;;;;;;;10.1111/jsbm.12059;;;;;;;;A;2;
CREM-MEF - 15 ;Fall Malick, Viviani Jean-Laurent;2015;;A new multi-factor risk model to evaluate funding liquidity risk of banks;European Journal of Finance;;;;;;;;online;;;;;;;;;;;;;;;;;;10.1080/1351847X.2014.996656;;;;;;;;C;
CREM-EPCS - 22 ;Fanelli Angelo, Leniowski Darius, Monaco Gianpiero, Sankowski Piotr;2015;;The ring design game with fair cost allocation;Theoretical Computer Science;;;;;;;; vol 562, pp. 90-100;;;;;;;;;;;;;;;;;;10.1016/j.tcs.2014.09.035;;;;;;;;;0;
CREM-EPCS - 23 ;Fiorino Nadia, Galli Emma, Padovano Fabio;2015;;How long does it take for government decentralization to affect corruption?;Economics of Governance;;;;;;;; vol 16 ,n° 3, pp. 273-305;;;;;;;;;;;;;;;;;;10.1007/s10101-015-0156-y;;;;;;;;B;
CREM-EPCS - 24 ;Fiorino Nadia, Gavoille Nicolas, Padovano Fabio;2015;;Rewarding judicial independence: Evidence from the Italian Constitutional Court;International Review of Law and Economics;;;;;;;; vol 43, pp. 56-66;;;;;;;;;;;;;;;;;;10.1016/j.irle.2015.05.002;;;;;;;;A;1;
CREM-MEF - 16 ;Fouilloux Jessica, Moraux Franck, Viviani Jean-Laurent;2015;;Investing in finite-life carbon emissions reduction program under risk and idiosyncratic uncertainty;Energy Policy;;;;;;;; vol 82, pp. 310-320;;;;;;;;;;;;;;;;;;10.1016/j.enpol.2014.12.004;;;;;;;;A;2;
;Gavrel Frédéric;2015;;Participation, Recruitment Selection, and the Minimum Wage: Online Appendix Dynamics and directed search;Scandinavian Journal of Economics;;;;;;;; vol 117 ,n° 4, pp. 20;;;;;;;;;;;;;;;;;;10.1111/sjoe.12106;;;;;;;;A;
CREM-EPCS - 25 ;Gavrel Frédéric;2015;;Participation, Recruitment Selection, and the Minimum Wage;Scandinavian Journal of Economics;;;;;;;; vol 117 ,n° 4, pp. 1281-1305.;;;;;;;;;;;;;;;;;;10.1111/sjoe.12106;;;;;;;;A;
CREM-EPCS - 26 ;Gilardone Muriel;2015;;Rawls's influence and counter-influence on Sen: post-welfarism and impartiality;European Journal of the History of Economic Thought;;;;;;;; vol 22 ,n° 2, pp. 198-235;;;;;;;;;;;;;;;;;;10.1080/09672567.2013.792365;;;;;;;;A;2;
CREM-EPCS - 27 ;Gravel Nicolas, Tarroux Benoît;2015;;Robust normative comparisons of socially risky situations;Social Choice and Welfare;;;;;;;; vol 44 ,n° 2, pp. 257-282;;;;;;;;;;;;;;;;;;10.1007/s00355-014-0833-8;;;;;;;;A;1;
CREM-EPCS - 28 CREM-MM - 20 ;Grolier Jacques;2015;;Comparaison de salaires moyens : les dangers de l'effet structure;Santé RH;;;;;;;; ,n° 71, pp. 15-19;;;;;;;;;;;;;;;;;;;;;;;;;;;0;
CREM-EPCS - 29 ;Grolier Jacques;2015;;Coût par séjour : de la neutralisation de l’effet «case-mix» à l’identification de l’origine des différentiels de coûts;Finances hospitalières;;;;;;;; ,n° 93, pp. 8-13;;;;;;;;;;;;;;;;;;;;;;;;;;;0;
CREM-EPCS - 30 ;Grolier Jacques;2015;;L'efficience financière des investissements hospitaliers;Gestions hospitalières;;;;;;;; ,n° 545, pp. 239-242;;;;;;;;;;;;;;;;;;;;;;;;;;;0;
CREM-EPCS - 31 ;Jaramillo Fernando, Kempf Hubert, Moizeau Fabien;2015;;Heterogeneity and the formation of risk-sharing coalitions;Journal of Development Economics;;;;;;;; vol 114, pp. 79-96;;;;;;;;;;;;;;;;;;10.1016/j.jdeveco.2014.09.003;;;;;;;;A;1;
CREM-MEF - 17 ;Jedidi Ons, Pentecôte Jean-Sébastien;2015;;Robust Signals for Banking Crises;Economics Bulletin;;;;;;;; vol 35 ,n° 3, pp. 1617-1629;;;;;;;;;;;;;;;;;;;;;;;;;;B;3;
CREM-EPCS - 32 ;Josselin Jean-Michel;2015;;Public Choice Reflections on the Measurement of Political Power;Homo Oeconomicus;;;;;;;; vol 32 ,n° 1, pp. 157-161;;;;;;;;;;;;;;;;;;;;;;;;;;;E;
CREM-EIEC - 23 ;Kadohognon Ouattara Sylvain;2015;;Incentives to merge in asymmetric mixed oligopoly;Economics Bulletin;;;;;;;; vol 35 ,n° 2, pp. 885-895;;;;;;;;;;;;;;;;;;;;;;;;;;B;3;
CREM-EPCS - 33 ;Kamwa Eric, Merlin Vincent;2015;;Scoring rules over subsets of alternatives: Consistency and paradoxes;Journal of Mathematical Economics;;;;;;;; vol 61, pp. 130-138;;;;;;;;;;;;;;;;;;10.1016/j.jmateco.2015.08.008;;;;;;;;A;1;
CREM-EPCS - 34 ;Kamwa Eric;2015;;On the Fishburn social choice function;International Journal of Economic Theory;;;;;;;; vol 11 ,n° 2, pp. 247-262;;;;;;;;;;;;;;;;;;10.1111/ijet.12063;;;;;;;;B;
CREM-MEF - 18 ;Lai Anh Ngoc, Mellios Constantin;2015;;Valuation of commodity derivatives with an unobservable convenience yield;Computers and Operations Research;;;;;;;;online;;;;;;;;;;;;;;;;;;10.1016/j.cor.2015.03.007;;;;;;;;;
CREM-MM - 21 ;Lawrence Benjamin, Perrigot Rozenn;2015;;Influence of Organizational Form and Customer Type on Online Customer Satisfaction Ratings;Journal of Small Business Management;;;;;;;; vol 53, pp. 58-74;;;;;;;;;;;;;;;;;;10.1111/jsbm.12184;;;;;;;;A;2;
CREM-EIEC - 24 ;Le Pape Nicolas;2015;;Risque de défaut et concurrence sur le marché des produits;Revue économique;;;;;;;;online;;;;;;;;;;;;;;;;;;10.3917/reco.pr2.0051;;;;;;;;;3;
;Louhichi Waël, Zreik Ousayna;2015;;Corporate Risk Reporting: A study of The Impact of Risk Disclosure on Firms Reputation;Economics Bulletin;;;;;;;; vol 35 ,n° 4, pp. 2395-2408;;;;;;;;;;;;;;;;;;;;;;;;;;B;3;
CREM-EIEC - 25 ;Lumeau Marianne, Thierry Clémence;2015;;La demande de livres de fiction en bibliothèques;Réseaux;;;;;;;; vol 2 ,n° 190-191, pp. 275-298;;;;;;;;;;;;;;;;;;10.3917/res.190-191.0275;;;;;;;;C;4;
CREM-EIEC - 26 ;Lumeau Marianne, Masclet David, Pénard Thierry;2015;;Reputation and social (dis)approval in feedback mechanisms: An experimental study;Journal of Economic Behavior and Organization;;;;;;;; vol 112, pp. 127-140;;;;;;;;;;;;;;;;;;10.1016/j.jebo.2015.02.002;;;;;;;;A;2;
CREM-MM - 22 ;Lux Gulliver;2015;;Adoption et usages des outils de gestion de l’absentéisme : l’importance des jeux d’acteurs et jeux de pouvoir;Gestion et Management public;;;;;;;; vol 3-4 ,n° 2, pp. 83-106;;;;;;;;;;;;;;;;;;10.3917/gmp.034.0083;;;;;;;;;
CREM-MM - 23 ;Lux Gulliver, Petit Nicolas;2015;;Coalitions of Actors and Managerial Innovations in the Healthcare and Social Healthcare Sector;Public Organization Review;;;;;;;;online;;;;;;;;;;;;;;;;;;10.1007/s11115-015-0304-4;;;;;;;;B;
CREM-MM - 24 ;Mammar El Hadj Sihem, Chédotel Frédérique, Pujol Laurent;2015;;Construire un projet inter-organisationnel dans l’Economie sociale et solidaire : quel lien entre l’identification et l’émergence d’une compétence inter-organisationnelle ?;Revue Française de Gestion;;;;;;;; vol 41 ,n° 246, pp. 169-173;;;;;;;;;;;;;;;;;;10.3166/rfg.246.159-173;;;;;;;;C;4;
CREM-MEF - 19 ;Martin Franck, Nguyen Mai Lan;2015;;Asymmetric dynamics in the correlations of hedge fund strategy indices: what lessons about financial contagion ?;Economics Bulletin;;;;;;;; vol 35 ,n° 4, pp. 2110-2125;;;;;;;;;;;;;;;;;;;;;;;;;;B;3;
CREM-EIEC - 27 ;Martin L., Omrani N.;2015;;An assessment of trends in technology use, innovative work practices and employees’ attitudes in Europe;Applied Economics;;;;;;;; vol 47 ,n° 6, pp. 623-638;;;;;;;;;;;;;;;;;;10.1080/00036846.2014.978072;;;;;;;;A;2;
