Auteurs;Année;Année de soutenance;Titre;Titre journal;Année;Volume;Issue;Editeur scientifique;Titre ouvrage;Titre du volume;Editeur revue;Volume, Issue, Pages;ISBN;Titre conférence;Commentaire;Date congrès;Ville;Pays;Patent n°;Date de publication;Type de rapport;N°;Organisme de délivrance;Pages;Date de publication;Directeur de thèse;Université de soutenance;Année de soutenance;Organisme de délivrance;DOI;NNT;Pubmed;Référence;ArXiv;Description;Voir aussi;Réf. HAL;Rang HCERES;Rang CNRS
Peyta L., Jarnouen K., Pinault M., Coulouarn C., Guimaraes C., Goupille C., Pais De Barros J.-P., Chevalier S., Dumas J.-F., Maillot F., Hatch G. M., Loyer P., Servais S.;2015;;Regulation of hepatic cardiolipin metabolism by TNFα: Implication in cancer cachexia;BBA - Biochimica et Biophysica Acta;;1851;11;;;;;1490-1500;;;;;;;;;;;;;;;;;10.1016/j.bbalip.2015.08.008;;26327596;;;;;;;
Plé C., Richoux R., Jardin J., Nurdin M., Briard-Bion V., Parayre S., Ferreira S., Pot B., Bouguen G., Deutsch S.-A., Falentin H., Foligné B., Jan G.;2015;;Single-strain starter experimental cheese reveals anti-inflammatory effect of Propionibacterium freudenreichii CIRM BIA 129 in TNBS-colitis model;journal of functional foods;;18, Part A;;;;;;575-585;;;;;;;;;;;;;;;;;10.1016/j.jff.2015.08.015;;;;;;;;;
Polard E., Nowak E., Happe A., Biraben A., Oger E.;2015;;Brand name to generic substitution of antiepileptic drugs does not lead to seizure-related hospitalization: a population-based case-crossover study;Pharmacoepidemiology and Drug Safety;;24;11;;;;;1161-1169;;;;;;;;;;;;;;;;;10.1002/pds.3879;;;;;;;;;
Pothier K., Benguigui N., Kulpa R., Chavoix C.;2015;;Multiple Object Tracking While Walking: Similarities and Differences Between Young, Young-Old, and Old-Old Adults;Journals of Gerontology Series B: Psychological Sciences and Social Sciences;;70;6;;;;;840-849;;;;;;;;;;;;;;;;;10.1093/geronb/gbu047;;;;;;;;;
Poullot E., Jacquet-Kammerer S.-L., Pagenault M., Llamas-Gutierrez F.;2015;;Une endoscopie redoutable [A terrible endoscopy].;Annales de Pathologie;;35;2;;;;;174-176;;;;;;;;;;;;;;;;;10.1016/j.annpat.2015.01.008;;25765141;;;;;;;
Puéchal X., Pagnoux C., Perrodeau E., Hamidou M., Boffa J.-J., Kyndt X., Lifermann F., Papo T., Merrien D., Smail A., Delaval P., Hanrotel-Saliou C., Imbert B., Khouatra C., Lambert M.  et al.;2015;;Long-term outcomes of the WEGENT trial on remission-maintenance for granulomatosis with polyangiitis or microscopic polyangiitis;Arthritis & Rheumatology;;;;;;;;;;;;;;;;;;;;;;;;;10.1002/art.39450;;26473755;;;;;;;
Radoï L., Menvielle G., Cyr D., Lapôtre-Ledoux B., Stücker I., Luce D.;2015;;Population attributable risks of oral cavity cancer to behavioral and medical risk factors in France: results of a large population-based case–control study, the ICARE study;BMC Cancer;;15;;;;;;827;;;;;;;;;;;;;;;;;10.1186/s12885-015-1841-5;;;;;;;;;
Rau F., Lainé J., Ramanoudjame L., Ferry A., Arandel L., Delalande O., Jollet A., Dingli F., Lee K.-Y., Peccate C., Lorain S., Kabashi E., Athanasopoulos T., Koo T., Loew D.  et al.;2015;;Abnormal splicing switch of DMD's penultimate exon compromises muscle fibre maintenance in myotonic dystrophy;Nature Communications;;6;;;;;;7205;;;;;;;;;;;;;;;;;10.1038/ncomms8205;;26018658;;;;;;;
Ravinet A., Cabrespine A., Socie G., Milpied N., Yakoub Agha I., Nguyen S., Michallet M., Menard A. L., Maillard N., Mohty M., Suarez F., Huynh A., Marchand T., Deteix C., Cassuto J. P.  et al.;2015;;Impact of Thymoglobulin by Stem Cell Source (Peripheral Blood Stem Cell or Bone Marrow) After Myeloablative Stem Cell Transplantation From HLA 10/10-Matched Unrelated Donors. A Report From the Société Française de Greffe de Moelle et de Thérapie Cellulaire;Transplantation;;;;;;;;;;;;;;;;;;;;;;;;;10.1097/TP.0000000000000976;;26528768;;;;;;;
Rayar M., Sulpice L., Edeline J., Garin E., Levi Sandri G. B., Meunier B., Boucher E., Boudjema K.;2015;;The combination of intra-arterial yttrium-90 radioembolization with systemic chemotherapy is a promising method for the downstaging to surgery of initially unresectable huge intrahepatic cholangiocarcinoma;Annals of Surgical Oncology;;22;9;;;;;3102-8;;;;;;;;;;;;;;;;;10.1245/s10434-014-4365-3;;25623598;;;;;;;
Reboutier D., Benaud C., Prigent C.;2015;;Aurora A's Functions During Mitotic Exit: The Guess Who Game;Frontiers in Oncology;;5;;;;;;290;;;;;;;;;;;;;;;;;10.3389/fonc.2015.00290;;26734572;;;;;;;
Renaud S., Corcé V., Cannie I., Ropert M., Lepage S., Loréal O., Deniaud D., Gaboriau F.;2015;;Quilamine HQ1-44, an iron chelator vectorized toward tumor cells by the polyamine transport system, inhibits HCT116 tumor growth without adverse effect;Biochemical Pharmacology;;96;3;;;;;179-189;;;;;;;;;;;;;;;;;10.1016/j.bcp.2015.06.001;;26070250;;;;;;;
Revest M., Camou F., Senneville E., Caillon J., Laurent F., Calvet B., Feugier P., Batt M., Chidiac C.;2015;;Medical treatment of prosthetic vascular graft infections: review of the literature and proposals of a Working Group;International Journal of Antimicrobial Agents;;46;3;;;;;254-265;;;;;;;;;;;;;;;;;10.1016/j.ijantimicag.2015.04.014;;26163735;;;;;;;
Richette P., Clerson P., Bouée S., Chalès G., Doherty M., Flipo R. M., Lambert C., Lioté F., Poiraud T., Schaeverbeke T., Bardin T.;2015;;Identification of patients with gout: elaboration of a questionnaire for epidemiological studies;Annals of the Rheumatic Diseases;;74;9;;;;;1684-1690;;;;;;;;;;;;;;;;;10.1136/annrheumdis-2013-204976;;24796335;;;;;;;
Ropars M., Common H., Guillin R., Hervé A., Guggenbhul P.;2015;;Coracoid-like osteochondroma and painful giant thoracic bursitis;Joint, Bone, Spine: Revue Du Rhumatisme;;;;;;;;;;;;;;;;;;;;;;;;;10.1016/j.jbspin.2015.05.014;;26677990;;;;;;;
Ropars M., Crétual A., Kaila R., Bonan I., Anthony H., Thomazeau H.;2015;;Diagnosis and treatment of anteroinferior capsular redundancy associated with anterior shoulder instability using an open Latarjet procedure and capsulorrhaphy;Knee Surgery, Sports Traumatology, Arthroscopy;;;;;;;;;;;;;;;;;;;;;;;;;10.1007/s00167-015-3621-9;;;;;;;;;
Ropert M., Détivaud L., Fimbel D'hauthuille B., Gautier M., Leroyer P., Jouanolle A.-M., Loréal O., Brissot P.;2015;;Monoclonal anti-transferrin antibody: A paradigm for better understanding of iron metabolism.;American Journal of Hematology;;90;6;;;;;E129-E130;;;;;;;;;;;;;;;;;10.1002/ajh.24004;;25779881;;;;;;;
Ruff M., Leyme A., Le Cann F., Bonnier D., Le Seyec J., Chesnel F., Fattet L., Rimokh R., Baffet G., Theret N.;2015;;The Disintegrin and Metalloprotease ADAM12 Is Associated with TGF-β-Induced Epithelial to Mesenchymal Transition;PLoS ONE;;10;9;;;;;e0139179;;;;;;;;;;;;;;;;;10.1371/journal.pone.0139179;;26407179;;;;;;;
Ruivard M., Lainé F., Deugnier Y.;2015;;Iron absorption in Nonalcoholic Steatohepatitis (NASH) and Dysmetabolic iron overload syndrome (DIOS);Hepatology (Baltimore, Md.);;;;;;;;;;;;;;;;;;;;;;;;;10.1002/hep.28296;;26476299;;;;;;;
Sa Cunha A., Carrere N., Meunier B., Fabre J.-M., Sauvanet A., Pessaux P., Ortega-Deballon P., Fingerhut A., Lacaine F.;2015;;Stump closure reinforcement with absorbable fibrin collagen sealant sponge (TachoSil®) does not prevent pancreatic fistula after distal pancreatectomy: the FIABLE* multicenter controlled randomized study;American Journal of Surgery;;210;4;;;;;739-748;;;;;;;;;;;;;;;;;10.1016/j.amjsurg.2015.04.015;;26160763;;;;;;;
Salaun E., Lefeuvre-Orfila L., Cavey T., Martin B., Turlin B., Ropert M., Loréal O., Derbré F.;2015;;Myriocin prevents muscle ceramide accumulation, but not muscle fiber atrophy during short-term mechanical unloading;Journal of Applied Physiology;;;;;;;;jap.00720.2015;;;;;;;;;;;;;;;;;10.1152/japplphysiol.00720.2015;;26542521;;;;;;;
Salou M., Garcia A., Michel L., Gainche-Salmon A., Loussouarn D., Nicol B., Guillot F., Hulin P., Nedellec S., Baron D., Ramstein G., Soulillou J.-P., Brouard S., Nicot A. B., Degauque N.  et al.;2015;;Expanded CD8 T-cell sharing between periphery and CNS in multiple sclerosis;Annals of Clinical and Translational Neurology;;;;;;;;2(6): 609-622;;;;;;;;;;;;;;;;;10.1002/acn3.199;;;;;;;;;
Salvati R., Hitti E., Bellanger J.-J., Saint-Jalmes H., Gambarota G.;2015;;Fat ViP MRI: Virtual Phantom Magnetic Resonance Imaging of water-fat systems;Magnetic Resonance Imaging;;;;;;;;;;;;;;;;;;;;;;;;;10.1016/j.mri.2015.12.002;;26681180;;;;;;;
Salvati R., Gambarota G.;2015;;MRI-Based Direct Measurements of the T2* Transverse Relaxation Time of Water and Lipid Protons in Water–Lipid Mixtures;Applied Magnetic Resonance;;;;;;;;1-10;;;;;;;;;;;;;;;;;10.1007/s00723-015-0737-5;;;;;;;;;
Sandborn W. J., Bouguen G.;2015;;Reply to: Van Kruiningen, H. (2015). Missing the Target to Treat in Crohn's Disease. Clinical gastroenterology and hepatology;Clinical Gastroenterology and Hepatology;;13;13;;;;;2382;;;;;;;;;;;;;;;;;10.1016/j.cgh.2015.07.042;;;;;;;;;
Sardain H., Lavoue V., Redpath M., Bertheuil N., Foucher F., Leveque J.;2015;;Curative pelvic exenteration for recurrent cervical carcinoma in the era of concurrent chemotherapy and radiation therapy. A systematic review;EJSO - European Journal of Surgical Oncology;;41;8;;;;;975-985;;;;;;;;;;;;;;;;;10.1016/j.ejso.2015.03.235;;25922209;;;;;;;
Sartelli M., Malangoni M. A., Abu-Zidan F. M., Griffiths E. A., Di Bella S., Mcfarland L. V., Eltringham I., Shelat V. G., Velmahos G. C., Kelly C. P., Khanna S., Abdelsattar Z. M., Alrahmani L., Ansaloni L., Augustin G.  et al.;2015;;WSES guidelines for management of Clostridium difficile infection in surgical patients;World Journal of Emergency Surgery;;10;;;;;;38;;;;;;;;;;;;;;;;;10.1186/s13017-015-0033-6;;26300956;;;;;;;
Sbidian E., Hotz C., Seneschal J., Maruani A., Amelot F., Aubin F., Paul C., Beylot Barry M., Humbert P., Dupuy A., Caux F., Dupin N., Modiano P., Lepesant P., Ingen-Housz-Oro S.  et al.;2015;;Anti-TNFα therapy for hidradenitis suppurativa. Results from a national cohort study between 2000 and 2013;British Journal of Dermatology;;;;;;;;Epub;;;;;;;;;;;;;;;;;10.1111/bjd.14199;;26406350;;;;;;;
Schnell F., Riding N., O'hanlon R., Lentz P. A., Donal E., Kervio G., Matelot D., Leurent G., Doutreleau S., Chevalier L., Guerard S., Wilson M. G., Carré F.;2015;;Response to Letter Regarding Article, "Recognition and Significance of Pathological T-Wave Inversions in Athletes";Circulation;;132;14;;;;;e181-182;;;;;;;;;;;;;;;;;10.1161/CIRCULATIONAHA.115.016786;;26438775;;;;;;;
Senéjoux A., Siproudhis L., Abramowitz L., Munoz Bongrand N., Desseaux K., Bouguen G., Bourreille A., Dewit O., Stefanescu C., Vernier G., Louis E., Grimaud J.-C., Godart B., Savoye G., Hebuterne X.  et al.;2015;;Fistula plug in fistulising ano-perineal Crohn's disease: a randomized controlled trial;Journal of Crohn's & Colitis;;;;;;;;In press;;;;;;;;;;;;;;;;;10.1093/ecco-jcc/jjv162;;26351393;;;;;;;
Seror R., Le Gall-David S., Bonnaure-Mallet M., Schaeverbeke T., Cantagrel A., Minet J., Gottenberg J.-E., Chanson P., Ravaud P., Mariette X.;2015;;Anti-Porphyromonas gingivalis antibodies titres are associated with non-smoking status in early rheumatoid arthritis: Results from the ESPOIR cohort;Arthritis & Rheumatology;;67;7;;;;;1729-1737;;;;;;;;;;;;;;;;;10.1002/art.39118;;25779552;;;;;;;
Sharanek A., Burban A., Humber L., Bachour-El Azzi P., Felix-Gomes N., Rainteau D., Guillouzo A.;2015;;Dose-dependent intracellular accumulation of endogenous bile acids in cyclosporine A-treated HepaRG hepatocytes;Toxicology Letters;;238;2, Supplement;;;;;S301-S302;;;;;;;;;;;;;;;;;10.1016/j.toxlet.2015.08.865;;;;;;;;;
Sicre De Fontbrune F., Moignet A., Beaupain B., Suarez F., Galicier L., Socie G., Varet B., Coppo P., Michel M., Pautas C., Oksenhendler E., Lengline E., Terriou L., Moreau P., Chantepie S.  et al.;2015;;Severe chronic primary neutropenia in adults: report on a series of 108 patients;Blood;;126;14;;;;;1643-1650;;;;;;;;;;;;;;;;;10.1182/blood-2015-03-634493;;26261239;;;;;;;
Smonig R., Wallenhorst T., Bouju P., Letheulle J., Le Tulzo Y., Tadié J. M., Gacouin A.;2015;;Constipation is independently associated with delirium in critically ill ventilated patients;Intensive Care Medicine;;42;1;;;;;126-127;;;;;;;;;;;;;;;;;10.1007/s00134-015-4050-4;;26359169;;;;;;;
Souberbielle J., Massart C., Brailly-Tabard S., Cormier C., Cavalier E., Delanaye P., Chanson P.;2015;;Serum PTH reference values established with an automated 3rd-generation assay in vitamin D-replete subjects with normal renal function. Consequence for the diagnosis of primary hyperparathyroidism and the classification of dialysis patients;European Journal of Endocrinology / European Federation of Endocrine Societies;;174;;;;;;315-323;;;;;;;;;;;;;;;;;10.1530/EJE-15-0595;;26628583;;;;;;;
Souberbielle J.-C., Cavalier E., Delanaye P., Massart C., Brailly-Tabard S., Cormier C., Borderie D., Benachi A., Chanson P.;2015;;Serum calcitriol concentrations measured with a new direct automated assay in a large population of adult healthy subjects and in various clinical situations;Clinica Chimica Acta;;451;PART B;;;;;149-153;;;;;;;;;;;;;;;;;10.1016/j.cca.2015.09.021;;26409159;;;;;;;
Strale P.-O., Duchesne L., Peyret G., Montel L., Nguyen T., Png E., Tampé R., Troyanovsky S., Hénon S., Ladoux B., Mège R.-A.;2015;;The formation of ordered nanoclusters controls cadherin anchoring to actin and cell-cell contact fluidity;Journal of Cell Biology;;210;2;;;;;333-346;;;;;;;;;;;;;;;;;10.1083/jcb.201410111;;26195669;;;;;;;
Suzuki M., Sakata I., Sakai T., Tomioka H., Nishigaki K., Tramier M., Coppey-Moisan M.;2015;;A high-throughput direct FRET-based assay for analysing apoptotic proteases using flow cytometry and fluorescence-lifetime measurements;Analytical Biochemistry;;491;;;;;;10-17;;;;;;;;;;;;;;;;;10.1016/j.ab.2015.08.022;;26334608;;;;;;;
Sánchez-Bretaño A., Gueguen M.-M., Cano-Nicolau J., Kah O., Alonso-Gómez Á. L., Delgado M. J., Isorna E.;2015;;Anatomical distribution and daily profile of gper1b gene expression in brain and peripheral structures of goldfish (Carassius auratus);Chronobiology International;;32;7;;;;;889-902;;;;;;;;;;;;;;;;;10.3109/07420528.2015.1049615;;26171989;;;;;;;
Sánchez-Bretaño A., Blanco A. M., Unniappan S., Kah O., Gueguen M.-M., Bertucci J. I., Alonso-Gómez Á. L., Valenciano A. I., Isorna E., Delgado M. J.;2015;;In Situ Localization and Rhythmic Expression of Ghrelin and ghs-r1 Ghrelin Receptor in the Brain and Gastrointestinal Tract of Goldfish (Carassius auratus);PLoS ONE;;10;10;;;;;e0141043;;;;;;;;;;;;;;;;;10.1371/journal.pone.0141043;;26506093;;;;;;;
Taillandier A., Domingues C., De Cazanove C., Porquet-Bordes V., Monnot S., Kiffer-Moreira T., Rothenbuhler A., Guggenbuhl P., Cormier C., Baujat G., Debiais F., Capri Y., Cohen-Solal M., Parent P., Chiesa J.  et al.;2015;;Molecular diagnosis of hypophosphatasia and differential diagnosis by targeted Next Generation Sequencing;Molecular Genetics and Metabolism;;116;3;;;;;215-220;;;;;;;;;;;;;;;;;10.1016/j.ymgme.2015.09.010;;26432670;;;;;;;
Tallet C., Sénèque E., Mégnin C., Morisset S., Val-Laillet D., Meunier-Salaün M.-C., Fureix C., Hausberger M.;2015;;Assessing walking posture with geometric morphometrics: effects of rearing environment in pigs;Applied Animal Behaviour Science;;174;;;;;;32-41;;;;;;;;;;;;;;;;;10.1016/j.applanim.2015.10.008;;;;;;;;;
Tamanai-Shacoori Z., Dupont A., Auffret M., Peton V., Barloy-Hubler F., Ehrmann E., Ropert M., Bonnaure-Mallet M., Jolivet-Gougeon A.;2015;;Genetic determinants associated with cfxA-positive clinical Capnocytophaga isolates;International Journal of Antimicrobial Agents;;46;3;;;;;356-358;;;;;;;;;;;;;;;;;10.1016/j.ijantimicag.2015.05.006;;26159866;;;;;;;
Tasseel-Ponche S., Yelnik A. P., Bonan I. V.;2015;;Motor strategies of postural control after hemispheric stroke [Stratégies motrices du contrôle postural après AVC hémisphérique];Neurophysiologie Clinique/Clinical Neurophysiology;;;;;;;;;;;;;;;;;;;;;;;;;10.1016/j.neucli.2015.09.003;;;;;;;;;
Tattevin P., Watt G., Revest M., Arvieux C., Fournier P.-E.;2015;;Update on blood culture-negative endocarditis;Médecine et Maladies Infectieuses;;45;1-2;;;;;1-8;;;;;;;;;;;;;;;;;10.1016/j.medmal.2014.11.003;;25480453;;;;;;;
Thomazeau H., Raoul T., Hervé A., Basselot F., Common H., Ropars M.;2015;;Are spinoglenoid ganglion cysts early markers of glenohumeral arthritis?;Journal of Shoulder and Elbow Surgery;;;;;;;;;;;;;;;;;;;;;;;;;10.1016/j.jse.2015.11.004;;;;;;;;;
Tornvall P., Gerbaud E., Behaghel A., Chopard R., Collste O., Laraudogoitia E., Leurent G., Meneveau N., Montaudon M., Perez-David E., Sörensson P., Agewall S.;2015;;Myocarditis or “true” infarction by cardiac magnetic resonance in patients with a clinical diagnosis of myocardial infarction without obstructive coronary disease: A meta-analysis of individual patient data;Atherosclerosis;;241;1;;;;;87-91;;;;;;;;;;;;;;;;;10.1016/j.atherosclerosis.2015.04.816;;25967935;;;;;;;
Tourbah A., Lebrun-Frenay C., Edan G., Clanet M., Papex C., Vukusic S., De Sesze J., Debouverie M., Gout O., Clavelou P., Defer G., Laplaud D., Moreau T., Labauge P., Brochet B.  et al.;2015;;MD1003 (high doses of biotin) in progressive multiple sclerosis: subgroup analyses of the MS-SPI trial;Multiple Sclerosis;;21;11;;;;;785;;;;;;;;;;;;;;;;;;;;;;;;;;
Trinchet J.-C., Bourcier V., Chaffaut C., Ait Ahmed M., Allam S., Marcellin P., Guyader D., Pol S., Larrey D., De Lédinghen V., Ouzan D., Zoulim F., Roulot D., Tran A., Bronowicki J.-P.  et al.;2015;;Complications and competing risks of death in compensated viral cirrhosis (ANRS CO12 CirVir prospective cohort);Hepatology;;62;3;;;;;737-750;;;;;;;;;;;;;;;;;10.1002/hep.27743;;25678021;;;;;;;
Uguen T., Jezequel C., Ropert M., Houssel-Debry P., Latournerie M., Lainé F., Deugnier Y., Vigneau C., Boudjema K., Guyader D., Bardou-Jacquet E.;2015;;Pretransplant renal function according to CKD-EPI cystatin C equation is a prognostic factor of death after liver transplantation;Liver International;;;;;;;;in press;;;;;;;;;;;;;;;;;10.1111/liv.12989;;26502295;;;;;;;
Victoni T., Gicquel T., Bodin A., Daude M., Tenor H., Valença S., Devillier P., Porto L. C., Lagente V., Boichot E.;2015;;Roflumilast n-oxide associated with PGE2 prevents the neutrophil elastase-induced production of chemokines by epithelial cells;International Immunopharmacology;;30;;;;;;1-8;;;;;;;;;;;;;;;;;10.1016/j.intimp.2015.11.019;;26610096;;;;;;;
Viel J.-F., Warembourg C., Le Maner-Idrissi G., Lacroix A., Limon G., Rouget F., Monfort C., Durand G., Cordier S., Chevrier C.;2015;;Pyrethroid insecticide exposure and cognitive developmental disabilities in children: The PELAGIE mother–child cohort;Environment International;;82;;;;;;69-75;;;;;;;;;;;;;;;;;10.1016/j.envint.2015.05.009;;26057254;;;;;;;
Wallenhorst T., Brochard C., Bretagne J.-F., Bouguen G., Siproudhis L.;2015;;Crohn's disease: is there any link between anal and luminal phenotypes?;International Journal of Colorectal Disease;;;;;;;;1-5;;;;;;;;;;;;;;;;;10.1007/s00384-015-2390-8;;26410258;;;;;;;
Wallenhorst T., Bouguen G., Brochard C., Cunin D., Desfourneaux V., Ropert A., Bretagne J.-F., Siproudhis L.;2015;;Long-term impact of full-thickness rectal prolapse treatment on fecal incontinence.;Surgery;;158;1;;;;;104-111;;;;;;;;;;;;;;;;;10.1016/j.surg.2015.03.005;;25869649;;;;;;;
Warembourg C., Debost-Legrand A., Bonvallot N., Massart C., Garlantézec R., Monfort C., Gaudreau E., Chevrier C., Cordier S.;2015;;Exposure of pregnant women to persistent organic pollutants and cord sex hormone levels;Human Reproduction;;31;1;;;;;190-198;;;;;;;;;;;;;;;;;10.1093/humrep/dev260;;26493407;;;;;;;
Weis F., Giudice E., Churcher M., Jin L., Hilcenko C., Wong C. C., Traynor D., Kay R. R., Warren A. J.;2015;;Mechanism of eIF6 release from the nascent 60S ribosomal subunit;Nature Structural and Molecular Biology;;;;;;;;in press;;;;;;;;;;;;;;;;;10.1038/nsmb.3112;;26479198;;;;;;;
Wils P., Bouhnik Y., Michetti P., Flourie B., Brixi H., Bourrier A., Allez M., Duclos B., Grimaud J.-C., Buisson A., Amiot A., Fumery M., Roblin X., Peyrin-Biroulet L., Filippi J.  et al.;2015;;Subcutaneous Ustekinumab Provides Clinical Benefit for Two-Thirds of Patients With Crohn’s Disease Refractory to Anti-Tumor Necrosis Factor Agents;Clinical Gastroenterology and Hepatology;;;;;;;;;;;;;;;;;;;;;;;;;10.1016/j.cgh.2015.09.018;;26432476;;;;;;;
Winkler T. W., Justice A. E., Graff M., Barata L., Feitosa M. F., Chu S., Czajkowski J., Esko T., Fall T., Kilpeläinen T. O., Lu Y., Mägi R., Mihailov E., Pers T. H., Rüeger S.  et al.;2015;;The Influence of Age and Sex on Genetic Associations with Adult Body Size and Shape: A Large-Scale Genome-Wide Interaction Study.;PLoS Genetics;;11;10;;;;;e1005378;;;;;;;;;;;;;;;;;10.1371/journal.pgen.1005378;;26426971;;;;;;;
Xiang W., Yang C., Bellanger J.-J., Shu H., Le Bouquin Jeannès R.;2015;;Inferring effective connectivity in epilepsy using dynamic causal modeling;IRBM;;;;;;;;;;;;;;;;;;;;;;;;;10.1016/j.irbm.2015.09.001;;;;;;;;;
Zeng X. Z., Lavoué V., Lau S., Press J. Z., Abitbol J., Gotlieb R., How J., Wang Y., Gotlieb W. H.;2015;;Outcome of Robotic Surgery for Endometrial Cancer as a Function of Patient Age:;International Journal of Gynecological Cancer;;25;4;;;;;637-644;;;;;;;;;;;;;;;;;10.1097/IGC.0000000000000411;;25723778;;;;;;;
Zhang J., Chen Y., Hu Y., Luo L., Shu H., Li B., Liu J., Coatrieux J.-L.;2015;;Gamma regularization based reconstruction for low dose CT;Magnetic Resonance Materials in Physics, Biology and Medicine;;;;;;;;;;;;;;;;;;;;;;;;;10.1088/0031-9155/60/17/6901;;26305538;;;;;;;
Zwaenepoel K., Merkle D., Cabillic F., Berg E., Belaud-Rotureau M.-A., Grazioli V., Herelle O., Hummel M., Le Calve M., Lenze D., Mende S., Pauwels P., Quilichini B., Repetti E.;2015;;Automation of ALK gene rearrangement testing with fluorescence in situ hybridization (FISH): A feasibility study;Experimental and Molecular Pathology;;98;1;;;;;113-118;;;;;;;;;;;;;;;;;10.1016/j.yexmp.2015.01.005;;25576649;;;;;;;

Auteurs;Année;Année de soutenance;Titre;Titre journal;Année;Volume;Issue;Editeur scientifique;Titre ouvrage;Titre du volume;Editeur revue;Volume, Issue, Pages;ISBN;Titre conférence;Commentaire;Date congrès;Ville;Pays;Patent n°;Date de publication;Type de rapport;N°;Organisme de délivrance;Pages;Date de publication;Directeur de thèse;Université de soutenance;Année de soutenance;Organisme de délivrance;DOI;NNT;Pubmed;Référence;ArXiv;Description;Voir aussi;Réf. HAL;Rang HCERES;Rang CNRS
Allain J.-S., Bernard M., Icard N., Gatey C., Molina J.-M., Tas P., Leyer C., Fillatre P., Tattevin P., Houot R.;2016;;Des lésions osseuses diffuses [Disseminated bone lesions];Revue de Médecine Interne;;;;;;;;In Press;;;;;;;;;;;;;;;;;10.1016/j.revmed.2015.11.004;;26725943;;;;;;;
Cancel A., Naudet F., Rousseau P. F., Millet B., Drapier D.;2016;;L’impulsivité : quelles conséquences sur l’adhésion aux soins ? Présentation d’une étude réalisée en addictologie [Impulsivity: What are the consequences on compliance to rehabilitation?];Encéphale;;;;;;;;In press;;;;;;;;;;;;;;;;;10.1016/j.encep.2015.12.009;;26796565;;;;;;;
Chales G., Richette P.;2016;;Obésité, hyperuricémie et goutte;Revue du Rhumatisme monographies;;;;;;;;In press;;;;;;;;;;;;;;;;;10.1016/j.monrhu.2015.11.002;;;;;;;;;
De Kerdaniel O., Body N., Davoine E., Foucher F., Henno S., Tavenard A., Laviolle B., Rozel C., Leblanc M., Lavoue V., Leveque J.;2016;;Application des recommandations dans la prise en charge du cancer de l’endomètre en pratique clinique. Étude rétrospective bretonne;Journal de Gynécologie Obstétrique et Biologie de la Reproduction;;;;;;;;In press;;;;;;;;;;;;;;;;;10.1016/j.jgyn.2015.12.009;;26780842;;;;;;;
Fourrier A., Ricordel C., Lespagnol A., Llamas Gutierrez F., Lederlin M., Mosser J., Lena H., Desrues B.;2016;;Analyse des différentes méthodes diagnostiques dans le cancer bronchique non à petites cellules métastatiques et de leur rendement dans l’étude histologique et en biologie moléculaire. Recherche de facteurs prédictifs d’échec. Étude rétrospective, monocentrique, portant sur les patients de 2012 et 2013;Revue des Maladies Respiratoires;;33, Supplement;;;;;;A111;;;;;;;;;;;;;;;;;10.1016/j.rmr.2015.10.177;;;;;;;;;
Ricordel C., Lespagnol A., Kerjouan M., Fievet A., De Tayrac M., Aliouat A., Hamdi H., Mosser J., Lena H.;2016;;Mutation du gène DDR2 dans les carcinomes épidermoïdes bronchiques primitifs : analyse d’une cohorte rétrospective monocentrique;Revue des Maladies Respiratoires;;33, Supplement;;;;;;A47;;;;;;;;;;;;;;;;;10.1016/j.rmr.2015.10.678;;;;;;;;;
Andoyo R., Guyomarc'h F., Burel A., Famelart M.-H.;2015;;Spatial arrangement of casein micelles and whey protein aggregate in acid gels: Insight on mechanisms;Food Hydrocolloids;;51;;;;;;118-128;;;;;;;;;;;;;;;;;10.1016/j.foodhyd.2015.04.031;;;;;;;;;
Andueza Urra J. D., Mourot B.-I., Ait-Kaddour A., Prache S., Mourot J.;2015;;Utilisation de la spectroscopie dans le proche infrarouge et de la spectroscopie de fluorescence pour estimer la qualité et la traçabilité de la viande;INRA Productions Animales;;28;2;;;;;197-208;;;;;;;;;;;;;;;;;;;;;;;;;;
Angulo L., Guyader-Joly C., Auclair S., Hennequet-Antier C., Papillier P., Boussaha M., Fritz S., Hugot K., Moreews F., Ponsart C., Humblot P., Dalbies Tran R.;2015;;An integrated approach to bovine oocyte quality: from phenotype to genes;Reproduction, Fertility and Development;;;;;;;;np;;;;;;;;;;;;;;;;;10.1071/RD14353;;25689671;;;;;;;
Atigui M., Marnet P.-G., Barmat A., Khorchani T., Hammadi M.;2015;;Effects of vacuum level and pulsation rate on milk ejection and milk flow traits in Tunisian dairy camels (Camelus dromedarius);Tropical Animal Health and Production;;47;1;;;;;201-206;;;;;;;;;;;;;;;;;10.1007/s11250-014-0708-0;;25348647;;;;;;;
